Rank,Term name,P-value,Z-score,Combined score,Overlapping genes,Adjusted p-value,Old p-value,Old adjusted p-value,gene count
971,Antigen Processing And Presentation Of Exogenous Peptide Antigen (GO:0002478),0.33586688298822287,2.588017174082748,2.8236312387344022,['LGMN'],0.6236560468390187,0,0,1
972,Associative Learning (GO:0008306),0.33586688298822287,2.588017174082748,2.8236312387344022,['LGMN'],0.6236560468390187,0,0,1
973,Regulation Of Neutrophil Chemotaxis (GO:0090022),0.33586688298822287,2.588017174082748,2.8236312387344022,['JAM3'],0.6236560468390187,0,0,1
974,Regulation Of Platelet Aggregation (GO:0090330),0.33586688298822287,2.588017174082748,2.8236312387344022,['CD9'],0.6236560468390187,0,0,1
975,Carbohydrate Derivative Catabolic Process (GO:1901136),0.33586688298822287,2.588017174082748,2.8236312387344022,['OGA'],0.6236560468390187,0,0,1
976,Regulation Of Reactive Oxygen Species Biosynthetic Process (GO:1903426),0.33586688298822287,2.588017174082748,2.8236312387344022,['RAB27A'],0.6236560468390187,0,0,1
977,Regulation Of Vacuole Organization (GO:0044088),0.33586688298822287,2.588017174082748,2.8236312387344022,['C9ORF72'],0.6236560468390187,0,0,1
978,Response To ATP (GO:0033198),0.33586688298822287,2.588017174082748,2.8236312387344022,['TAF1'],0.6236560468390187,0,0,1
979,Endoplasmic Reticulum To Cytosol Transport (GO:1903513),0.33586688298822287,2.588017174082748,2.8236312387344022,['SEL1L'],0.6236560468390187,0,0,1
980,Eye Morphogenesis (GO:0048592),0.33586688298822287,2.588017174082748,2.8236312387344022,['COL5A2'],0.6236560468390187,0,0,1
981,Glucose 6-Phosphate Metabolic Process (GO:0051156),0.33586688298822287,2.588017174082748,2.8236312387344022,['SHPK'],0.6236560468390187,0,0,1
982,Hippo Signaling (GO:0035329),0.33586688298822287,2.588017174082748,2.8236312387344022,['AMOTL1'],0.6236560468390187,0,0,1
983,Late Endosome To Lysosome Transport (GO:1902774),0.33586688298822287,2.588017174082748,2.8236312387344022,['C9ORF72'],0.6236560468390187,0,0,1
984,Mitotic Sister Chromatid Cohesion (GO:0007064),0.33586688298822287,2.588017174082748,2.8236312387344022,['DSCC1'],0.6236560468390187,0,0,1
985,Negative Regulation Of Response To Wounding (GO:1903035),0.33586688298822287,2.588017174082748,2.8236312387344022,['IL33'],0.6236560468390187,0,0,1
986,Neuron Maturation (GO:0042551),0.33586688298822287,2.588017174082748,2.8236312387344022,['LGI4'],0.6236560468390187,0,0,1
987,Positive Regulation Of Rho Protein Signal Transduction (GO:0035025),0.33586688298822287,2.588017174082748,2.8236312387344022,['PRAG1'],0.6236560468390187,0,0,1
988,Positive Regulation Of Phospholipase C Activity (GO:0010863),0.33586688298822287,2.588017174082748,2.8236312387344022,['ARHGAP6'],0.6236560468390187,0,0,1
989,Positive Regulation Of Smoothened Signaling Pathway (GO:0045880),0.33586688298822287,2.588017174082748,2.8236312387344022,['TUBD1'],0.6236560468390187,0,0,1
990,Positive Regulation Of Viral Life Cycle (GO:1903902),0.33586688298822287,2.588017174082748,2.8236312387344022,['HMGB1'],0.6236560468390187,0,0,1
991,Protein Localization To Microtubule Organizing Center (GO:1905508),0.33586688298822287,2.588017174082748,2.8236312387344022,['CEP83'],0.6236560468390187,0,0,1
992,Protein Peptidyl-Prolyl Isomerization (GO:0000413),0.33586688298822287,2.588017174082748,2.8236312387344022,['PPIH'],0.6236560468390187,0,0,1
993,Regulation Of I-kappaB kinase/NF-kappaB Signaling (GO:0043122),0.34141228688747777,1.273655051756816,1.3687518433326482,"['BST2', 'TRAF3', 'DHX36', 'TRIM25', 'ATP2C1', 'TMEM106A']",0.6326343127498131,0,0,6
994,Positive Regulation Of Nucleic Acid-Templated Transcription (GO:1903508),0.3420198835935308,1.1610655339468898,1.2456914260438199,"['RNF20', 'KDM5A', 'SF3B3', 'SHC1', 'DYRK1A', 'HMGA2', 'NFATC2', 'RGMB', 'KLF4', 'FUBP3', 'ATXN7', 'ZMIZ1', 'EP400']",0.6326343127498131,0,0,13
995,Mitotic DNA Damage Checkpoint Signaling (GO:0044773),0.34233463522734503,1.686142083466072,1.8074879199948688,"['RINT1', 'PRKDC']",0.6326343127498131,0,0,2
996,Negative Regulation Of Amide Metabolic Process (GO:0034249),0.34294256796569716,1.4702628452628452,1.5734639556413874,"['DHX36', 'EIF2AK3', 'PATL2']",0.6326343127498131,0,0,3
997,Double-Strand Break Repair (GO:0006302),0.3460338900435401,1.3052983027942286,1.3852067860687984,"['SETX', 'PRKDC', 'TDP1', 'NSMCE1', 'HMGB1']",0.6326343127498131,0,0,5
998,Axon Development (GO:0061564),0.35033254762742605,1.4505494505494505,1.5214413408333356,"['SEMA5A', 'AFG3L2', 'NTNG2']",0.6326343127498131,0,0,3
999,Protein Phosphorylation (GO:0006468),0.3520341539283058,1.1596344021576266,1.2106897186194614,"['PRAG1', 'PRKDC', 'EIF2AK3', 'DYRK1A', 'TESK2', 'TNNI3K', 'TNIK', 'SGK2', 'CLK3', 'PDK1', 'CSNK1G1', 'TAF1']",0.6326343127498131,0,0,12
1000,Regulation Of Macromolecule Biosynthetic Process (GO:0010556),0.35216324156804624,1.6476961394769614,1.7196353049848463,"['RABL3', 'ELP2']",0.6326343127498131,0,0,2
1001,Regulation Of Type I Interferon Production (GO:0032479),0.35216324156804624,1.6476961394769614,1.7196353049848463,"['TRAF3', 'TRIM56']",0.6326343127498131,0,0,2
1002,Transcription Preinitiation Complex Assembly (GO:0070897),0.35216324156804624,1.6476961394769614,1.7196353049848463,"['MED6', 'TAF1']",0.6326343127498131,0,0,2
1003,Positive Regulation Of Endocytosis (GO:0045807),0.35216324156804624,1.6476961394769614,1.7196353049848463,"['RAB27A', 'PLA2G5']",0.6326343127498131,0,0,2
1004,B Cell Receptor Signaling Pathway (GO:0050853),0.3537531716244883,2.4153005464480874,2.5098737269898375,['NFATC2'],0.6326343127498131,0,0,1
1005,Regulation Of Chromosome Segregation (GO:0051983),0.3537531716244883,2.4153005464480874,2.5098737269898375,['PUM1'],0.6326343127498131,0,0,1
1006,DNA Replication Initiation (GO:0006270),0.3537531716244883,2.4153005464480874,2.5098737269898375,['ORC3'],0.6326343127498131,0,0,1
1007,Regulation Of Fatty Acid Oxidation (GO:0046320),0.3537531716244883,2.4153005464480874,2.5098737269898375,['NR4A3'],0.6326343127498131,0,0,1
1008,Regulation Of Interferon-Alpha Production (GO:0032647),0.3537531716244883,2.4153005464480874,2.5098737269898375,['DHX36'],0.6326343127498131,0,0,1
1009,Apoptotic Cell Clearance (GO:0043277),0.3537531716244883,2.4153005464480874,2.5098737269898375,['HMGB1'],0.6326343127498131,0,0,1
1010,Carbohydrate Biosynthetic Process (GO:0016051),0.3537531716244883,2.4153005464480874,2.5098737269898375,['ST3GAL3'],0.6326343127498131,0,0,1
1011,Regulation Of Protein Deacetylation (GO:0090311),0.3537531716244883,2.4153005464480874,2.5098737269898375,['DYRK1A'],0.6326343127498131,0,0,1
1012,Cardiac Muscle Tissue Morphogenesis (GO:0055008),0.3537531716244883,2.4153005464480874,2.5098737269898375,['MYL3'],0.6326343127498131,0,0,1
1013,Cell Projection Organization (GO:0030030),0.3537531716244883,2.4153005464480874,2.5098737269898375,['PARVB'],0.6326343127498131,0,0,1
1014,Cellular Response To Catecholamine Stimulus (GO:0071870),0.3537531716244883,2.4153005464480874,2.5098737269898375,['NR4A3'],0.6326343127498131,0,0,1
1015,Cellular Response To Gamma Radiation (GO:0071480),0.3537531716244883,2.4153005464480874,2.5098737269898375,['HSF1'],0.6326343127498131,0,0,1
1016,Cytosolic Pattern Recognition Receptor Signaling Pathway (GO:0002753),0.3537531716244883,2.4153005464480874,2.5098737269898375,['TRIM25'],0.6326343127498131,0,0,1
1017,Dicarboxylic Acid Transport (GO:0006835),0.3537531716244883,2.4153005464480874,2.5098737269898375,['SLC13A3'],0.6326343127498131,0,0,1
1018,Toll-Like Receptor Signaling Pathway (GO:0002224),0.3537531716244883,2.4153005464480874,2.5098737269898375,['TRAF3'],0.6326343127498131,0,0,1
1019,Glutamate Metabolic Process (GO:0006536),0.3537531716244883,2.4153005464480874,2.5098737269898375,['GLUD1'],0.6326343127498131,0,0,1
1020,Glycerophospholipid Catabolic Process (GO:0046475),0.3537531716244883,2.4153005464480874,2.5098737269898375,['PLA2G5'],0.6326343127498131,0,0,1
1021,Glycosphingolipid Biosynthetic Process (GO:0006688),0.3537531716244883,2.4153005464480874,2.5098737269898375,['ST8SIA1'],0.6326343127498131,0,0,1
1022,Mitochondrial Fusion (GO:0008053),0.3537531716244883,2.4153005464480874,2.5098737269898375,['MIGA1'],0.6326343127498131,0,0,1
1023,Negative Regulation Of Protein Localization To Cell Periphery (GO:1904376),0.3537531716244883,2.4153005464480874,2.5098737269898375,['GBP1'],0.6326343127498131,0,0,1
1024,Polyol Metabolic Process (GO:0019751),0.3537531716244883,2.4153005464480874,2.5098737269898375,['IPPK'],0.6326343127498131,0,0,1
1025,Positive Regulation Of Dendrite Morphogenesis (GO:0050775),0.3537531716244883,2.4153005464480874,2.5098737269898375,['DHX36'],0.6326343127498131,0,0,1
1026,Positive Regulation Of Nitric Oxide Biosynthetic Process (GO:0045429),0.3537531716244883,2.4153005464480874,2.5098737269898375,['KLF4'],0.6326343127498131,0,0,1
1027,Postsynaptic Membrane Organization (GO:0001941),0.3537531716244883,2.4153005464480874,2.5098737269898375,['GPHN'],0.6326343127498131,0,0,1
1028,Potassium Ion Homeostasis (GO:0055075),0.3537531716244883,2.4153005464480874,2.5098737269898375,['ATP1B3'],0.6326343127498131,0,0,1
1029,Protein Kinase B Signaling (GO:0043491),0.3537531716244883,2.4153005464480874,2.5098737269898375,['SETX'],0.6326343127498131,0,0,1
1030,Regulation Of DNA Methylation-Dependent Heterochromatin Formation (GO:0090308),0.3537531716244883,2.4153005464480874,2.5098737269898375,['DYRK1A'],0.6326343127498131,0,0,1
1031,Synapse Organization (GO:0050808),0.355702444975642,1.3434343434343434,1.3886553192376094,"['FARP1', 'HMCN2', 'PCDHB10', 'GPHN']",0.6348875035321052,0,0,4
1032,Negative Regulation Of Protein Metabolic Process (GO:0051248),0.355702444975642,1.3434343434343434,1.3886553192376094,"['SF3B3', 'DHX36', 'EIF2AK3', 'PATL2']",0.6348875035321052,0,0,4
1033,Regulation Of Protein Metabolic Process (GO:0051246),0.35771346603750137,1.431354829381145,1.4714656675133966,"['TRAF3', 'ELP2', 'KLF4']",0.6372419772157423,0,0,3
1034,Regulation Of JNK Cascade (GO:0046328),0.35771346603750137,1.431354829381145,1.4714656675133966,"['TRAF3', 'TNIK', 'HMGB1']",0.6372419772157423,0,0,3
1035,Regulation Of Focal Adhesion Assembly (GO:0051893),0.3619405377671935,1.610958904109589,1.6371778095468248,"['ARHGAP6', 'FERMT2']",0.639814698240427,0,0,2
1036,Regulation Of Telomere Maintenance Via Telomerase (GO:0032210),0.3619405377671935,1.610958904109589,1.6371778095468248,"['PKIB', 'TERF1']",0.639814698240427,0,0,2
1037,Cellular Response To Light Stimulus (GO:0071482),0.3619405377671935,1.610958904109589,1.6371778095468248,"['DHX36', 'TAF1']",0.639814698240427,0,0,2
1038,Response To Metal Ion (GO:0010038),0.3619405377671935,1.610958904109589,1.6371778095468248,"['GPHN', 'SEC31A']",0.639814698240427,0,0,2
1039,Glycoprotein Metabolic Process (GO:0009100),0.3619405377671935,1.610958904109589,1.6371778095468248,"['ST8SIA1', 'OGA']",0.639814698240427,0,0,2
1040,Positive Regulation Of Cell Cycle (GO:0045787),0.3619405377671935,1.610958904109589,1.6371778095468248,"['HSF1', 'LGMN']",0.639814698240427,0,0,2
1041,Transmembrane Receptor Protein Serine/Threonine Kinase Signaling Pathway (GO:0007178),0.36508286450200145,1.4126587698016269,1.4234386631128473,"['ZMIZ1', 'RGMB', 'FERMT2']",0.639814698240427,0,0,3
1042,Intrinsic Apoptotic Signaling Pathway (GO:0097193),0.36508286450200145,1.4126587698016269,1.4234386631128473,"['PPP1R13B', 'PRKDC', 'PDK1']",0.639814698240427,0,0,3
1043,rRNA Metabolic Process (GO:0016072),0.36508286450200145,1.4126587698016269,1.4234386631128473,"['EXOSC7', 'EXOSC9', 'UTP20']",0.639814698240427,0,0,3
1044,Regulation Of Epidermal Growth Factor-Activated Receptor Activity (GO:0007176),0.3711590270200332,2.2641734972677594,2.244078196621118,['SHC1'],0.639814698240427,0,0,1
1045,N-glycan Processing (GO:0006491),0.3711590270200332,2.2641734972677594,2.244078196621118,['ST8SIA1'],0.639814698240427,0,0,1
1046,RNA Destabilization (GO:0050779),0.3711590270200332,2.2641734972677594,2.244078196621118,['PUM1'],0.639814698240427,0,0,1
1047,Blood Vessel Endothelial Cell Migration (GO:0043534),0.3711590270200332,2.2641734972677594,2.244078196621118,['NR4A1'],0.639814698240427,0,0,1
1048,Cellular Response To Unfolded Protein (GO:0034620),0.3711590270200332,2.2641734972677594,2.244078196621118,['HSF1'],0.639814698240427,0,0,1
1049,Response To Copper Ion (GO:0046688),0.3711590270200332,2.2641734972677594,2.244078196621118,['HSF1'],0.639814698240427,0,0,1
1050,"Retrograde Protein Transport, ER To Cytosol (GO:0030970)",0.3711590270200332,2.2641734972677594,2.244078196621118,['SEL1L'],0.639814698240427,0,0,1
1051,Establishment Of Vesicle Localization (GO:0051650),0.3711590270200332,2.2641734972677594,2.244078196621118,['RAB27A'],0.639814698240427,0,0,1
1052,Female Gamete Generation (GO:0007292),0.3711590270200332,2.2641734972677594,2.244078196621118,['PIWIL2'],0.639814698240427,0,0,1
1053,Gliogenesis (GO:0042063),0.3711590270200332,2.2641734972677594,2.244078196621118,['CD9'],0.639814698240427,0,0,1
1054,Type I Interferon-Mediated Signaling Pathway (GO:0060337),0.3711590270200332,2.2641734972677594,2.244078196621118,['TRAF3'],0.639814698240427,0,0,1
1055,"mRNA Cis Splicing, Via Spliceosome (GO:0045292)",0.3711590270200332,2.2641734972677594,2.244078196621118,['CLNS1A'],0.639814698240427,0,0,1
1056,Negative Regulation Of ERBB Signaling Pathway (GO:1901185),0.3711590270200332,2.2641734972677594,2.244078196621118,['LGMN'],0.639814698240427,0,0,1
1057,Negative Regulation Of Axon Extension Involved In Axon Guidance (GO:0048843),0.3711590270200332,2.2641734972677594,2.244078196621118,['SEMA5A'],0.639814698240427,0,0,1
1058,Negative Regulation Of Protein Localization To Plasma Membrane (GO:1903077),0.3711590270200332,2.2641734972677594,2.244078196621118,['GBP1'],0.639814698240427,0,0,1
1059,Positive Regulation Of B Cell Proliferation (GO:0030890),0.3711590270200332,2.2641734972677594,2.244078196621118,['NFATC2'],0.639814698240427,0,0,1
1060,Positive Regulation Of Reproductive Process (GO:2000243),0.3711590270200332,2.2641734972677594,2.244078196621118,['ANKRD31'],0.639814698240427,0,0,1
1061,Positive Regulation Of Response To Wounding (GO:1903036),0.3711590270200332,2.2641734972677594,2.244078196621118,['MYLK'],0.639814698240427,0,0,1
1062,Protein Localization To Centrosome (GO:0071539),0.3711590270200332,2.2641734972677594,2.244078196621118,['CEP83'],0.639814698240427,0,0,1
1063,Receptor Metabolic Process (GO:0043112),0.3711590270200332,2.2641734972677594,2.244078196621118,['LGMN'],0.639814698240427,0,0,1
1064,Regulation Of Bone Resorption (GO:0045124),0.3711590270200332,2.2641734972677594,2.244078196621118,['BGLAP'],0.639814698240427,0,0,1
1065,Transforming Growth Factor Beta Receptor Signaling Pathway (GO:0007179),0.37166217541653473,1.5758189398451459,1.5596982615226787,"['ZMIZ1', 'FERMT2']",0.639814698240427,0,0,2
1066,Nucleocytoplasmic Transport (GO:0006913),0.37166217541653473,1.5758189398451459,1.5596982615226787,"['XPO1', 'BACH2']",0.639814698240427,0,0,2
1067,Positive Regulation Of Cell-Substrate Adhesion (GO:0010811),0.37166217541653473,1.5758189398451459,1.5596982615226787,"['CCDC80', 'FERMT2']",0.639814698240427,0,0,2
1068,Positive Regulation Of Transcription Initiation By RNA Polymerase II (GO:0060261),0.37166217541653473,1.5758189398451459,1.5596982615226787,"['MED6', 'TAF1']",0.639814698240427,0,0,2
1069,Protein K63-linked Ubiquitination (GO:0070534),0.37166217541653473,1.5758189398451459,1.5596982615226787,"['TRAF3', 'TRIM56']",0.639814698240427,0,0,2
1070,Regulation Of Rho Protein Signal Transduction (GO:0035023),0.37166217541653473,1.5758189398451459,1.5596982615226787,"['PRAG1', 'KCTD10']",0.639814698240427,0,0,2
1071,Response To Calcium Ion (GO:0051592),0.3724383578639453,1.3944420963651734,1.3772677809084364,"['CACNA1A', 'SEC31A', 'LGMN']",0.64055224573799,0,0,3
1072,Protein Modification Process (GO:0036211),0.3740722500441454,1.111115107913669,1.092566505957447,"['METAP1D', 'UBA7', 'PRAG1', 'PRKDC', 'ST8SIA1', 'EIF2AK3', 'OGA', 'DYRK1A', 'TESK2', 'PLOD2', 'TNNI3K', 'CLK3', 'TNIK', 'SGK2', 'ST3GAL3', 'PDK1', 'TAF1']",0.6427622057661528,0,0,17
1073,Regulation Of Exocytosis (GO:0017157),0.3813240759214812,1.542174293208977,1.4868189839660004,"['CADPS', 'RAB27A']",0.6469459388960213,0,0,2
1074,RNA Catabolic Process (GO:0006401),0.3813240759214812,1.542174293208977,1.4868189839660004,"['EXOSC7', 'EXOSC9']",0.6469459388960213,0,0,2
1075,Endoplasmic Reticulum Organization (GO:0007029),0.3813240759214812,1.542174293208977,1.4868189839660004,"['EIF2AK3', 'SEC31A']",0.6469459388960213,0,0,2
1076,Visual Perception (GO:0007601),0.3813240759214812,1.542174293208977,1.4868189839660004,"['GPR143', 'ATXN7']",0.6469459388960213,0,0,2
1077,Fc-epsilon Receptor Signaling Pathway (GO:0038095),0.38809731947888354,2.1308261009321763,2.016825087812577,['NR4A3'],0.6469459388960213,0,0,1
1078,L-amino Acid Transport (GO:0015807),0.38809731947888354,2.1308261009321763,2.016825087812577,['SLC47A1'],0.6469459388960213,0,0,1
1079,NAD Metabolic Process (GO:0019674),0.38809731947888354,2.1308261009321763,2.016825087812577,['NADSYN1'],0.6469459388960213,0,0,1
1080,RNA-templated DNA Biosynthetic Process (GO:0006278),0.38809731947888354,2.1308261009321763,2.016825087812577,['TERF1'],0.6469459388960213,0,0,1
1081,Regulation Of Meiotic Cell Cycle (GO:0051445),0.38809731947888354,2.1308261009321763,2.016825087812577,['DUSP1'],0.6469459388960213,0,0,1
1082,Regulation Of Neuroblast Proliferation (GO:1902692),0.38809731947888354,2.1308261009321763,2.016825087812577,['DCT'],0.6469459388960213,0,0,1
1083,Axonemal Dynein Complex Assembly (GO:0070286),0.38809731947888354,2.1308261009321763,2.016825087812577,['DNAH1'],0.6469459388960213,0,0,1
1084,cAMP-mediated Signaling (GO:0019933),0.38809731947888354,2.1308261009321763,2.016825087812577,['PDE7A'],0.6469459388960213,0,0,1
1085,Regulation Of Protein Localization To Cell Periphery (GO:1904375),0.38809731947888354,2.1308261009321763,2.016825087812577,['GBP1'],0.6469459388960213,0,0,1
1086,Cellular Response To Type I Interferon (GO:0071357),0.38809731947888354,2.1308261009321763,2.016825087812577,['TRAF3'],0.6469459388960213,0,0,1
1087,Response To Cadmium Ion (GO:0046686),0.38809731947888354,2.1308261009321763,2.016825087812577,['HSF1'],0.6469459388960213,0,0,1
1088,Telomere Maintenance Via Telomerase (GO:0007004),0.38809731947888354,2.1308261009321763,2.016825087812577,['TERF1'],0.6469459388960213,0,0,1
1089,Heme Biosynthetic Process (GO:0006783),0.38809731947888354,2.1308261009321763,2.016825087812577,['FECH'],0.6469459388960213,0,0,1
1090,Vesicle Cargo Loading (GO:0035459),0.38809731947888354,2.1308261009321763,2.016825087812577,['SEC31A'],0.6469459388960213,0,0,1
1091,Vesicle Docking (GO:0048278),0.38809731947888354,2.1308261009321763,2.016825087812577,['CEP83'],0.6469459388960213,0,0,1
1092,Long-Chain Fatty Acid Transport (GO:0015909),0.38809731947888354,2.1308261009321763,2.016825087812577,['FABP5'],0.6469459388960213,0,0,1
1093,Macrophage Activation (GO:0042116),0.38809731947888354,2.1308261009321763,2.016825087812577,['TMEM106A'],0.6469459388960213,0,0,1
1094,Negative Regulation Of Cell Junction Assembly (GO:1901889),0.38809731947888354,2.1308261009321763,2.016825087812577,['ARHGAP6'],0.6469459388960213,0,0,1
1095,Negative Regulation Of Microtubule Depolymerization (GO:0007026),0.38809731947888354,2.1308261009321763,2.016825087812577,['ATXN7'],0.6469459388960213,0,0,1
1096,Negative Regulation Of Protein Transport (GO:0051224),0.38809731947888354,2.1308261009321763,2.016825087812577,['RSAD2'],0.6469459388960213,0,0,1
1097,Negative Regulation Of Stem Cell Population Maintenance (GO:1902455),0.38809731947888354,2.1308261009321763,2.016825087812577,['SF3B3'],0.6469459388960213,0,0,1
1098,Negative Regulation Of Telomere Maintenance Via Telomerase (GO:0032211),0.38809731947888354,2.1308261009321763,2.016825087812577,['TERF1'],0.6469459388960213,0,0,1
1099,Neuropeptide Signaling Pathway (GO:0007218),0.38809731947888354,2.1308261009321763,2.016825087812577,['GPR37'],0.6469459388960213,0,0,1
1100,Nuclear-Transcribed mRNA poly(A) Tail Shortening (GO:0000289),0.38809731947888354,2.1308261009321763,2.016825087812577,['SAMD4B'],0.6469459388960213,0,0,1
1101,Phosphatidylethanolamine Metabolic Process (GO:0046337),0.38809731947888354,2.1308261009321763,2.016825087812577,['SELENOI'],0.6469459388960213,0,0,1
1102,Positive Regulation Of Axon Extension (GO:0045773),0.38809731947888354,2.1308261009321763,2.016825087812577,['SEMA5A'],0.6469459388960213,0,0,1
1103,"Positive Regulation Of mRNA Splicing, Via Spliceosome (GO:0048026)",0.38809731947888354,2.1308261009321763,2.016825087812577,['CLNS1A'],0.6469459388960213,0,0,1
1104,Positive Regulation Of Protein Autophosphorylation (GO:0031954),0.38809731947888354,2.1308261009321763,2.016825087812577,['GPNMB'],0.6469459388960213,0,0,1
1105,Protein Heterooligomerization (GO:0051291),0.38809731947888354,2.1308261009321763,2.016825087812577,['FARSB'],0.6469459388960213,0,0,1
1106,Sensory Perception Of Light Stimulus (GO:0050953),0.3909224190513407,1.509931506849315,1.4181973627745723,"['GPR143', 'ATXN7']",0.648719906209522,0,0,2
1107,Memory (GO:0007613),0.3909224190513407,1.509931506849315,1.4181973627745723,"['EIF4EBP2', 'LGMN']",0.648719906209522,0,0,2
1108,Monoatomic Cation Homeostasis (GO:0055080),0.3909224190513407,1.509931506849315,1.4181973627745723,"['UNC80', 'SLC39A12']",0.648719906209522,0,0,2
1109,Negative Regulation Of Cellular Response To Growth Factor Stimulus (GO:0090288),0.3909224190513407,1.509931506849315,1.4181973627745723,"['CAPN5', 'UBE2D1']",0.648719906209522,0,0,2
1110,Nucleotide-Excision Repair (GO:0006289),0.3909224190513407,1.509931506849315,1.4181973627745723,"['POLD3', 'SLC30A9']",0.648719906209522,0,0,2
1111,Regulation Of Inflammatory Response (GO:0050727),0.3924543225334428,1.2721473104248224,1.1898840626513785,"['IL33', 'SHPK', 'OTULIN', 'KLF4']",0.6506758434802895,0,0,4
1112,Response To Cytokine (GO:0034097),0.39439865016842474,1.3424908424908424,1.2490441881432544,"['BST2', 'ISG15', 'TRIM56']",0.6527244506830533,0,0,3
1113,Negative Regulation Of Transmembrane Receptor Protein Serine/Threonine Kinase Signaling Pathway (GO:0090101),0.39439865016842474,1.3424908424908424,1.2490441881432544,"['SF3B3', 'CAPN5', 'UBE2D1']",0.6527244506830533,0,0,3
1114,Gene Expression (GO:0010467),0.4004045511609001,1.1516116195781934,1.0540469277805218,"['SETX', 'EXOSC7', 'XPO1', 'FASTKD2', 'EXOSC9', 'MPHOSPH10', 'EIF4EBP2', 'FARSB']",0.6554418820241558,0,0,8
1115,Ribosomal Large Subunit Biogenesis (GO:0042273),0.40045363224386427,1.479004752585966,1.3535219869650914,"['TMA16', 'MDN1']",0.6554418820241558,0,0,2
1116,Regulation Of BMP Signaling Pathway (GO:0030510),0.40045363224386427,1.479004752585966,1.3535219869650914,"['CAPN5', 'UBE2D1']",0.6554418820241558,0,0,2
1117,Regulation Of Actin Filament-Based Process (GO:0032970),0.40045363224386427,1.479004752585966,1.3535219869650914,"['ARHGAP44', 'BST2']",0.6554418820241558,0,0,2
1118,Response To UV (GO:0009411),0.4016761266884995,1.3260184937014206,1.2094736278024025,"['DHX36', 'PRIMPOL', 'TAF1']",0.6554418820241558,0,0,3
1119,Ubiquitin-Dependent Protein Catabolic Process (GO:0006511),0.4032740716764328,1.1267985455051586,1.0232895573623078,"['HERC5', 'RNF20', 'RNF43', 'KCTD10', 'UBE3D', 'TRIM25', 'UBE2D1', 'UBE3B', 'HERC6', 'TAF1']",0.6554418820241558,0,0,10
1120,Regulation Of Chemokine Production (GO:0032642),0.404580575386246,2.012295081967213,1.8209346029919715,['IL33'],0.6554418820241558,0,0,1
1121,Regulation Of Endoplasmic Reticulum Stress-Induced Intrinsic Apoptotic Signaling Pathway (GO:1902235),0.404580575386246,2.012295081967213,1.8209346029919715,['EIF2AK3'],0.6554418820241558,0,0,1
1122,Regulation Of Extracellular Matrix Organization (GO:1903053),0.404580575386246,2.012295081967213,1.8209346029919715,['ZNF469'],0.6554418820241558,0,0,1
1123,Bile Acid Biosynthetic Process (GO:0006699),0.404580575386246,2.012295081967213,1.8209346029919715,['CYP27A1'],0.6554418820241558,0,0,1
1124,Cardiac Muscle Contraction (GO:0060048),0.404580575386246,2.012295081967213,1.8209346029919715,['MYL3'],0.6554418820241558,0,0,1
1125,Regulation Of Telomere Capping (GO:1904353),0.404580575386246,2.012295081967213,1.8209346029919715,['PKIB'],0.6554418820241558,0,0,1
1126,Response To Interferon-Beta (GO:0035456),0.404580575386246,2.012295081967213,1.8209346029919715,['BST2'],0.6554418820241558,0,0,1
1127,Mitochondrial RNA Metabolic Process (GO:0000959),0.404580575386246,2.012295081967213,1.8209346029919715,['FASTKD2'],0.6554418820241558,0,0,1
1128,Negative Regulation Of Cell Cycle Process (GO:0010948),0.404580575386246,2.012295081967213,1.8209346029919715,['TERF1'],0.6554418820241558,0,0,1
1129,Negative Regulation Of Epithelial Cell Apoptotic Process (GO:1904036),0.404580575386246,2.012295081967213,1.8209346029919715,['SEMA5A'],0.6554418820241558,0,0,1
1130,Negative Regulation Of Stress Fiber Assembly (GO:0051497),0.404580575386246,2.012295081967213,1.8209346029919715,['ARHGAP6'],0.6554418820241558,0,0,1
1131,Positive Regulation Of DNA Binding (GO:0043388),0.404580575386246,2.012295081967213,1.8209346029919715,['HMGB1'],0.6554418820241558,0,0,1
1132,Positive Regulation Of Cell-Substrate Junction Organization (GO:0150117),0.404580575386246,2.012295081967213,1.8209346029919715,['FERMT2'],0.6554418820241558,0,0,1
1133,Positive Regulation Of Dendritic Spine Development (GO:0060999),0.404580575386246,2.012295081967213,1.8209346029919715,['DHX36'],0.6554418820241558,0,0,1
1134,Protein Localization To Cell Surface (GO:0034394),0.404580575386246,2.012295081967213,1.8209346029919715,['JAM3'],0.6554418820241558,0,0,1
1135,Purine Nucleotide Biosynthetic Process (GO:0006164),0.404580575386246,2.012295081967213,1.8209346029919715,['NADSYN1'],0.6554418820241558,0,0,1
1136,Regulation Of Cardiac Muscle Hypertrophy (GO:0010611),0.404580575386246,2.012295081967213,1.8209346029919715,['NR4A3'],0.6554418820241558,0,0,1
