Rank,Term name,P-value,Z-score,Combined score,Overlapping genes,Adjusted p-value,Old p-value,Old adjusted p-value,gene count
1301,tRNA Modification (GO:0006400),0.49144475415001954,1.2273972602739727,0.8719500690919895,"['TYW3', 'TARBP1']",0.6891264159249203,0,0,2
1302,TOR Signaling (GO:0031929),0.49458475670615887,1.5085382513661203,1.0620663584006496,['EIF4EBP2'],0.6891264159249203,0,0,1
1303,Actin Filament Polymerization (GO:0030041),0.49458475670615887,1.5085382513661203,1.0620663584006496,['ARHGAP6'],0.6891264159249203,0,0,1
1304,Regulation Of Protein Localization To Membrane (GO:1905475),0.49458475670615887,1.5085382513661203,1.0620663584006496,['GBP1'],0.6891264159249203,0,0,1
1305,Cellular Response To Hydrogen Peroxide (GO:0070301),0.49458475670615887,1.5085382513661203,1.0620663584006496,['SETX'],0.6891264159249203,0,0,1
1306,Clathrin-Dependent Endocytosis (GO:0072583),0.49458475670615887,1.5085382513661203,1.0620663584006496,['STON2'],0.6891264159249203,0,0,1
1307,Dendritic Spine Organization (GO:0097061),0.49458475670615887,1.5085382513661203,1.0620663584006496,['LGMN'],0.6891264159249203,0,0,1
1308,Retinoid Metabolic Process (GO:0001523),0.49458475670615887,1.5085382513661203,1.0620663584006496,['KDM5A'],0.6891264159249203,0,0,1
1309,Signal Transduction By P53 Class Mediator (GO:0072331),0.49458475670615887,1.5085382513661203,1.0620663584006496,['PPP1R13B'],0.6891264159249203,0,0,1
1310,Spermatid Development (GO:0007286),0.49458475670615887,1.5085382513661203,1.0620663584006496,['JAM2'],0.6891264159249203,0,0,1
1311,Establishment Of Protein Localization To Vacuole (GO:0072666),0.49458475670615887,1.5085382513661203,1.0620663584006496,['VPS13C'],0.6891264159249203,0,0,1
1312,Zymogen Activation (GO:0031638),0.49458475670615887,1.5085382513661203,1.0620663584006496,['LGMN'],0.6891264159249203,0,0,1
1313,Intracellular pH Reduction (GO:0051452),0.49458475670615887,1.5085382513661203,1.0620663584006496,['GPR89B'],0.6891264159249203,0,0,1
1314,Mitotic G2 DNA Damage Checkpoint Signaling (GO:0007095),0.49458475670615887,1.5085382513661203,1.0620663584006496,['RINT1'],0.6891264159249203,0,0,1
1315,Negative Regulation Of DNA Biosynthetic Process (GO:2000279),0.49458475670615887,1.5085382513661203,1.0620663584006496,['TERF1'],0.6891264159249203,0,0,1
1316,Negative Regulation Of Cell-Cell Adhesion (GO:0022408),0.49458475670615887,1.5085382513661203,1.0620663584006496,['KLF4'],0.6891264159249203,0,0,1
1317,Negative Regulation Of Plasma Membrane Bounded Cell Projection Assembly (GO:0120033),0.49458475670615887,1.5085382513661203,1.0620663584006496,['ARHGAP44'],0.6891264159249203,0,0,1
1318,Negative Regulation Of Stress-Activated MAPK Cascade (GO:0032873),0.49458475670615887,1.5085382513661203,1.0620663584006496,['DUSP1'],0.6891264159249203,0,0,1
1319,Positive Regulation Of Bone Mineralization (GO:0030501),0.49458475670615887,1.5085382513661203,1.0620663584006496,['ISG15'],0.6891264159249203,0,0,1
1320,Positive Regulation Of Type II Interferon Production (GO:0032729),0.49458475670615887,1.5085382513661203,1.0620663584006496,['ISG15'],0.6891264159249203,0,0,1
1321,Protein Acetylation (GO:0006473),0.49458475670615887,1.5085382513661203,1.0620663584006496,['DSCC1'],0.6891264159249203,0,0,1
1322,Protein Localization To Golgi Apparatus (GO:0034067),0.49458475670615887,1.5085382513661203,1.0620663584006496,['VPS13C'],0.6891264159249203,0,0,1
1323,Translation (GO:0006412),0.4988307443256958,1.0649340068437347,0.74064928100213,"['PTCD3', 'MRPS27', 'FASTKD2', 'MRPS10', 'EIF4EBP2', 'FARSB']",0.6918881865219679,0,0,6
1324,Regulation Of Endothelial Cell Migration (GO:0010594),0.5000627765102875,1.2068493150684931,0.8363726860348667,"['DNAJA4', 'RIN2']",0.6918881865219679,0,0,2
1325,Negative Regulation Of Protein Serine/Threonine Kinase Activity (GO:0071901),0.5000627765102875,1.2068493150684931,0.8363726860348667,"['PKIB', 'DUSP1']",0.6918881865219679,0,0,2
1326,Negative Regulation Of Supramolecular Fiber Organization (GO:1902904),0.5000627765102875,1.2068493150684931,0.8363726860348667,"['ATXN7', 'DYRK1A']",0.6918881865219679,0,0,2
1327,Negative Regulation Of Transforming Growth Factor Beta Receptor Signaling Pathway (GO:0030512),0.5000627765102875,1.2068493150684931,0.8363726860348667,"['SF3B3', 'CAPN5']",0.6918881865219679,0,0,2
1328,Positive Regulation Of Neurogenesis (GO:0050769),0.5000627765102875,1.2068493150684931,0.8363726860348667,"['CHODL', 'DCT']",0.6918881865219679,0,0,2
1329,Regulation Of Proteasomal Ubiquitin-Dependent Protein Catabolic Process (GO:0032434),0.500164562970879,1.1314388736263736,0.7838813406127021,"['XPO1', 'PIAS1', 'TAF1']",0.6918881865219679,0,0,3
1330,Positive Regulation Of Cellular Biosynthetic Process (GO:0031328),0.5054991977968656,1.0888377969717682,0.7428147567800579,"['PIWIL2', 'PRKDC', 'ASIP', 'KLF4']",0.6918881865219679,0,0,4
1331,Negative Regulation Of Cellular Biosynthetic Process (GO:0031327),0.5068957444018547,1.1196895887617537,0.7607730114514748,"['DHX36', 'EIF2AK3', 'PATL2']",0.6918881865219679,0,0,3
1332,Regulation Of Cellular Senescence (GO:2000772),0.5082064770360913,1.4480874316939891,0.9801632662724336,['HMGA2'],0.6918881865219679,0,0,1
1333,GPI Anchor Biosynthetic Process (GO:0006506),0.5082064770360913,1.4480874316939891,0.9801632662724336,['PGAP2'],0.6918881865219679,0,0,1
1334,RNA Biosynthetic Process (GO:0032774),0.5082064770360913,1.4480874316939891,0.9801632662724336,['SETX'],0.6918881865219679,0,0,1
1335,SMAD Protein Signal Transduction (GO:0060395),0.5082064770360913,1.4480874316939891,0.9801632662724336,['ZMIZ1'],0.6918881865219679,0,0,1
1336,Regulation Of Interleukin-2 Production (GO:0032663),0.5082064770360913,1.4480874316939891,0.9801632662724336,['GBP1'],0.6918881865219679,0,0,1
1337,Regulation Of Long-Term Synaptic Potentiation (GO:1900271),0.5082064770360913,1.4480874316939891,0.9801632662724336,['LGMN'],0.6918881865219679,0,0,1
1338,Regulation Of Neuron Migration (GO:2001222),0.5082064770360913,1.4480874316939891,0.9801632662724336,['NTNG2'],0.6918881865219679,0,0,1
1339,Regulation Of Protein Autophosphorylation (GO:0031952),0.5082064770360913,1.4480874316939891,0.9801632662724336,['GPNMB'],0.6918881865219679,0,0,1
1340,Regulation Of Transcription By RNA Polymerase III (GO:0006359),0.5082064770360913,1.4480874316939891,0.9801632662724336,['DHX36'],0.6918881865219679,0,0,1
1341,Cellular Response To Retinoic Acid (GO:0071300),0.5082064770360913,1.4480874316939891,0.9801632662724336,['SETX'],0.6918881865219679,0,0,1
1342,Cellular Response To Type II Interferon (GO:0071346),0.5082064770360913,1.4480874316939891,0.9801632662724336,['GBP1'],0.6918881865219679,0,0,1
1343,Establishment Of Mitotic Spindle Localization (GO:0040001),0.5082064770360913,1.4480874316939891,0.9801632662724336,['ZW10'],0.6918881865219679,0,0,1
1344,Transcription Elongation By RNA Polymerase II (GO:0006368),0.5082064770360913,1.4480874316939891,0.9801632662724336,['ELP2'],0.6918881865219679,0,0,1
1345,Mesenchymal Cell Migration (GO:0090497),0.5082064770360913,1.4480874316939891,0.9801632662724336,['SEMA5A'],0.6918881865219679,0,0,1
1346,Myofibril Assembly (GO:0030239),0.5082064770360913,1.4480874316939891,0.9801632662724336,['ACTN2'],0.6918881865219679,0,0,1
1347,Positive Regulation Of Notch Signaling Pathway (GO:0045747),0.5082064770360913,1.4480874316939891,0.9801632662724336,['ZMIZ1'],0.6918881865219679,0,0,1
1348,Positive Regulation Of Biomineral Tissue Development (GO:0070169),0.5082064770360913,1.4480874316939891,0.9801632662724336,['ISG15'],0.6918881865219679,0,0,1
1349,Positive Regulation Of Myeloid Cell Differentiation (GO:0045639),0.5082064770360913,1.4480874316939891,0.9801632662724336,['PRKDC'],0.6918881865219679,0,0,1
1350,Positive Regulation Of Reactive Oxygen Species Metabolic Process (GO:2000379),0.5082064770360913,1.4480874316939891,0.9801632662724336,['RAB27A'],0.6918881865219679,0,0,1
1351,Positive Regulation Of Smooth Muscle Cell Proliferation (GO:0048661),0.5082064770360913,1.4480874316939891,0.9801632662724336,['NR4A3'],0.6918881865219679,0,0,1
1352,Regulation Of Endothelial Cell Proliferation (GO:0001936),0.5085866474216855,1.1869750729845048,0.8025372064353831,"['SEMA5A', 'NR4A1']",0.6918881865219679,0,0,2
1353,Regulation Of Protein Secretion (GO:0050708),0.5085866474216855,1.1869750729845048,0.8025372064353831,"['RSAD2', 'EIPR1']",0.6918881865219679,0,0,2
1354,Positive Regulation Of Vasculature Development (GO:1904018),0.5085866474216855,1.1869750729845048,0.8025372064353831,"['SEMA5A', 'HMGA2']",0.6918881865219679,0,0,2
1355,Metal Ion Transport (GO:0030001),0.5135796747010869,1.1081800852209016,0.7384359123443458,"['CACNA1D', 'ATP2B2', 'ATP2C1']",0.6976502660762552,0,0,3
1356,Negative Regulation Of Wnt Signaling Pathway (GO:0030178),0.5135796747010869,1.1081800852209016,0.7384359123443458,"['RNF43', 'KREMEN1', 'LZTS2']",0.6976502660762552,0,0,3
1357,Import Into Nucleus (GO:0051170),0.5170151850415466,1.167741935483871,0.7703395422883763,"['RANBP17', 'BACH2']",0.7000969998782294,0,0,2
1358,Monoatomic Cation Transmembrane Transport (GO:0098655),0.5195399429767825,1.0522131568803803,0.6890013640166763,"['CACNA1A', 'ATP1B3', 'SLC30A1', 'CACNA1D', 'ATP2C1']",0.7000969998782294,0,0,5
1359,Cellular Response To Metal Ion (GO:0071248),0.520215331101482,1.0969030969030968,0.7168398355892831,"['HSF1', 'CACNA1A', 'LGMN']",0.7000969998782294,0,0,3
1360,Regulation Of Cytokine-Mediated Signaling Pathway (GO:0001959),0.5214620433403533,1.3922866750735603,0.9065440163398538,['OTULIN'],0.7000969998782294,0,0,1
1361,RNA Stabilization (GO:0043489),0.5214620433403533,1.3922866750735603,0.9065440163398538,['DHX36'],0.7000969998782294,0,0,1
1362,Acylglycerol Metabolic Process (GO:0006639),0.5214620433403533,1.3922866750735603,0.9065440163398538,['SEL1L'],0.7000969998782294,0,0,1
1363,Regulation Of Mitotic Nuclear Division (GO:0007088),0.5214620433403533,1.3922866750735603,0.9065440163398538,['DUSP1'],0.7000969998782294,0,0,1
1364,Regulation Of Potassium Ion Transmembrane Transport (GO:1901379),0.5214620433403533,1.3922866750735603,0.9065440163398538,['CACNA1D'],0.7000969998782294,0,0,1
1365,Regulation Of Vascular Associated Smooth Muscle Cell Proliferation (GO:1904705),0.5214620433403533,1.3922866750735603,0.9065440163398538,['NR4A3'],0.7000969998782294,0,0,1
1366,Establishment Of Spindle Orientation (GO:0051294),0.5214620433403533,1.3922866750735603,0.9065440163398538,['ZW10'],0.7000969998782294,0,0,1
1367,Import Into Cell (GO:0098657),0.5214620433403533,1.3922866750735603,0.9065440163398538,['SLC47A1'],0.7000969998782294,0,0,1
1368,Negative Regulation Of DNA Metabolic Process (GO:0051053),0.5214620433403533,1.3922866750735603,0.9065440163398538,['TERF1'],0.7000969998782294,0,0,1
1369,Negative Regulation Of Chemotaxis (GO:0050922),0.5214620433403533,1.3922866750735603,0.9065440163398538,['SEMA5A'],0.7000969998782294,0,0,1
1370,Neural Crest Cell Migration (GO:0001755),0.5214620433403533,1.3922866750735603,0.9065440163398538,['SEMA5A'],0.7000969998782294,0,0,1
1371,Positive Regulation Of Substrate Adhesion-Dependent Cell Spreading (GO:1900026),0.5214620433403533,1.3922866750735603,0.9065440163398538,['FERMT2'],0.7000969998782294,0,0,1
1372,Potassium Ion Import Across Plasma Membrane (GO:1990573),0.5214620433403533,1.3922866750735603,0.9065440163398538,['ATP1B3'],0.7000969998782294,0,0,1
1373,Negative Regulation Of Neuron Death (GO:1901215),0.5253473389328857,1.149119373776908,0.7396831275021574,"['GPNMB', 'LGMN']",0.7042866072157026,0,0,2
1374,Negative Regulation Of Phosphorylation (GO:0042326),0.5253473389328857,1.149119373776908,0.7396831275021574,"['PRKDC', 'C9ORF72']",0.7042866072157026,0,0,2
1375,Regulation Of Macromolecule Metabolic Process (GO:0060255),0.533337997601995,1.075019040365575,0.6757568762758032,"['RO60', 'FUBP3', 'TRIM4']",0.7050812768371548,0,0,3
1376,Antigen Receptor-Mediated Signaling Pathway (GO:0050851),0.533582183479046,1.1310787671232876,0.7104782759952444,"['ORC3', 'NFATC2']",0.7050812768371548,0,0,2
1377,Cellular Response To Transforming Growth Factor Beta Stimulus (GO:0071560),0.533582183479046,1.1310787671232876,0.7104782759952444,"['ZMIZ1', 'FERMT2']",0.7050812768371548,0,0,2
1378,Adenylate Cyclase-Inhibiting G Protein-Coupled Receptor Signaling Pathway (GO:0007193),0.5343612716963454,1.3406193078324227,0.8401435039895176,['GPR37'],0.7050812768371548,0,0,1
1379,Calcium-Dependent Cell-Cell Adhesion Via Plasma Membrane Cell Adhesion Molecules (GO:0016339),0.5343612716963454,1.3406193078324227,0.8401435039895176,['PCDHB10'],0.7050812768371548,0,0,1
1380,Regulation Of Protein Tyrosine Kinase Activity (GO:0061097),0.5343612716963454,1.3406193078324227,0.8401435039895176,['SHC1'],0.7050812768371548,0,0,1
1381,Transcription By RNA Polymerase III (GO:0006383),0.5343612716963454,1.3406193078324227,0.8401435039895176,['RO60'],0.7050812768371548,0,0,1
1382,Tumor Necrosis Factor-Mediated Signaling Pathway (GO:0033209),0.5343612716963454,1.3406193078324227,0.8401435039895176,['TRAF3'],0.7050812768371548,0,0,1
1383,Glycosphingolipid Metabolic Process (GO:0006687),0.5343612716963454,1.3406193078324227,0.8401435039895176,['ST8SIA1'],0.7050812768371548,0,0,1
1384,Inositol Lipid-Mediated Signaling (GO:0048017),0.5343612716963454,1.3406193078324227,0.8401435039895176,['GPR143'],0.7050812768371548,0,0,1
1385,mRNA Splice Site Recognition (GO:0006376),0.5343612716963454,1.3406193078324227,0.8401435039895176,['SETX'],0.7050812768371548,0,0,1
1386,Membrane Protein Proteolysis (GO:0033619),0.5343612716963454,1.3406193078324227,0.8401435039895176,['AFG3L2'],0.7050812768371548,0,0,1
1387,miRNA Processing (GO:0035196),0.5343612716963454,1.3406193078324227,0.8401435039895176,['PUM1'],0.7050812768371548,0,0,1
1388,Mitochondrial Membrane Organization (GO:0007006),0.5343612716963454,1.3406193078324227,0.8401435039895176,['CHCHD6'],0.7050812768371548,0,0,1
1389,Negative Regulation Of Axon Extension (GO:0030517),0.5343612716963454,1.3406193078324227,0.8401435039895176,['SEMA5A'],0.7050812768371548,0,0,1
1390,Positive Regulation Of Ras Protein Signal Transduction (GO:0046579),0.5343612716963454,1.3406193078324227,0.8401435039895176,['PRAG1'],0.7050812768371548,0,0,1
1391,Positive Regulation Of Cytokine-Mediated Signaling Pathway (GO:0001961),0.5343612716963454,1.3406193078324227,0.8401435039895176,['TRIM56'],0.7050812768371548,0,0,1
1392,Positive Regulation Of Interleukin-8 Production (GO:0032757),0.5343612716963454,1.3406193078324227,0.8401435039895176,['HMGB1'],0.7050812768371548,0,0,1
1393,Positive Regulation Of miRNA Transcription (GO:1902895),0.5343612716963454,1.3406193078324227,0.8401435039895176,['KLF4'],0.7050812768371548,0,0,1
1394,Positive Regulation Of Ossification (GO:0045778),0.5343612716963454,1.3406193078324227,0.8401435039895176,['ISG15'],0.7050812768371548,0,0,1
1395,Positive Regulation Of Peptide Hormone Secretion (GO:0090277),0.5343612716963454,1.3406193078324227,0.8401435039895176,['GLUD1'],0.7050812768371548,0,0,1
1396,Presynaptic Endocytosis (GO:0140238),0.5343612716963454,1.3406193078324227,0.8401435039895176,['STON2'],0.7050812768371548,0,0,1
1397,Protein-Containing Complex Organization (GO:0043933),0.539823224498881,1.06439883645766,0.6562163106636588,"['ZW10', 'HSF1', 'PPIH']",0.7109492338783656,0,0,3
1398,Ubiquitin-Dependent ERAD Pathway (GO:0030433),0.5417189122403221,1.1135932560590094,0.6826416016268697,"['SEL1L', 'TRIM25']",0.7109492338783656,0,0,2
1399,Positive Regulation Of Cell Motility (GO:2000147),0.5448359575891354,1.033844942935852,0.6278235611374127,"['SEMA5A', 'GPNMB', 'FERMT2', 'MYLK']",0.7109492338783656,0,0,4
1400,Regulation Of Cytosolic Calcium Ion Concentration (GO:0051480),0.5469137157468209,1.2926424668227947,0.7800634907353707,['ATP2B2'],0.7109492338783656,0,0,1
1401,Regulation Of Protein Localization To Cell Surface (GO:2000008),0.5469137157468209,1.2926424668227947,0.7800634907353707,['ACTN2'],0.7109492338783656,0,0,1
1402,Regulation Of Protein Modification By Small Protein Conjugation Or Removal (GO:1903320),0.5469137157468209,1.2926424668227947,0.7800634907353707,['ZMIZ1'],0.7109492338783656,0,0,1
1403,Regulation Of Regulated Secretory Pathway (GO:1903305),0.5469137157468209,1.2926424668227947,0.7800634907353707,['RAB27A'],0.7109492338783656,0,0,1
1404,Regulation Of Tumor Necrosis Factor-Mediated Signaling Pathway (GO:0010803),0.5469137157468209,1.2926424668227947,0.7800634907353707,['OTULIN'],0.7109492338783656,0,0,1
1405,Semaphorin-Plexin Signaling Pathway (GO:0071526),0.5469137157468209,1.2926424668227947,0.7800634907353707,['SEMA5A'],0.7109492338783656,0,0,1
1406,Endothelial Cell Migration (GO:0043542),0.5469137157468209,1.2926424668227947,0.7800634907353707,['NR4A1'],0.7109492338783656,0,0,1
1407,Striated Muscle Contraction (GO:0006941),0.5469137157468209,1.2926424668227947,0.7800634907353707,['MYL3'],0.7109492338783656,0,0,1
1408,Synaptic Vesicle Cycle (GO:0099504),0.5469137157468209,1.2926424668227947,0.7800634907353707,['PCLO'],0.7109492338783656,0,0,1
1409,Lamellipodium Organization (GO:0097581),0.5469137157468209,1.2926424668227947,0.7800634907353707,['PARVB'],0.7109492338783656,0,0,1
1410,Multivesicular Body Organization (GO:0036257),0.5469137157468209,1.2926424668227947,0.7800634907353707,['RAB27A'],0.7109492338783656,0,0,1
1411,Negative Regulation Of Endopeptidase Activity (GO:0010951),0.5469137157468209,1.2926424668227947,0.7800634907353707,['SERPINH1'],0.7109492338783656,0,0,1
1412,Negative Regulation Of Peptidase Activity (GO:0010466),0.5469137157468209,1.2926424668227947,0.7800634907353707,['SERPINH1'],0.7109492338783656,0,0,1
1413,Negative Regulation Of Protein Secretion (GO:0050709),0.5469137157468209,1.2926424668227947,0.7800634907353707,['RSAD2'],0.7109492338783656,0,0,1
1414,Positive Regulation Of Biosynthetic Process (GO:0009891),0.5469137157468209,1.2926424668227947,0.7800634907353707,['RAB27A'],0.7109492338783656,0,0,1
1415,Positive Regulation Of Organelle Organization (GO:0010638),0.5469137157468209,1.2926424668227947,0.7800634907353707,['PLA2G5'],0.7109492338783656,0,0,1
1416,Positive Regulation Of Osteoblast Differentiation (GO:0045669),0.5469137157468209,1.2926424668227947,0.7800634907353707,['FERMT2'],0.7109492338783656,0,0,1
1417,Positive Regulation Of Telomere Maintenance Via Telomerase (GO:0032212),0.5469137157468209,1.2926424668227947,0.7800634907353707,['PKIB'],0.7109492338783656,0,0,1
1418,Adenylate Cyclase-Modulating G Protein-Coupled Receptor Signaling Pathway (GO:0007188),0.5576953584142825,1.0801881005929257,0.6307676517329341,"['GPR37', 'CACNA1D']",0.7197169928911917,0,0,2
1419,Regulation Of Organelle Assembly (GO:1902115),0.5576953584142825,1.0801881005929257,0.6307676517329341,"['INTU', 'C9ORF72']",0.7197169928911917,0,0,2
1420,Regulation Of Dendrite Morphogenesis (GO:0048814),0.5591286736304535,1.2479743734690032,0.7255419087278556,['TNIK'],0.7197169928911917,0,0,1
1421,Regulation Of Erythrocyte Differentiation (GO:0045646),0.5591286736304535,1.2479743734690032,0.7255419087278556,['PRKDC'],0.7197169928911917,0,0,1
1422,Notch Signaling Pathway (GO:0007219),0.5591286736304535,1.2479743734690032,0.7255419087278556,['GMDS'],0.7197169928911917,0,0,1
1423,Regulation Of Intracellular Transport (GO:0032386),0.5591286736304535,1.2479743734690032,0.7255419087278556,['RINT1'],0.7197169928911917,0,0,1
1424,Amino Acid Transmembrane Transport (GO:0003333),0.5591286736304535,1.2479743734690032,0.7255419087278556,['SLC47A1'],0.7197169928911917,0,0,1
1425,Antiviral Innate Immune Response (GO:0140374),0.5591286736304535,1.2479743734690032,0.7255419087278556,['TRIM25'],0.7197169928911917,0,0,1
1426,Regulation Of Neurotransmitter Secretion (GO:0046928),0.5591286736304535,1.2479743734690032,0.7255419087278556,['SLC30A1'],0.7197169928911917,0,0,1
1427,Regulation Of Protein Import Into Nucleus (GO:0042306),0.5591286736304535,1.2479743734690032,0.7255419087278556,['UBR5'],0.7197169928911917,0,0,1
1428,Histone Lysine Methylation (GO:0034968),0.5591286736304535,1.2479743734690032,0.7255419087278556,['MLLT10'],0.7197169928911917,0,0,1
1429,Intrinsic Apoptotic Signaling Pathway By P53 Class Mediator (GO:0072332),0.5591286736304535,1.2479743734690032,0.7255419087278556,['PPP1R13B'],0.7197169928911917,0,0,1
1430,Positive Regulation Of NIK/NF-kappaB Signaling (GO:1901224),0.5591286736304535,1.2479743734690032,0.7255419087278556,['TRIM56'],0.7197169928911917,0,0,1
1431,Positive Regulation Of Insulin Secretion (GO:0032024),0.5591286736304535,1.2479743734690032,0.7255419087278556,['GLUD1'],0.7197169928911917,0,0,1
1432,Cell-Cell Adhesion Via Plasma-Membrane Adhesion Molecules (GO:0098742),0.5652382699957309,1.023921832884097,0.5841555150461718,"['HMCN2', 'ATP2C1', 'PCDHB10']",0.7259328523245527,0,0,3
1433,Negative Regulation Of Protein Modification Process (GO:0031400),0.565534008189866,1.064222401289283,0.6065906425381632,"['PRKDC', 'C9ORF72']",0.7259328523245527,0,0,2
1434,Positive Regulation Of Binding (GO:0051099),0.565534008189866,1.064222401289283,0.6065906425381632,"['HMGB1', 'TAF1']",0.7259328523245527,0,0,2
1435,Positive Regulation Of Protein Modification By Small Protein Conjugation Or Removal (GO:1903322),0.565534008189866,1.064222401289283,0.6065906425381632,"['UBE2D1', 'PIAS1']",0.7259328523245527,0,0,2
1436,B Cell Differentiation (GO:0030183),0.5710151949702088,1.2062841530054644,0.6759286091211215,['RABL3'],0.7268901099758981,0,0,1
1437,O-glycan Processing (GO:0016266),0.5710151949702088,1.2062841530054644,0.6759286091211215,['ST3GAL3'],0.7268901099758981,0,0,1
1438,Regulation Of Interleukin-1 Beta Production (GO:0032651),0.5710151949702088,1.2062841530054644,0.6759286091211215,['TMEM106A'],0.7268901099758981,0,0,1
1439,Regulation Of Nervous System Development (GO:0051960),0.5710151949702088,1.2062841530054644,0.6759286091211215,['LGI4'],0.7268901099758981,0,0,1
1440,Response To Organonitrogen Compound (GO:0010243),0.5710151949702088,1.2062841530054644,0.6759286091211215,['SEL1L'],0.7268901099758981,0,0,1
1441,Signal Release From Synapse (GO:0099643),0.5710151949702088,1.2062841530054644,0.6759286091211215,['PCLO'],0.7268901099758981,0,0,1
1442,Inner Mitochondrial Membrane Organization (GO:0007007),0.5710151949702088,1.2062841530054644,0.6759286091211215,['CHCHD6'],0.7268901099758981,0,0,1
1443,Modulation By Host Of Symbiont Process (GO:0051851),0.5710151949702088,1.2062841530054644,0.6759286091211215,['HMGA2'],0.7268901099758981,0,0,1
1444,Negative Regulation Of Cellular Metabolic Process (GO:0031324),0.5710151949702088,1.2062841530054644,0.6759286091211215,['HMGA2'],0.7268901099758981,0,0,1
1445,Negative Regulation Of Transferase Activity (GO:0051348),0.5710151949702088,1.2062841530054644,0.6759286091211215,['TERF1'],0.7268901099758981,0,0,1
1446,Protein Targeting To Vacuole (GO:0006623),0.5710151949702088,1.2062841530054644,0.6759286091211215,['VPS13C'],0.7268901099758981,0,0,1
1447,Regulation Of T Cell Differentiation (GO:0045580),0.5710151949702088,1.2062841530054644,0.6759286091211215,['ZMIZ1'],0.7268901099758981,0,0,1
1448,Regulation Of Neuron Projection Development (GO:0010975),0.5772318303041801,0.9909053171817804,0.5445136764986171,"['ARHGAP44', 'SETX', 'NTNG2', 'PRAG1']",0.7340056119535389,0,0,4
1449,Positive Regulation Of Response To External Stimulus (GO:0032103),0.5809102317145459,1.0336594911937378,0.5614414975263011,"['IL33', 'TRIM56']",0.7340056119535389,0,0,2
1450,Amino Acid Transport (GO:0006865),0.582582087229139,1.1672836241847346,0.6306660443917301,['SLC7A2'],0.7340056119535389,0,0,1
1451,Regulation Of Monoatomic Cation Transmembrane Transport (GO:1904062),0.582582087229139,1.1672836241847346,0.6306660443917301,['CACNA1D'],0.7340056119535389,0,0,1
1452,Carboxylic Acid Transmembrane Transport (GO:1905039),0.582582087229139,1.1672836241847346,0.6306660443917301,['SLC13A3'],0.7340056119535389,0,0,1
1453,Response To Organic Cyclic Compound (GO:0014070),0.582582087229139,1.1672836241847346,0.6306660443917301,['BGLAP'],0.7340056119535389,0,0,1
1454,Epithelial To Mesenchymal Transition (GO:0001837),0.582582087229139,1.1672836241847346,0.6306660443917301,['HMGA2'],0.7340056119535389,0,0,1
1455,Establishment Of Protein Localization To Extracellular Region (GO:0035592),0.582582087229139,1.1672836241847346,0.6306660443917301,['SEL1L'],0.7340056119535389,0,0,1
1456,Negative Regulation Of Cell-Substrate Adhesion (GO:0010812),0.582582087229139,1.1672836241847346,0.6306660443917301,['GBP1'],0.7340056119535389,0,0,1
1457,Negative Regulation Of Response To Biotic Stimulus (GO:0002832),0.582582087229139,1.1672836241847346,0.6306660443917301,['PRKDC'],0.7340056119535389,0,0,1
1458,Organic Hydroxy Compound Biosynthetic Process (GO:1901617),0.582582087229139,1.1672836241847346,0.6306660443917301,['CYP27A1'],0.7340056119535389,0,0,1
1459,Positive Regulation Of Double-Strand Break Repair Via Homologous Recombination (GO:1905168),0.582582087229139,1.1672836241847346,0.6306660443917301,['EP400'],0.7340056119535389,0,0,1
1460,Positive Regulation Of Epithelial To Mesenchymal Transition (GO:0010718),0.582582087229139,1.1672836241847346,0.6306660443917301,['FERMT2'],0.7340056119535389,0,0,1
1461,Positive Regulation Of miRNA Metabolic Process (GO:2000630),0.582582087229139,1.1672836241847346,0.6306660443917301,['KLF4'],0.7340056119535389,0,0,1
1462,Regulation Of Cell-Substrate Adhesion (GO:0010810),0.582582087229139,1.1672836241847346,0.6306660443917301,['CCDC80'],0.7340056119535389,0,0,1
1463,Cytokine-Mediated Signaling Pathway (GO:0019221),0.583728511382515,0.9955136606512753,0.5359041990356755,"['IL33', 'TRAF3', 'LEPR']",0.7344452991575086,0,0,3
1464,Negative Regulation Of Cell Migration (GO:0030336),0.583728511382515,0.9955136606512753,0.5359041990356755,"['BST2', 'RNF20', 'SF3B3']",0.7344452991575086,0,0,3
1465,Regulation Of Mitotic Cell Cycle Phase Transition (GO:1901990),0.5884473089781809,1.019023731429674,0.5403555646760024,"['KLHL18', 'ZW10']",0.7388684002302721,0,0,2
