Rank,Term name,P-value,Z-score,Combined score,Overlapping genes,Adjusted p-value,Old p-value,Old adjusted p-value,gene count
964,Keratinocyte Differentiation (GO:0030216),0.2470966372258977,3.7328821656050954,5.218478838596735,['ST14'],0.3682174294131526,0,0,1
965,Maintenance Of Protein Localization In Organelle (GO:0072595),0.2470966372258977,3.7328821656050954,5.218478838596735,['HSPA5'],0.3682174294131526,0,0,1
966,Purine Nucleotide Biosynthetic Process (GO:0006164),0.2470966372258977,3.7328821656050954,5.218478838596735,['NAMPT'],0.3682174294131526,0,0,1
967,Muscle Cell Differentiation (GO:0042692),0.2470966372258977,3.7328821656050954,5.218478838596735,['WNT5B'],0.3682174294131526,0,0,1
968,Positive Regulation Of Binding (GO:0051099),0.24913914101816773,2.1375915750915753,2.970704508702105,"['APOE', 'IGF1']",0.3708775849247724,0,0,2
969,Regulation Of I-kappaB kinase/NF-kappaB Signaling (GO:0043122),0.2546054864276168,1.5897480003440267,2.174838924158193,"['BST2', 'ECT2', 'IKBKE', 'LITAF']",0.37668282020355925,0,0,4
970,Positive Regulation Of Peptidyl-Tyrosine Phosphorylation (GO:0050731),0.2552904572621013,2.099865047233468,2.86705774310654,"['IL15', 'IGF1']",0.37668282020355925,0,0,2
971,Regulation Of Fatty Acid Biosynthetic Process (GO:0042304),0.25957393508822646,3.512926189584114,4.737931690649398,['APOC1'],0.37668282020355925,0,0,1
972,Regulation Of Gluconeogenesis (GO:0006111),0.25957393508822646,3.512926189584114,4.737931690649398,['PTPN2'],0.37668282020355925,0,0,1
973,Negative Regulation Of Protein Localization To Membrane (GO:1905476),0.25957393508822646,3.512926189584114,4.737931690649398,['PID1'],0.37668282020355925,0,0,1
974,Negative Regulation Of Proteolysis (GO:0045861),0.25957393508822646,3.512926189584114,4.737931690649398,['PLAT'],0.37668282020355925,0,0,1
975,Activation Of Protein Kinase B Activity (GO:0032148),0.25957393508822646,3.512926189584114,4.737931690649398,['IGF1'],0.37668282020355925,0,0,1
976,Apical Junction Assembly (GO:0043297),0.25957393508822646,3.512926189584114,4.737931690649398,['ECT2'],0.37668282020355925,0,0,1
977,Regulation Of Ossification (GO:0030278),0.25957393508822646,3.512926189584114,4.737931690649398,['ENPP1'],0.37668282020355925,0,0,1
978,Nucleic Acid Metabolic Process (GO:0090304),0.25957393508822646,3.512926189584114,4.737931690649398,['ENPP1'],0.37668282020355925,0,0,1
979,Regulation Of Protein Targeting To Membrane (GO:0090313),0.25957393508822646,3.512926189584114,4.737931690649398,['CEMIP'],0.37668282020355925,0,0,1
980,Phospholipid Translocation (GO:0045332),0.25957393508822646,3.512926189584114,4.737931690649398,['PLSCR1'],0.37668282020355925,0,0,1
981,Photoperiodism (GO:0009648),0.25957393508822646,3.512926189584114,4.737931690649398,['PER3'],0.37668282020355925,0,0,1
982,Cellular Response To Interleukin-6 (GO:0071354),0.25957393508822646,3.512926189584114,4.737931690649398,['PID1'],0.37668282020355925,0,0,1
983,Renal System Development (GO:0072001),0.25957393508822646,3.512926189584114,4.737931690649398,['PROX1'],0.37668282020355925,0,0,1
984,Positive Regulation Of Cell Division (GO:0051781),0.25957393508822646,3.512926189584114,4.737931690649398,['ECT2'],0.37668282020355925,0,0,1
985,Endothelial Cell Migration (GO:0043542),0.25957393508822646,3.512926189584114,4.737931690649398,['S100A9'],0.37668282020355925,0,0,1
986,Positive Regulation Of Glucose Transmembrane Transport (GO:0010828),0.25957393508822646,3.512926189584114,4.737931690649398,['IGF1'],0.37668282020355925,0,0,1
987,Establishment Of Mitotic Spindle Orientation (GO:0000132),0.25957393508822646,3.512926189584114,4.737931690649398,['UBXN2B'],0.37668282020355925,0,0,1
988,Positive Regulation Of Interleukin-2 Production (GO:0032743),0.25957393508822646,3.512926189584114,4.737931690649398,['PDE4B'],0.37668282020355925,0,0,1
989,Superoxide Metabolic Process (GO:0006801),0.25957393508822646,3.512926189584114,4.737931690649398,['SH3PXD2B'],0.37668282020355925,0,0,1
990,Glycolytic Process (GO:0006096),0.25957393508822646,3.512926189584114,4.737931690649398,['ENO4'],0.37668282020355925,0,0,1
991,Intrinsic Apoptotic Signaling Pathway In Response To Endoplasmic Reticulum Stress (GO:0070059),0.25957393508822646,3.512926189584114,4.737931690649398,['CASP4'],0.37668282020355925,0,0,1
992,Proteoglycan Biosynthetic Process (GO:0030166),0.25957393508822646,3.512926189584114,4.737931690649398,['IGF1'],0.37668282020355925,0,0,1
993,Regulation Of Bone Resorption (GO:0045124),0.25957393508822646,3.512926189584114,4.737931690649398,['SPP1'],0.37668282020355925,0,0,1
994,Negative Regulation Of Protein Phosphorylation (GO:0001933),0.2604810883328623,1.7287220843672457,2.3255201970506474,"['NIBAN1', 'PID1', 'ENPP1']",0.3774972271974247,0,0,3
995,Negative Regulation Of Protein Modification Process (GO:0031400),0.26144499149412204,2.0634394341290894,2.7681687416688217,"['NIBAN1', 'PID1']",0.3774972271974247,0,0,2
996,Negative Regulation Of Transmembrane Receptor Protein Serine/Threonine Kinase Signaling Pathway (GO:0090101),0.26144499149412204,2.0634394341290894,2.7681687416688217,"['SAP30', 'HSPA1A']",0.3774972271974247,0,0,2
997,Epigenetic Regulation Of Gene Expression (GO:0040029),0.26144499149412204,2.0634394341290894,2.7681687416688217,"['INSL6', 'EZH2']",0.3774972271974247,0,0,2
998,Positive Regulation Of Supramolecular Fiber Organization (GO:1902905),0.26144499149412204,2.0634394341290894,2.7681687416688217,"['PROX1', 'APOE']",0.3774972271974247,0,0,2
999,Positive Regulation Of Apoptotic Process (GO:0043065),0.2618828454398589,1.5686274509803921,2.1017380863282566,"['TNFAIP8', 'BCL6', 'PRDM11', 'ECT2']",0.3777509312100467,0,0,4
1000,Regulation Of Organelle Assembly (GO:1902115),0.26760096557632623,2.0282485875706215,2.6737556211321434,"['TBC1D8', 'TBC1D14']",0.3825485505386826,0,0,2
1001,Positive Regulation Of Epithelial Cell Migration (GO:0010634),0.26760096557632623,2.0282485875706215,2.6737556211321434,"['PROX1', 'HIF1A']",0.3825485505386826,0,0,2
1002,Phosphorylation (GO:0016310),0.2687311173826639,1.3628238924966245,1.7908105084452317,"['FGR', 'LIMK2', 'PIM1', 'PRKCQ', 'FAM20A', 'JAK3', 'IKBKE']",0.3825485505386826,0,0,7
1003,Regulation Of Signal Transduction (GO:0009966),0.26944190654837125,1.695739500912964,2.2237969733430383,"['PLSCR1', 'CD55', 'PTPN2']",0.3825485505386826,0,0,3
1004,Negative Regulation Of Epithelial Cell Migration (GO:0010633),0.2718457430614927,3.3174097664543525,4.32099420998404,['APOE'],0.3825485505386826,0,0,1
1005,B Cell Receptor Signaling Pathway (GO:0050853),0.2718457430614927,3.3174097664543525,4.32099420998404,['SH2B2'],0.3825485505386826,0,0,1
1006,Regulation Of Cytoplasmic Translation (GO:2000765),0.2718457430614927,3.3174097664543525,4.32099420998404,['YBX3'],0.3825485505386826,0,0,1
1007,Regulation Of Developmental Growth (GO:0048638),0.2718457430614927,3.3174097664543525,4.32099420998404,['APOE'],0.3825485505386826,0,0,1
1008,Fc-epsilon Receptor Signaling Pathway (GO:0038095),0.2718457430614927,3.3174097664543525,4.32099420998404,['PRKCQ'],0.3825485505386826,0,0,1
1009,Negative Regulation Of Receptor-Mediated Endocytosis (GO:0048261),0.2718457430614927,3.3174097664543525,4.32099420998404,['APOC1'],0.3825485505386826,0,0,1
1010,Negative Regulation Of Smooth Muscle Cell Proliferation (GO:0048662),0.2718457430614927,3.3174097664543525,4.32099420998404,['APOE'],0.3825485505386826,0,0,1
1011,Regulation Of Mitochondrial Fission (GO:0090140),0.2718457430614927,3.3174097664543525,4.32099420998404,['C11ORF65'],0.3825485505386826,0,0,1
1012,Neutral Amino Acid Transport (GO:0015804),0.2718457430614927,3.3174097664543525,4.32099420998404,['SLC7A5'],0.3825485505386826,0,0,1
1013,Blood Circulation (GO:0008015),0.2718457430614927,3.3174097664543525,4.32099420998404,['TBC1D8'],0.3825485505386826,0,0,1
1014,Blood Vessel Morphogenesis (GO:0048514),0.2718457430614927,3.3174097664543525,4.32099420998404,['PROX1'],0.3825485505386826,0,0,1
1015,Regulation Of Sprouting Angiogenesis (GO:1903670),0.2718457430614927,3.3174097664543525,4.32099420998404,['CEMIP2'],0.3825485505386826,0,0,1
1016,Cellular Response To Topologically Incorrect Protein (GO:0035967),0.2718457430614927,3.3174097664543525,4.32099420998404,['HSPA1A'],0.3825485505386826,0,0,1
1017,Respiratory Chain Complex IV Assembly (GO:0008535),0.2718457430614927,3.3174097664543525,4.32099420998404,['SCO2'],0.3825485505386826,0,0,1
1018,Secretory Granule Organization (GO:0033363),0.2718457430614927,3.3174097664543525,4.32099420998404,['SRGN'],0.3825485505386826,0,0,1
1019,Sterol Biosynthetic Process (GO:0016126),0.2718457430614927,3.3174097664543525,4.32099420998404,['CH25H'],0.3825485505386826,0,0,1
1020,Positive Regulation Of Immunoglobulin Production (GO:0002639),0.2718457430614927,3.3174097664543525,4.32099420998404,['INSL6'],0.3825485505386826,0,0,1
1021,Ventricular Septum Development (GO:0003281),0.2718457430614927,3.3174097664543525,4.32099420998404,['PROX1'],0.3825485505386826,0,0,1
1022,Zymogen Activation (GO:0031638),0.2718457430614927,3.3174097664543525,4.32099420998404,['PLAT'],0.3825485505386826,0,0,1
1023,Positive Regulation Of Protein Import Into Nucleus (GO:0042307),0.2718457430614927,3.3174097664543525,4.32099420998404,['ECT2'],0.3825485505386826,0,0,1
1024,Negative Regulation Of DNA Recombination (GO:0045910),0.2718457430614927,3.3174097664543525,4.32099420998404,['INSL6'],0.3825485505386826,0,0,1
1025,Positive Regulation Of T Cell Activation (GO:0050870),0.2737566586189572,1.9942307692307693,2.583557219959137,"['IL15', 'PRKCQ']",0.384861800068212,0,0,2
1026,Cytokine-Mediated Signaling Pathway (GO:0019221),0.27843805529313215,1.663978494623656,2.1274957899815634,"['IL15', 'IL21R', 'JAK3']",0.38964012018129435,0,0,3
1027,Negative Regulation Of Developmental Process (GO:0051093),0.2799104055555219,1.9613282891971417,2.497331277715289,"['C11ORF65', 'SAP30']",0.38964012018129435,0,0,2
1028,Phosphate-Containing Compound Metabolic Process (GO:0006796),0.2829474958247046,1.6485350695472034,2.0812655115612224,"['LIMK2', 'ENPP1', 'ALOX15B']",0.38964012018129435,0,0,3
1029,Fc Receptor Signaling Pathway (GO:0038093),0.2839154241432054,3.1424740194435135,3.956622692353034,['PRKCQ'],0.38964012018129435,0,0,1
1030,L-alpha-amino Acid Transmembrane Transport (GO:1902475),0.2839154241432054,3.1424740194435135,3.956622692353034,['SLC7A5'],0.38964012018129435,0,0,1
1031,Regulation Of Interleukin-10 Production (GO:0032653),0.2839154241432054,3.1424740194435135,3.956622692353034,['JAK3'],0.38964012018129435,0,0,1
1032,Negative Regulation Of Response To Endoplasmic Reticulum Stress (GO:1903573),0.2839154241432054,3.1424740194435135,3.956622692353034,['HSPA1A'],0.38964012018129435,0,0,1
1033,Adherens Junction Organization (GO:0034332),0.2839154241432054,3.1424740194435135,3.956622692353034,['CDH26'],0.38964012018129435,0,0,1
1034,Nuclear Membrane Organization (GO:0071763),0.2839154241432054,3.1424740194435135,3.956622692353034,['UBXN2B'],0.38964012018129435,0,0,1
1035,Nuclear Membrane Reassembly (GO:0031468),0.2839154241432054,3.1424740194435135,3.956622692353034,['UBXN2B'],0.38964012018129435,0,0,1
1036,Regulation Of Phosphatidylinositol 3-Kinase Activity (GO:0043551),0.2839154241432054,3.1424740194435135,3.956622692353034,['FGR'],0.38964012018129435,0,0,1
1037,Canonical Wnt Signaling Pathway (GO:0060070),0.2839154241432054,3.1424740194435135,3.956622692353034,['WNT5B'],0.38964012018129435,0,0,1
1038,Cell Chemotaxis (GO:0060326),0.2839154241432054,3.1424740194435135,3.956622692353034,['PRKCQ'],0.38964012018129435,0,0,1
1039,Phosphatidylinositol 3-Kinase Signaling (GO:0014065),0.2839154241432054,3.1424740194435135,3.956622692353034,['IGF1'],0.38964012018129435,0,0,1
1040,Regulation Of Viral Entry Into Host Cell (GO:0046596),0.2839154241432054,3.1424740194435135,3.956622692353034,['IFITM2'],0.38964012018129435,0,0,1
1041,Cyclic-Nucleotide-Mediated Signaling (GO:0019935),0.2839154241432054,3.1424740194435135,3.956622692353034,['APOE'],0.38964012018129435,0,0,1
1042,Response To Peptide (GO:1901652),0.2839154241432054,3.1424740194435135,3.956622692353034,['CALCR'],0.38964012018129435,0,0,1
1043,Epithelial Cell Migration (GO:0010631),0.2839154241432054,3.1424740194435135,3.956622692353034,['S100A9'],0.38964012018129435,0,0,1
1044,Establishment Of Spindle Orientation (GO:0051294),0.2839154241432054,3.1424740194435135,3.956622692353034,['UBXN2B'],0.38964012018129435,0,0,1
1045,Positive Regulation Of Osteoblast Differentiation (GO:0045669),0.2839154241432054,3.1424740194435135,3.956622692353034,['IGF1'],0.38964012018129435,0,0,1
1046,Lipid Modification (GO:0030258),0.2839154241432054,3.1424740194435135,3.956622692353034,['ALOX15B'],0.38964012018129435,0,0,1
1047,Receptor Signaling Pathway Via STAT (GO:0097696),0.2839154241432054,3.1424740194435135,3.956622692353034,['JAK3'],0.38964012018129435,0,0,1
1048,Multivesicular Body Sorting Pathway (GO:0071985),0.2839154241432054,3.1424740194435135,3.956622692353034,['RAB27A'],0.38964012018129435,0,0,1
1049,Negative Regulation Of T Cell Activation (GO:0050868),0.2839154241432054,3.1424740194435135,3.956622692353034,['JAK3'],0.38964012018129435,0,0,1
1050,Negative Regulation Of Blood Vessel Endothelial Cell Migration (GO:0043537),0.2839154241432054,3.1424740194435135,3.956622692353034,['APOE'],0.38964012018129435,0,0,1
1051,Cellular Response To Chemical Stress (GO:0062197),0.2860605957852501,1.9294871794871795,2.4148527999103373,"['HSPA1B', 'HSPA1A']",0.39221057899766454,0,0,2
1052,Negative Regulation Of Amide Metabolic Process (GO:0034249),0.29220567191652974,1.8986568986568986,2.335912586628852,"['APOE', 'IGF1']",0.3998386858627724,0,0,2
1053,Negative Regulation Of Nucleic Acid-Templated Transcription (GO:1903507),0.2949793362475587,1.3544222398100514,1.6535463531611054,"['TSHZ3', 'NFIL3', 'BCL6', 'PROX1', 'PRDM11', 'EZH2']",0.3998386858627724,0,0,6
1054,Negative Regulation Of Double-Strand Break Repair (GO:2000780),0.29578628669654083,2.985031847133758,3.6361212917193355,['INSL6'],0.3998386858627724,0,0,1
1055,Negative Regulation Of Peptidyl-Tyrosine Phosphorylation (GO:0050732),0.29578628669654083,2.985031847133758,3.6361212917193355,['PTPN2'],0.3998386858627724,0,0,1
1056,Amino Acid Transmembrane Transport (GO:0003333),0.29578628669654083,2.985031847133758,3.6361212917193355,['SLC7A5'],0.3998386858627724,0,0,1
1057,Regulation Of Nervous System Development (GO:0051960),0.29578628669654083,2.985031847133758,3.6361212917193355,['CX3CR1'],0.3998386858627724,0,0,1
1058,Regulation Of Osteoclast Differentiation (GO:0045670),0.29578628669654083,2.985031847133758,3.6361212917193355,['LILRB3'],0.3998386858627724,0,0,1
1059,Carboxylic Acid Transmembrane Transport (GO:1905039),0.29578628669654083,2.985031847133758,3.6361212917193355,['SLC7A5'],0.3998386858627724,0,0,1
1060,Carboxylic Acid Transport (GO:0046942),0.29578628669654083,2.985031847133758,3.6361212917193355,['SLC7A5'],0.3998386858627724,0,0,1
1061,Central Nervous System Neuron Differentiation (GO:0021953),0.29578628669654083,2.985031847133758,3.6361212917193355,['PROX1'],0.3998386858627724,0,0,1
1062,Epidermal Cell Differentiation (GO:0009913),0.29578628669654083,2.985031847133758,3.6361212917193355,['ST14'],0.3998386858627724,0,0,1
1063,Establishment Of Mitotic Spindle Localization (GO:0040001),0.29578628669654083,2.985031847133758,3.6361212917193355,['UBXN2B'],0.3998386858627724,0,0,1
1064,Import Into Cell (GO:0098657),0.29578628669654083,2.985031847133758,3.6361212917193355,['SLC7A5'],0.3998386858627724,0,0,1
1065,Inositol Lipid-Mediated Signaling (GO:0048017),0.29578628669654083,2.985031847133758,3.6361212917193355,['IGF1'],0.3998386858627724,0,0,1
1066,Regulation Of Cardiac Muscle Contraction (GO:0055117),0.29578628669654083,2.985031847133758,3.6361212917193355,['PDE4B'],0.3998386858627724,0,0,1
1067,Regulation Of Transforming Growth Factor Beta Receptor Signaling Pathway (GO:0017015),0.3044745099729121,1.8398422090729782,2.1878813079188895,"['SAP30', 'HSPA1A']",0.4087196902739514,0,0,2
1068,RNA Stabilization (GO:0043489),0.30746158518873234,2.8425841674249317,3.35255833745097,['SLC11A1'],0.4087196902739514,0,0,1
1069,Negative Regulation Of Peptidase Activity (GO:0010466),0.30746158518873234,2.8425841674249317,3.35255833745097,['SERPINA1'],0.4087196902739514,0,0,1
1070,T Cell Differentiation (GO:0030217),0.30746158518873234,2.8425841674249317,3.35255833745097,['PTPN2'],0.4087196902739514,0,0,1
1071,Regulation Of Regulated Secretory Pathway (GO:1903305),0.30746158518873234,2.8425841674249317,3.35255833745097,['RAB27A'],0.4087196902739514,0,0,1
1072,Cellular Response To Alcohol (GO:0097306),0.30746158518873234,2.8425841674249317,3.35255833745097,['GRAMD1A'],0.4087196902739514,0,0,1
1073,Cellular Response To Hydrogen Peroxide (GO:0070301),0.30746158518873234,2.8425841674249317,3.35255833745097,['ECT2'],0.4087196902739514,0,0,1
1074,Cellular Response To Osmotic Stress (GO:0071470),0.30746158518873234,2.8425841674249317,3.35255833745097,['YBX3'],0.4087196902739514,0,0,1
1075,Cellular Response To Radiation (GO:0071478),0.30746158518873234,2.8425841674249317,3.35255833745097,['ECT2'],0.4087196902739514,0,0,1
1076,Regulation Of Vascular Associated Smooth Muscle Cell Proliferation (GO:1904705),0.30746158518873234,2.8425841674249317,3.35255833745097,['IGF1'],0.4087196902739514,0,0,1
1077,Response To Retinoic Acid (GO:0032526),0.30746158518873234,2.8425841674249317,3.35255833745097,['WNT5B'],0.4087196902739514,0,0,1
1078,Positive Regulation Of Epithelial To Mesenchymal Transition (GO:0010718),0.30746158518873234,2.8425841674249317,3.35255833745097,['EZH2'],0.4087196902739514,0,0,1
1079,Steroid Biosynthetic Process (GO:0006694),0.30746158518873234,2.8425841674249317,3.35255833745097,['CH25H'],0.4087196902739514,0,0,1
1080,Positive Regulation Of miRNA Transcription (GO:1902895),0.30746158518873234,2.8425841674249317,3.35255833745097,['HIF1A'],0.4087196902739514,0,0,1
1081,Integrated Stress Response Signaling (GO:0140467),0.30746158518873234,2.8425841674249317,3.35255833745097,['CEBPD'],0.4087196902739514,0,0,1
1082,Muscle Organ Development (GO:0007517),0.30746158518873234,2.8425841674249317,3.35255833745097,['IGF1'],0.4087196902739514,0,0,1
1083,Regulation Of T Cell Receptor Signaling Pathway (GO:0050856),0.30746158518873234,2.8425841674249317,3.35255833745097,['PTPN2'],0.4087196902739514,0,0,1
1084,Regulation Of calcineurin-NFAT Signaling Cascade (GO:0070884),0.30746158518873234,2.8425841674249317,3.35255833745097,['IGF1'],0.4087196902739514,0,0,1
1085,mRNA Metabolic Process (GO:0016071),0.31059541125176654,1.8117715617715617,2.118439521029664,"['HSPA1B', 'HSPA1A']",0.4125050577085674,0,0,2
1086,Negative Regulation Of Response To External Stimulus (GO:0032102),0.31670547463194193,1.7845388442403367,2.051832495714068,"['APOE', 'PTPN2']",0.41819750236594333,0,0,2
1087,Intrinsic Apoptotic Signaling Pathway (GO:0097193),0.31670547463194193,1.7845388442403367,2.051832495714068,"['CASP4', 'IKBKE']",0.41819750236594333,0,0,2
1088,Negative Regulation Of Endopeptidase Activity (GO:0010951),0.3189445212353724,2.7130862767805444,3.1003470731931673,['SERPINA1'],0.41819750236594333,0,0,1
1089,Negative Regulation Of Endothelial Cell Migration (GO:0010596),0.3189445212353724,2.7130862767805444,3.1003470731931673,['APOE'],0.41819750236594333,0,0,1
1090,Negative Regulation Of mRNA Catabolic Process (GO:1902373),0.3189445212353724,2.7130862767805444,3.1003470731931673,['SLC11A1'],0.41819750236594333,0,0,1
1091,Negative Regulation Of Plasma Membrane Bounded Cell Projection Assembly (GO:0120033),0.3189445212353724,2.7130862767805444,3.1003470731931673,['LIMK2'],0.41819750236594333,0,0,1
1092,Negative Regulation Of Secretion By Cell (GO:1903531),0.3189445212353724,2.7130862767805444,3.1003470731931673,['APOE'],0.41819750236594333,0,0,1
1093,Amino Acid Transport (GO:0006865),0.3189445212353724,2.7130862767805444,3.1003470731931673,['SLC7A5'],0.41819750236594333,0,0,1
1094,Regulation Of Nitric Oxide Biosynthetic Process (GO:0045428),0.3189445212353724,2.7130862767805444,3.1003470731931673,['CX3CR1'],0.41819750236594333,0,0,1
1095,Regulation Of Protein Import Into Nucleus (GO:0042306),0.3189445212353724,2.7130862767805444,3.1003470731931673,['ECT2'],0.41819750236594333,0,0,1
1096,Cellular Response To Ketone (GO:1901655),0.3189445212353724,2.7130862767805444,3.1003470731931673,['SPP1'],0.41819750236594333,0,0,1
1097,Steroid Metabolic Process (GO:0008202),0.3189445212353724,2.7130862767805444,3.1003470731931673,['DHRS9'],0.41819750236594333,0,0,1
1098,Membrane Protein Proteolysis (GO:0033619),0.3189445212353724,2.7130862767805444,3.1003470731931673,['PRKCQ'],0.41819750236594333,0,0,1
1099,Monocarboxylic Acid Transport (GO:0015718),0.3189445212353724,2.7130862767805444,3.1003470731931673,['ACSL1'],0.41819750236594333,0,0,1
1100,Positive Regulation Of Cysteine-Type Endopeptidase Activity Involved In Apoptotic Process (GO:0043280),0.32888789089399706,1.7324414715719063,1.926541344168793,"['S100A9', 'S100A8']",0.4279436241528091,0,0,2
1101,Negative Regulation Of Tumor Necrosis Factor Production (GO:0032720),0.33023824431500604,2.594849072279147,2.8749395009265064,['IGF1'],0.4279436241528091,0,0,1
1102,Negative Regulation Of Tumor Necrosis Factor Superfamily Cytokine Production (GO:1903556),0.33023824431500604,2.594849072279147,2.8749395009265064,['IGF1'],0.4279436241528091,0,0,1
1103,Regulation Of Neurotransmitter Receptor Activity (GO:0099601),0.33023824431500604,2.594849072279147,2.8749395009265064,['OPRM1'],0.4279436241528091,0,0,1
1104,Regulation Of p38MAPK Cascade (GO:1900744),0.33023824431500604,2.594849072279147,2.8749395009265064,['DUSP1'],0.4279436241528091,0,0,1
1105,Positive Regulation Of Leukocyte Cell-Cell Adhesion (GO:1903039),0.33023824431500604,2.594849072279147,2.8749395009265064,['PRKCQ'],0.4279436241528091,0,0,1
1106,Positive Regulation Of Lipid Biosynthetic Process (GO:0046889),0.33023824431500604,2.594849072279147,2.8749395009265064,['APOE'],0.4279436241528091,0,0,1
1107,Gland Development (GO:0048732),0.33023824431500604,2.594849072279147,2.8749395009265064,['PROX1'],0.4279436241528091,0,0,1
1108,Unsaturated Fatty Acid Metabolic Process (GO:0033559),0.33023824431500604,2.594849072279147,2.8749395009265064,['ALOX15B'],0.4279436241528091,0,0,1
1109,Vacuolar Acidification (GO:0007035),0.33023824431500604,2.594849072279147,2.8749395009265064,['SLC11A1'],0.4279436241528091,0,0,1
1110,Positive Regulation Of Smooth Muscle Cell Proliferation (GO:0048661),0.33023824431500604,2.594849072279147,2.8749395009265064,['IGF1'],0.4279436241528091,0,0,1
1111,Positive Regulation Of Telomerase Activity (GO:0051973),0.33023824431500604,2.594849072279147,2.8749395009265064,['PRKCQ'],0.4279436241528091,0,0,1
1112,Kidney Development (GO:0001822),0.33023824431500604,2.594849072279147,2.8749395009265064,['PROX1'],0.4279436241528091,0,0,1
1113,Protein Maturation (GO:0051604),0.33495775872706796,1.7075091575091574,1.8675895897780779,"['SRGN', 'CASP4']",0.43366947917853094,0,0,2
1114,Regulation Of Neuron Projection Development (GO:0010975),0.3373746558379844,1.4831245001332978,1.611505577788168,"['APOE', 'ROR2', 'S100A9']",0.4364065341674466,0,0,3
1115,Neuron Differentiation (GO:0030182),0.3410118162994367,1.6832791621524017,1.810935940407605,"['WNT5B', 'MANF']",0.43761510118995406,0,0,2
1116,NIK/NF-kappaB Signaling (GO:0038061),0.3413458526977851,2.486464968152866,2.672599460299392,['CHI3L1'],0.43761510118995406,0,0,1
1117,Negative Regulation Of Stress-Activated MAPK Cascade (GO:0032873),0.3413458526977851,2.486464968152866,2.672599460299392,['DUSP1'],0.43761510118995406,0,0,1
1118,Carbohydrate Catabolic Process (GO:0016052),0.3413458526977851,2.486464968152866,2.672599460299392,['ENO4'],0.43761510118995406,0,0,1
1119,Regulation Of Receptor-Mediated Endocytosis (GO:0048259),0.3413458526977851,2.486464968152866,2.672599460299392,['APOC1'],0.43761510118995406,0,0,1
1120,Cognition (GO:0050890),0.3413458526977851,2.486464968152866,2.672599460299392,['C5AR1'],0.43761510118995406,0,0,1
1121,Positive Regulation Of Cell Cycle G1/S Phase Transition (GO:1902808),0.3413458526977851,2.486464968152866,2.672599460299392,['EZH2'],0.43761510118995406,0,0,1
1122,Response To Organic Cyclic Compound (GO:0014070),0.3413458526977851,2.486464968152866,2.672599460299392,['SPP1'],0.43761510118995406,0,0,1
1123,Melanosome Organization (GO:0032438),0.3413458526977851,2.486464968152866,2.672599460299392,['APOE'],0.43761510118995406,0,0,1
1124,Multivesicular Body Organization (GO:0036257),0.3413458526977851,2.486464968152866,2.672599460299392,['RAB27A'],0.43761510118995406,0,0,1
1125,Protein Phosphorylation (GO:0006468),0.35086849533391673,1.234339696143358,1.2927780067253025,"['FGR', 'LIMK2', 'PIM1', 'PRKCQ', 'FAM20A', 'JAK3', 'IKBKE']",0.4468500334946457,0,0,7
1126,Negative Regulation Of Transport (GO:0051051),0.35227039420535566,2.386751592356688,2.490232150307342,['HAMP'],0.4468500334946457,0,0,1
1127,Regulation Of Primary Metabolic Process (GO:0080090),0.35227039420535566,2.386751592356688,2.490232150307342,['APOE'],0.4468500334946457,0,0,1
1128,Regulation Of Protein Autophosphorylation (GO:0031952),0.35227039420535566,2.386751592356688,2.490232150307342,['ENPP1'],0.4468500334946457,0,0,1
1129,Cellular Response To Glucose Starvation (GO:0042149),0.35227039420535566,2.386751592356688,2.490232150307342,['HSPA5'],0.4468500334946457,0,0,1
1130,Skin Development (GO:0043588),0.35227039420535566,2.386751592356688,2.490232150307342,['ST14'],0.4468500334946457,0,0,1
1131,Positive Regulation Of Lymphocyte Activation (GO:0051251),0.35227039420535566,2.386751592356688,2.490232150307342,['PRKCQ'],0.4468500334946457,0,0,1
1132,Toll-Like Receptor Signaling Pathway (GO:0002224),0.35227039420535566,2.386751592356688,2.490232150307342,['LY96'],0.4468500334946457,0,0,1
1133,Positive Regulation Of miRNA Metabolic Process (GO:2000630),0.35227039420535566,2.386751592356688,2.490232150307342,['HIF1A'],0.4468500334946457,0,0,1
