Rank,Term name,P-value,Z-score,Combined score,Overlapping genes,Adjusted p-value,Old p-value,Old adjusted p-value,gene count
634,Ventricular Cardiac Muscle Tissue Development (GO:0003229),0.12497076653198645,8.54049135577798,17.761450090602988,['PROX1'],0.27833520026675806,0,0,1
635,Insulin-Like Growth Factor Receptor Signaling Pathway (GO:0048009),0.12497076653198645,8.54049135577798,17.761450090602988,['IGF1'],0.27833520026675806,0,0,1
636,Positive Regulation Of Smooth Muscle Cell Migration (GO:0014911),0.12497076653198645,8.54049135577798,17.761450090602988,['IGF1'],0.27833520026675806,0,0,1
637,Positive Regulation Of Transcription From RNA Polymerase II Promoter In Response To Endoplasmic Reticulum Stress (GO:1990440),0.12497076653198645,8.54049135577798,17.761450090602988,['HSPA5'],0.27833520026675806,0,0,1
638,Leucine Transport (GO:0015820),0.12497076653198645,8.54049135577798,17.761450090602988,['SLC7A5'],0.27833520026675806,0,0,1
639,Leukocyte Adhesion To Vascular Endothelial Cell (GO:0061756),0.12497076653198645,8.54049135577798,17.761450090602988,['CX3CR1'],0.27833520026675806,0,0,1
640,Leukocyte Tethering Or Rolling (GO:0050901),0.12497076653198645,8.54049135577798,17.761450090602988,['CX3CR1'],0.27833520026675806,0,0,1
641,Linoleic Acid Metabolic Process (GO:0043651),0.12497076653198645,8.54049135577798,17.761450090602988,['ALOX15B'],0.27833520026675806,0,0,1
642,Lipid Catabolic Process (GO:0016042),0.12497076653198645,8.54049135577798,17.761450090602988,['LIPG'],0.27833520026675806,0,0,1
643,Lymphocyte Chemotaxis (GO:0048247),0.12497076653198645,8.54049135577798,17.761450090602988,['CH25H'],0.27833520026675806,0,0,1
644,Maintenance Of Synapse Structure (GO:0099558),0.12497076653198645,8.54049135577798,17.761450090602988,['ERC2'],0.27833520026675806,0,0,1
645,Mitochondrion Morphogenesis (GO:0070584),0.12497076653198645,8.54049135577798,17.761450090602988,['PID1'],0.27833520026675806,0,0,1
646,Regulation Of B Cell Activation (GO:0050864),0.12497076653198645,8.54049135577798,17.761450090602988,['THEMIS2'],0.27833520026675806,0,0,1
647,Negative Regulation Of Cytokine Production Involved In Immune Response (GO:0002719),0.12497076653198645,8.54049135577798,17.761450090602988,['JAK3'],0.27833520026675806,0,0,1
648,Positive Regulation Of Proteasomal Protein Catabolic Process (GO:1901800),0.1273526386630843,2.5056451612903228,5.163621917178198,"['RNF144B', 'HSPA1B', 'HSPA1A']",0.2832023955455316,0,0,3
649,Positive Regulation Of I-kappaB kinase/NF-kappaB Signaling (GO:0043123),0.12870460242440673,2.1330881507872657,4.3733328469085,"['BST2', 'ECT2', 'IKBKE', 'LITAF']",0.28532820322087704,0,0,4
650,Membrane Organization (GO:0061024),0.12870460242440673,2.1330881507872657,4.3733328469085,"['UBXN2B', 'GCA', 'AZIN2', 'LMNB1']",0.28532820322087704,0,0,4
651,Cellular Response To Peptide (GO:1901653),0.1300981722330411,3.3322649572649574,6.796040891732518,"['CASP4', 'IGF1']",0.2866536180241777,0,0,2
652,Positive Regulation Of Apoptotic Signaling Pathway (GO:2001235),0.1300981722330411,3.3322649572649574,6.796040891732518,"['S100A9', 'S100A8']",0.2866536180241777,0,0,2
653,Regulation Of Rho Protein Signal Transduction (GO:0035023),0.1300981722330411,3.3322649572649574,6.796040891732518,"['GPR65', 'APOE']",0.2866536180241777,0,0,2
654,Regulation Of Blood Vessel Endothelial Cell Migration (GO:0043535),0.1300981722330411,3.3322649572649574,6.796040891732518,"['APOE', 'HIF1A']",0.2866536180241777,0,0,2
655,Negative Regulation Of Multicellular Organismal Process (GO:0051241),0.1316106378547228,2.114149008885851,4.287298480277521,"['SRGN', 'IL15', 'SLC11A1', 'SAP30']",0.2895434032803902,0,0,4
656,Regulation Of Chromosome Separation (GO:1905818),0.1394582873957815,7.4721337579617835,14.720026820551334,['PLSCR1'],0.29082401177615214,0,0,1
657,Negative Regulation Of Immune Effector Process (GO:0002698),0.1394582873957815,7.4721337579617835,14.720026820551334,['CD55'],0.29082401177615214,0,0,1
658,Negative Regulation Of Platelet Activation (GO:0010544),0.1394582873957815,7.4721337579617835,14.720026820551334,['APOE'],0.29082401177615214,0,0,1
659,T Cell Proliferation (GO:0042098),0.1394582873957815,7.4721337579617835,14.720026820551334,['SLC11A1'],0.29082401177615214,0,0,1
660,Negative Regulation Of Platelet-Derived Growth Factor Receptor Signaling Pathway (GO:0010642),0.1394582873957815,7.4721337579617835,14.720026820551334,['PTPN2'],0.29082401177615214,0,0,1
661,Regulation Of Leukocyte Activation (GO:0002694),0.1394582873957815,7.4721337579617835,14.720026820551334,['PLSCR1'],0.29082401177615214,0,0,1
662,Regulation Of Membrane Protein Ectodomain Proteolysis (GO:0051043),0.1394582873957815,7.4721337579617835,14.720026820551334,['APOE'],0.29082401177615214,0,0,1
663,Negative Regulation Of Type I Interferon-Mediated Signaling Pathway (GO:0060339),0.1394582873957815,7.4721337579617835,14.720026820551334,['PTPN2'],0.29082401177615214,0,0,1
664,Astrocyte Activation (GO:0048143),0.1394582873957815,7.4721337579617835,14.720026820551334,['C5AR1'],0.29082401177615214,0,0,1
665,Regulation Of Neural Precursor Cell Proliferation (GO:2000177),0.1394582873957815,7.4721337579617835,14.720026820551334,['PROX1'],0.29082401177615214,0,0,1
666,Neutrophil Activation (GO:0042119),0.1394582873957815,7.4721337579617835,14.720026820551334,['IL15'],0.29082401177615214,0,0,1
667,Nuclear Migration (GO:0007097),0.1394582873957815,7.4721337579617835,14.720026820551334,['LMNB1'],0.29082401177615214,0,0,1
668,Branched-Chain Amino Acid Transport (GO:0015803),0.1394582873957815,7.4721337579617835,14.720026820551334,['SLC7A5'],0.29082401177615214,0,0,1
669,Regulation Of Response To Endoplasmic Reticulum Stress (GO:1905897),0.1394582873957815,7.4721337579617835,14.720026820551334,['MANF'],0.29082401177615214,0,0,1
670,Phagolysosome Assembly (GO:0001845),0.1394582873957815,7.4721337579617835,14.720026820551334,['RAB20'],0.29082401177615214,0,0,1
671,Pigment Granule Transport (GO:0051904),0.1394582873957815,7.4721337579617835,14.720026820551334,['RAB27A'],0.29082401177615214,0,0,1
672,Regulation Of Tissue Remodeling (GO:0034103),0.1394582873957815,7.4721337579617835,14.720026820551334,['IL15'],0.29082401177615214,0,0,1
673,Platelet-Derived Growth Factor Receptor Signaling Pathway (GO:0048008),0.1394582873957815,7.4721337579617835,14.720026820551334,['PLAT'],0.29082401177615214,0,0,1
674,Positive Regulation Of Alpha-Beta T Cell Activation (GO:0046635),0.1394582873957815,7.4721337579617835,14.720026820551334,['CD55'],0.29082401177615214,0,0,1
675,Response To Cholesterol (GO:0070723),0.1394582873957815,7.4721337579617835,14.720026820551334,['GRAMD1A'],0.29082401177615214,0,0,1
676,Response To Fatty Acid (GO:0070542),0.1394582873957815,7.4721337579617835,14.720026820551334,['PID1'],0.29082401177615214,0,0,1
677,Positive Regulation Of Glucose Metabolic Process (GO:0010907),0.1394582873957815,7.4721337579617835,14.720026820551334,['PTPN2'],0.29082401177615214,0,0,1
678,Positive Regulation Of Glycogen Metabolic Process (GO:0070875),0.1394582873957815,7.4721337579617835,14.720026820551334,['IGF1'],0.29082401177615214,0,0,1
679,Establishment Of Melanosome Localization (GO:0032401),0.1394582873957815,7.4721337579617835,14.720026820551334,['RAB27A'],0.29082401177615214,0,0,1
680,Superoxide Anion Generation (GO:0042554),0.1394582873957815,7.4721337579617835,14.720026820551334,['SH3PXD2B'],0.29082401177615214,0,0,1
681,Extracellular Matrix Disassembly (GO:0022617),0.1394582873957815,7.4721337579617835,14.720026820551334,['SH3PXD2B'],0.29082401177615214,0,0,1
682,Positive Regulation Of Leukocyte Degranulation (GO:0043302),0.1394582873957815,7.4721337579617835,14.720026820551334,['FGR'],0.29082401177615214,0,0,1
683,Positive Regulation Of Regulatory T Cell Differentiation (GO:0045591),0.1394582873957815,7.4721337579617835,14.720026820551334,['BCL6'],0.29082401177615214,0,0,1
684,Positive Regulation Of Transcription From RNA Polymerase II Promoter Involved In Cellular Response To Chemical Stimulus (GO:1901522),0.1394582873957815,7.4721337579617835,14.720026820551334,['HIF1A'],0.29082401177615214,0,0,1
685,Positive Regulation Of Transcription Regulatory Region DNA Binding (GO:2000679),0.1394582873957815,7.4721337579617835,14.720026820551334,['IGF1'],0.29082401177615214,0,0,1
686,Positive Regulation Of Type I Interferon-Mediated Signaling Pathway (GO:0060340),0.1394582873957815,7.4721337579617835,14.720026820551334,['IKBKE'],0.29082401177615214,0,0,1
687,Maintenance Of Protein Localization In Endoplasmic Reticulum (GO:0035437),0.1394582873957815,7.4721337579617835,14.720026820551334,['HSPA5'],0.29082401177615214,0,0,1
688,Melanosome Transport (GO:0032402),0.1394582873957815,7.4721337579617835,14.720026820551334,['RAB27A'],0.29082401177615214,0,0,1
689,Regulation Of NMDA Receptor Activity (GO:2000310),0.1394582873957815,7.4721337579617835,14.720026820551334,['OPRM1'],0.29082401177615214,0,0,1
690,Regulation Of Blood Coagulation (GO:0030193),0.1394582873957815,7.4721337579617835,14.720026820551334,['APOE'],0.29082401177615214,0,0,1
691,Negative Regulation Of Cell Communication (GO:0010648),0.1394582873957815,7.4721337579617835,14.720026820551334,['OPRM1'],0.29082401177615214,0,0,1
692,Negative Regulation Of Protein Modification By Small Protein Conjugation Or Removal (GO:1903321),0.14137496000880895,3.156207827260459,6.17461444483978,"['HSPA1B', 'HSPA1A']",0.29397015493895196,0,0,2
693,Negative Regulation Of Protein Ubiquitination (GO:0031397),0.14137496000880895,3.156207827260459,6.17461444483978,"['HSPA1B', 'HSPA1A']",0.29397015493895196,0,0,2
694,Positive Regulation Of Transferase Activity (GO:0051347),0.14244030478105116,2.3727504244482174,4.6240926215878195,"['PRKCQ', 'ROR2', 'APOE']",0.29575861554682237,0,0,3
695,Negative Regulation Of DNA-templated Transcription (GO:0045892),0.1451294989199474,1.4304369475911864,2.760927605109798,"['TSHZ3', 'PROX1', 'PRDM1', 'PRDM11', 'HIF1A', 'SAP30', 'INSL6', 'PER3', 'NFIL3', 'BCL6', 'HAMP', 'HSPA1A', 'EZH2']",0.30090878840812113,0,0,13
696,Regulation Of Apoptotic Process (GO:0042981),0.14645767006436597,1.5072765072765073,2.8955065582478188,"['RNF144B', 'TNFAIP8', 'BCL6', 'HSPA5', 'PIM1', 'IGF1', 'ECT2', 'JAK3', 'HSPA1B', 'HSPA1A']",0.3025873578420991,0,0,10
697,RNA Catabolic Process (GO:0006401),0.14708992118093756,3.0749506903353057,5.893792336924052,"['HSPA1B', 'HSPA1A']",0.3025873578420991,0,0,2
698,Negative Regulation Of Transcription By RNA Polymerase II (GO:0000122),0.14805893060715444,1.5033783783783783,2.8716705492843055,"['INSL6', 'PER3', 'NFIL3', 'BCL6', 'PROX1', 'PRDM1', 'HAMP', 'SAP30', 'HSPA1A', 'EZH2']",0.3025873578420991,0,0,10
699,Regulation Of Cytoskeleton Organization (GO:0051493),0.150198842684135,2.3114143920595533,4.381968413338192,"['BST2', 'S100A9', 'S100A8']",0.3025873578420991,0,0,3
700,Regulation Of Protein Kinase Activity (GO:0045859),0.150198842684135,2.3114143920595533,4.381968413338192,"['FGR', 'C5AR1', 'ECT2']",0.3025873578420991,0,0,3
701,Positive Regulation Of Macromolecule Biosynthetic Process (GO:0010557),0.150198842684135,2.3114143920595533,4.381968413338192,"['NIBAN1', 'NAMPT', 'IGF1']",0.3025873578420991,0,0,3
702,3'-UTR-mediated mRNA Stabilization (GO:0070935),0.15370743764918757,6.6411889596602975,12.436982716207961,['YBX3'],0.3025873578420991,0,0,1
703,Negative Regulation Of Leukocyte Cell-Cell Adhesion (GO:1903038),0.15370743764918757,6.6411889596602975,12.436982716207961,['JAK3'],0.3025873578420991,0,0,1
704,Negative Regulation Of Lymphocyte Activation (GO:0051250),0.15370743764918757,6.6411889596602975,12.436982716207961,['JAK3'],0.3025873578420991,0,0,1
705,NAD Biosynthetic Process (GO:0009435),0.15370743764918757,6.6411889596602975,12.436982716207961,['NAMPT'],0.3025873578420991,0,0,1
706,Regulation Of Isotype Switching (GO:0045191),0.15370743764918757,6.6411889596602975,12.436982716207961,['INSL6'],0.3025873578420991,0,0,1
707,Acylglycerol Homeostasis (GO:0055090),0.15370743764918757,6.6411889596602975,12.436982716207961,['APOE'],0.3025873578420991,0,0,1
708,Amyloid Precursor Protein Metabolic Process (GO:0042982),0.15370743764918757,6.6411889596602975,12.436982716207961,['APOE'],0.3025873578420991,0,0,1
709,Neural Tube Development (GO:0021915),0.15370743764918757,6.6411889596602975,12.436982716207961,['PROX1'],0.3025873578420991,0,0,1
710,Neuropeptide Signaling Pathway (GO:0007218),0.15370743764918757,6.6411889596602975,12.436982716207961,['OPRM1'],0.3025873578420991,0,0,1
711,Cardiac Muscle Tissue Morphogenesis (GO:0055008),0.15370743764918757,6.6411889596602975,12.436982716207961,['PROX1'],0.3025873578420991,0,0,1
712,Cell Part Morphogenesis (GO:0032990),0.15370743764918757,6.6411889596602975,12.436982716207961,['PID1'],0.3025873578420991,0,0,1
713,Cellular Component Disassembly (GO:0022411),0.15370743764918757,6.6411889596602975,12.436982716207961,['SH3PXD2B'],0.3025873578420991,0,0,1
714,Phagosome Maturation (GO:0090382),0.15370743764918757,6.6411889596602975,12.436982716207961,['RAB20'],0.3025873578420991,0,0,1
715,Regulation Of Steroid Metabolic Process (GO:0019218),0.15370743764918757,6.6411889596602975,12.436982716207961,['APOE'],0.3025873578420991,0,0,1
716,Positive Regulation Of Adenylate Cyclase Activity (GO:0045762),0.15370743764918757,6.6411889596602975,12.436982716207961,['CALCR'],0.3025873578420991,0,0,1
717,Response To Organophosphorus (GO:0046683),0.15370743764918757,6.6411889596602975,12.436982716207961,['ENPP1'],0.3025873578420991,0,0,1
718,Positive Regulation Of Cytokine Production Involved In Inflammatory Response (GO:1900017),0.15370743764918757,6.6411889596602975,12.436982716207961,['HIF1A'],0.3025873578420991,0,0,1
719,Energy Reserve Metabolic Process (GO:0006112),0.15370743764918757,6.6411889596602975,12.436982716207961,['PID1'],0.3025873578420991,0,0,1
720,Positive Regulation Of Lipid Storage (GO:0010884),0.15370743764918757,6.6411889596602975,12.436982716207961,['IKBKE'],0.3025873578420991,0,0,1
721,Toll-Like Receptor 4 Signaling Pathway (GO:0034142),0.15370743764918757,6.6411889596602975,12.436982716207961,['LY96'],0.3025873578420991,0,0,1
722,Positive Regulation Of Nuclear Division (GO:0051785),0.15370743764918757,6.6411889596602975,12.436982716207961,['IGF1'],0.3025873578420991,0,0,1
723,Positive Regulation Of Regulated Secretory Pathway (GO:1903307),0.15370743764918757,6.6411889596602975,12.436982716207961,['RAB27A'],0.3025873578420991,0,0,1
724,Melanosome Localization (GO:0032400),0.15370743764918757,6.6411889596602975,12.436982716207961,['RAB27A'],0.3025873578420991,0,0,1
725,Proteoglycan Metabolic Process (GO:0006029),0.15370743764918757,6.6411889596602975,12.436982716207961,['IGF1'],0.3025873578420991,0,0,1
726,Regulation Of IRE1-mediated Unfolded Protein Response (GO:1903894),0.15370743764918757,6.6411889596602975,12.436982716207961,['HSPA5'],0.3025873578420991,0,0,1
727,Regulation Of T Cell Cytokine Production (GO:0002724),0.15370743764918757,6.6411889596602975,12.436982716207961,['CD55'],0.3025873578420991,0,0,1
728,Regulation Of Amyloid Precursor Protein Catabolic Process (GO:1902991),0.15370743764918757,6.6411889596602975,12.436982716207961,['APOE'],0.3025873578420991,0,0,1
729,Regulation Of Amyloid-Beta Clearance (GO:1900221),0.15370743764918757,6.6411889596602975,12.436982716207961,['APOE'],0.3025873578420991,0,0,1
730,Regulation Of Behavior (GO:0050795),0.15370743764918757,6.6411889596602975,12.436982716207961,['APOE'],0.3025873578420991,0,0,1
731,Regulation Of Brown Fat Cell Differentiation (GO:0090335),0.15370743764918757,6.6411889596602975,12.436982716207961,['PIM1'],0.3025873578420991,0,0,1
732,Cellular Response To Organic Cyclic Compound (GO:0071407),0.15412846679812683,2.281910984075133,4.267102400121478,"['SPP1', 'HSPA1B', 'HSPA1A']",0.3025873578420991,0,0,3
733,Positive Regulation Of Cell Projection Organization (GO:0031346),0.15412846679812683,2.281910984075133,4.267102400121478,"['ROR2', 'APOE', 'S100A9']",0.3025873578420991,0,0,3
734,Negative Regulation Of Cell Motility (GO:2000146),0.15412846679812683,2.281910984075133,4.267102400121478,"['BST2', 'ALOX15B', 'SAP30']",0.3025873578420991,0,0,3
735,Regulation Of Interleukin-1 Beta Production (GO:0032651),0.15865711137317517,2.92432770481551,5.383716365569764,"['CX3CR1', 'IGF1']",0.30749054339146653,0,0,2
736,Activation Of Cysteine-Type Endopeptidase Activity Involved In Apoptotic Process (GO:0006919),0.15865711137317517,2.92432770481551,5.383716365569764,"['S100A9', 'S100A8']",0.30749054339146653,0,0,2
737,B Cell Activation (GO:0042113),0.16450326268021284,2.8543956043956045,5.151684190049802,"['JAK3', 'PTPN2']",0.30749054339146653,0,0,2
738,Negative Regulation Of Intrinsic Apoptotic Signaling Pathway (GO:2001243),0.16450326268021284,2.8543956043956045,5.151684190049802,"['YBX3', 'HSPA1A']",0.30749054339146653,0,0,2
739,Positive Regulation Of Growth (GO:0045927),0.16450326268021284,2.8543956043956045,5.151684190049802,"['S100A9', 'S100A8']",0.30749054339146653,0,0,2
740,Telomere Organization (GO:0032200),0.16450326268021284,2.8543956043956045,5.151684190049802,"['INSL6', 'EZH2']",0.30749054339146653,0,0,2
741,Wound Healing (GO:0042060),0.16450326268021284,2.8543956043956045,5.151684190049802,"['SLC11A1', 'IGF1']",0.30749054339146653,0,0,2
742,Positive Regulation Of Phosphorylation (GO:0042327),0.1652773450989586,1.9258181818181819,3.466723732233925,"['NIBAN1', 'LIMK2', 'FAM20A', 'ROR2']",0.30749054339146653,0,0,4
743,Cellular Response To Oxidative Stress (GO:0034599),0.16610741156188036,2.19771833202203,3.945169543719839,"['HIF1A', 'HSPA1B', 'HSPA1A']",0.30749054339146653,0,0,3
744,Response To Endoplasmic Reticulum Stress (GO:0034976),0.16610741156188036,2.19771833202203,3.945169543719839,"['NIBAN1', 'HSPA5', 'CASP4']",0.30749054339146653,0,0,3
745,Negative Regulation Of Endoplasmic Reticulum Unfolded Protein Response (GO:1900102),0.16772211457716357,5.976433121019109,10.67060308640354,['HSPA5'],0.30749054339146653,0,0,1
746,Negative Regulation Of Fatty Acid Biosynthetic Process (GO:0045717),0.16772211457716357,5.976433121019109,10.67060308640354,['APOC1'],0.30749054339146653,0,0,1
747,Regulation Of Cytokine Production Involved In Immune Response (GO:0002718),0.16772211457716357,5.976433121019109,10.67060308640354,['SLC7A5'],0.30749054339146653,0,0,1
748,G Protein-Coupled Acetylcholine Receptor Signaling Pathway (GO:0007213),0.16772211457716357,5.976433121019109,10.67060308640354,['OPRM1'],0.30749054339146653,0,0,1
749,Negative Regulation Of Oxidative Stress-Induced Intrinsic Apoptotic Signaling Pathway (GO:1902176),0.16772211457716357,5.976433121019109,10.67060308640354,['HIF1A'],0.30749054339146653,0,0,1
750,Activation Of NF-kappaB-inducing Kinase Activity (GO:0007250),0.16772211457716357,5.976433121019109,10.67060308640354,['CHI3L1'],0.30749054339146653,0,0,1
751,Negative Regulation Of Receptor Signaling Pathway Via JAK-STAT (GO:0046426),0.16772211457716357,5.976433121019109,10.67060308640354,['PTPN2'],0.30749054339146653,0,0,1
752,Activation Of Phospholipase C Activity (GO:0007202),0.16772211457716357,5.976433121019109,10.67060308640354,['C5AR1'],0.30749054339146653,0,0,1
753,Negative Regulation Of Release Of Cytochrome C From Mitochondria (GO:0090201),0.16772211457716357,5.976433121019109,10.67060308640354,['IGF1'],0.30749054339146653,0,0,1
754,Amino Acid Import Across Plasma Membrane (GO:0089718),0.16772211457716357,5.976433121019109,10.67060308640354,['SLC7A5'],0.30749054339146653,0,0,1
755,Negative Regulation Of Tumor Necrosis Factor-Mediated Signaling Pathway (GO:0010804),0.16772211457716357,5.976433121019109,10.67060308640354,['PTPN2'],0.30749054339146653,0,0,1
756,Antimicrobial Humoral Immune Response Mediated By Antimicrobial Peptide (GO:0061844),0.16772211457716357,5.976433121019109,10.67060308640354,['S100A9'],0.30749054339146653,0,0,1
757,Axonal Transport Of Mitochondrion (GO:0019896),0.16772211457716357,5.976433121019109,10.67060308640354,['HIF1A'],0.30749054339146653,0,0,1
758,Calcium-Dependent Cell-Cell Adhesion Via Plasma Membrane Cell Adhesion Molecules (GO:0016339),0.16772211457716357,5.976433121019109,10.67060308640354,['CDH26'],0.30749054339146653,0,0,1
759,Carbohydrate Derivative Transport (GO:1901264),0.16772211457716357,5.976433121019109,10.67060308640354,['PLTP'],0.30749054339146653,0,0,1
760,Phosphatidylserine Metabolic Process (GO:0006658),0.16772211457716357,5.976433121019109,10.67060308640354,['PLSCR1'],0.30749054339146653,0,0,1
761,Regulation Of Transcription Regulatory Region DNA Binding (GO:2000677),0.16772211457716357,5.976433121019109,10.67060308640354,['IGF1'],0.30749054339146653,0,0,1
762,Regulation Of Vascular Endothelial Growth Factor Production (GO:0010574),0.16772211457716357,5.976433121019109,10.67060308640354,['HIF1A'],0.30749054339146653,0,0,1
763,Positive Regulation Of Rho Protein Signal Transduction (GO:0035025),0.16772211457716357,5.976433121019109,10.67060308640354,['GPR65'],0.30749054339146653,0,0,1
764,Positive Regulation Of T Cell Cytokine Production (GO:0002726),0.16772211457716357,5.976433121019109,10.67060308640354,['CD55'],0.30749054339146653,0,0,1
765,Response To ATP (GO:0033198),0.16772211457716357,5.976433121019109,10.67060308640354,['ENPP1'],0.30749054339146653,0,0,1
766,Response To Chemokine (GO:1990868),0.16772211457716357,5.976433121019109,10.67060308640354,['DUSP1'],0.30749054339146653,0,0,1
767,Positive Regulation Of Cell Cycle Phase Transition (GO:1901989),0.16772211457716357,5.976433121019109,10.67060308640354,['EZH2'],0.30749054339146653,0,0,1
768,Positive Regulation Of Cytoplasmic Translation (GO:2000767),0.16772211457716357,5.976433121019109,10.67060308640354,['YBX3'],0.30749054339146653,0,0,1
769,Sterol Transport (GO:0015918),0.16772211457716357,5.976433121019109,10.67060308640354,['GRAMD1A'],0.30749054339146653,0,0,1
770,Positive Regulation Of Immunoglobulin Mediated Immune Response (GO:0002891),0.16772211457716357,5.976433121019109,10.67060308640354,['INSL6'],0.30749054339146653,0,0,1
771,Positive Regulation Of Isotype Switching (GO:0045830),0.16772211457716357,5.976433121019109,10.67060308640354,['INSL6'],0.30749054339146653,0,0,1
772,Synaptic Vesicle Localization (GO:0097479),0.16772211457716357,5.976433121019109,10.67060308640354,['RAB27A'],0.30749054339146653,0,0,1
773,Female Gamete Generation (GO:0007292),0.16772211457716357,5.976433121019109,10.67060308640354,['MEI4'],0.30749054339146653,0,0,1
774,Positive Regulation Of Muscle Hypertrophy (GO:0014742),0.16772211457716357,5.976433121019109,10.67060308640354,['IGF1'],0.30749054339146653,0,0,1
775,Growth Hormone Receptor Signaling Pathway (GO:0060396),0.16772211457716357,5.976433121019109,10.67060308640354,['JAK3'],0.30749054339146653,0,0,1
776,Icosanoid Biosynthetic Process (GO:0046456),0.16772211457716357,5.976433121019109,10.67060308640354,['LTC4S'],0.30749054339146653,0,0,1
777,Intracellular Lipid Transport (GO:0032365),0.16772211457716357,5.976433121019109,10.67060308640354,['GRAMD1A'],0.30749054339146653,0,0,1
778,"Positive Regulation Of Synaptic Transmission, Glutamatergic (GO:0051968)",0.16772211457716357,5.976433121019109,10.67060308640354,['TSHZ3'],0.30749054339146653,0,0,1
779,Positive Regulation Of Telomere Capping (GO:1904355),0.16772211457716357,5.976433121019109,10.67060308640354,['PRKCQ'],0.30749054339146653,0,0,1
780,Positive Regulation Of Vascular Endothelial Growth Factor Production (GO:0010575),0.16772211457716357,5.976433121019109,10.67060308640354,['HIF1A'],0.30749054339146653,0,0,1
781,Leukotriene Metabolic Process (GO:0006691),0.16772211457716357,5.976433121019109,10.67060308640354,['LTC4S'],0.30749054339146653,0,0,1
782,Macrophage Differentiation (GO:0030225),0.16772211457716357,5.976433121019109,10.67060308640354,['IL15'],0.30749054339146653,0,0,1
783,Regulation Of ATP Biosynthetic Process (GO:2001169),0.16772211457716357,5.976433121019109,10.67060308640354,['PID1'],0.30749054339146653,0,0,1
784,Negative Regulation Of T Cell Receptor Signaling Pathway (GO:0050860),0.16772211457716357,5.976433121019109,10.67060308640354,['PTPN2'],0.30749054339146653,0,0,1
785,Negative Regulation Of Cell Development (GO:0010721),0.16772211457716357,5.976433121019109,10.67060308640354,['IGF1'],0.30749054339146653,0,0,1
786,Regulation Of Cardiac Muscle Cell Proliferation (GO:0060043),0.16772211457716357,5.976433121019109,10.67060308640354,['PIM1'],0.30749054339146653,0,0,1
787,Regulation Of Transcription By RNA Polymerase II (GO:0006357),0.16959983353952565,1.2908506541522378,2.2903737900540833,"['MGAM', 'PID1', 'TSHZ3', 'CEBPD', 'SLC11A1', 'IGF1', 'PROX1', 'PRDM1', 'HIF1A', 'LITAF', 'MED12L', 'SAP30', 'INSL6', 'PLSCR1', 'PER3', 'NFIL3', 'BCL6', 'NAMPT', 'HAMP', 'HSPA1A', 'EZH2']",0.3104019861054771,0,0,21
788,Receptor-Mediated Endocytosis (GO:0006898),0.17016061260362264,2.1710066070734553,3.8448798559351007,"['STAB1', 'LDLRAD3', 'APOE']",0.3104019861054771,0,0,3
789,Regulation Of Innate Immune Response (GO:0045088),0.17038721097115364,2.787716159809183,4.933370329649354,"['FGR', 'PLSCR1']",0.3104019861054771,0,0,2
790,Negative Regulation Of Transforming Growth Factor Beta Receptor Signaling Pathway (GO:0030512),0.17038721097115364,2.787716159809183,4.933370329649354,"['SAP30', 'HSPA1A']",0.3104019861054771,0,0,2
791,Negative Regulation Of Cellular Catabolic Process (GO:0031330),0.17038721097115364,2.787716159809183,4.933370329649354,"['APOC1', 'TBC1D14']",0.3104019861054771,0,0,2
792,Phagocytosis (GO:0006909),0.1763061313526701,2.724067599067599,4.727710335361971,"['CD93', 'SLC11A1']",0.3183427173160381,0,0,2
793,Cellular Response To Hormone Stimulus (GO:0032870),0.1763061313526701,2.724067599067599,4.727710335361971,"['HSPA1B', 'HSPA1A']",0.3183427173160381,0,0,2
794,Negative Regulation Of Cell Adhesion (GO:0007162),0.1763061313526701,2.724067599067599,4.727710335361971,"['DUSP1', 'TGFBI']",0.3183427173160381,0,0,2
795,Negative Regulation Of Endoplasmic Reticulum Stress-Induced Intrinsic Apoptotic Signaling Pathway (GO:1902236),0.18150615217760246,5.432541980312681,9.270446713779874,['HSPA1A'],0.3183427173160381,0,0,1
