Rank,Term name,P-value,Z-score,Combined score,Overlapping genes,Adjusted p-value,Old p-value,Old adjusted p-value,gene count
1,Cytoplasmic Translation (GO:0002181),3.1677552197994085e-13,216.5625,6232.79500689754,"['RPS15A', 'RPL18A', 'RPS19', 'RPL12', 'RPLP1', 'RPS2', 'RPL26', 'RPS10', 'RPS13']",6.683963513776751e-11,0,0,9
2,Translation (GO:0006412),1.2439474786377452e-12,144.1875,3952.5732004102993,"['RPS15A', 'RPL18A', 'RPS19', 'RPL12', 'RPLP1', 'RPS2', 'RPL26', 'RPS10', 'RPS13']",1.3123645899628212e-10,0,0,9
3,Peptide Biosynthetic Process (GO:0043043),3.968853065455462e-12,108.0,2835.2747480426915,"['RPS15A', 'RPL18A', 'RPS19', 'RPL12', 'RPLP1', 'RPS2', 'RPL26', 'RPS10', 'RPS13']",2.791426656037008e-10,0,0,9
4,Macromolecule Biosynthetic Process (GO:0009059),6.007119645711246e-11,61.473214285714285,1446.80226001923,"['RPS15A', 'RPL18A', 'RPS19', 'RPL12', 'RPLP1', 'RPS2', 'RPL26', 'RPS10', 'RPS13']",3.1687556131126825e-09,0,0,9
5,Gene Expression (GO:0010467),2.336098085223792e-09,32.84134615384615,652.7146539938442,"['RPS15A', 'RPL18A', 'RPS19', 'RPL12', 'RPLP1', 'RPS2', 'RPL26', 'RPS10', 'RPS13']",9.858333919644403e-08,0,0,9
6,Ribonucleoprotein Complex Biogenesis (GO:0022613),3.710057301219321e-06,146.85714285714286,1836.369743858654,"['RPS15A', 'RPS19', 'RPL26', 'RPS13']",0.0001118317272224681,0,0,4
7,Ribosome Biogenesis (GO:0042254),3.710057301219321e-06,146.85714285714286,1836.369743858654,"['RPS15A', 'RPS19', 'RPL26', 'RPS13']",0.0001118317272224681,0,0,4
8,Ribosomal Small Subunit Biogenesis (GO:0042274),2.736010182444298e-05,inf,inf,"['RPS15A', 'RPS19', 'RPS13']",0.0007216226856196836,0,0,3
9,rRNA Metabolic Process (GO:0016072),0.0009457357786472945,inf,inf,"['RPS19', 'RPL26']",0.019955024929457915,0,0,2
10,ncRNA Processing (GO:0034470),0.0009457357786472945,inf,inf,"['RPS19', 'RPL26']",0.019955024929457915,0,0,2
11,Positive Regulation Of Signaling (GO:0023056),0.0027825027717474967,67.04347826086956,394.510943744506,"['RIMS2', 'CLSTN2']",0.04892567373656015,0,0,2
12,Positive Regulation Of Cell Communication (GO:0010647),0.0027825027717474967,67.04347826086956,394.510943744506,"['RIMS2', 'CLSTN2']",0.04892567373656015,0,0,2
13,rRNA Processing (GO:0006364),0.005457853806790003,33.47826086956522,174.44516193382893,"['RPS19', 'RPL26']",0.08225765380233505,0,0,2
14,Positive Regulation Of Developmental Growth (GO:0048639),0.005457853806790003,33.47826086956522,174.44516193382893,"['RIMS2', 'PPIB']",0.08225765380233505,0,0,2
15,Regulation Of RNA Splicing (GO:0043484),0.008921535423850883,22.28985507246377,105.19222805619401,"['SRRM4', 'RPS13']",0.11765274840203352,0,0,2
16,Positive Regulation Of Synaptic Transmission (GO:0050806),0.008921535423850883,22.28985507246377,105.19222805619401,"['RIMS2', 'CLSTN2']",0.11765274840203352,0,0,2
17,Protein O-linked Glycosylation Via Serine (GO:0018242),0.03136744934117426,inf,inf,['GALNT13'],0.13037531819752488,0,0,1
18,Spontaneous Synaptic Transmission (GO:0098814),0.03136744934117426,inf,inf,['RIMS2'],0.13037531819752488,0,0,1
19,mRNA Processing (GO:0006397),0.03136744934117426,inf,inf,['SRRM4'],0.13037531819752488,0,0,1
20,Protein Insertion Into Mitochondrial Inner Membrane (GO:0045039),0.03136744934117426,inf,inf,['TIMM8B'],0.13037531819752488,0,0,1
21,Regulation Of Dendrite Extension (GO:1903859),0.03136744934117426,inf,inf,['RIMS2'],0.13037531819752488,0,0,1
22,Maturation Of SSU-rRNA (GO:0030490),0.03136744934117426,inf,inf,['RPS19'],0.13037531819752488,0,0,1
23,Positive Regulation Of Intrinsic Apoptotic Signaling Pathway By P53 Class Mediator (GO:1902255),0.03136744934117426,inf,inf,['RPL26'],0.13037531819752488,0,0,1
24,Cellular Response To Gamma Radiation (GO:0071480),0.03136744934117426,inf,inf,['RPL26'],0.13037531819752488,0,0,1
25,Regulation Of Telomerase RNA Localization To Cajal Body (GO:1904872),0.03136744934117426,inf,inf,['NOP10'],0.13037531819752488,0,0,1
26,O-glycan Processing (GO:0016266),0.03136744934117426,inf,inf,['GALNT13'],0.13037531819752488,0,0,1
27,Pseudouridine Synthesis (GO:0001522),0.03136744934117426,inf,inf,['NOP10'],0.13037531819752488,0,0,1
28,Positive Regulation Of Multicellular Organism Growth (GO:0040018),0.03136744934117426,inf,inf,['PPIB'],0.13037531819752488,0,0,1
29,Cellular Response To Light Stimulus (GO:0071482),0.03136744934117426,inf,inf,['RPL26'],0.13037531819752488,0,0,1
30,RNA Modification (GO:0009451),0.03136744934117426,inf,inf,['NOP10'],0.13037531819752488,0,0,1
31,Positive Regulation By Host Of Viral Genome Replication (GO:0044829),0.03136744934117426,inf,inf,['PPIB'],0.13037531819752488,0,0,1
32,"Positive Regulation Of DNA Damage Response, Signal Transduction By P53 Class Mediator (GO:0043517)",0.03136744934117426,inf,inf,['RPL26'],0.13037531819752488,0,0,1
33,rRNA Modification (GO:0000154),0.03136744934117426,inf,inf,['NOP10'],0.13037531819752488,0,0,1
34,Modulation By Host Of Viral Genome Replication (GO:0044827),0.03136744934117426,inf,inf,['PPIB'],0.13037531819752488,0,0,1
35,rRNA Pseudouridine Synthesis (GO:0031118),0.03136744934117426,inf,inf,['NOP10'],0.13037531819752488,0,0,1
36,Regulation Of Intrinsic Apoptotic Signaling Pathway In Response To DNA Damage By P53 Class Mediator (GO:1902165),0.03136744934117426,inf,inf,['RPL26'],0.13037531819752488,0,0,1
37,"Regulation Of DNA Damage Response, Signal Transduction By P53 Class Mediator Resulting In Transcription Of P21 Class Mediator (GO:1902162)",0.03136744934117426,inf,inf,['RPL26'],0.13037531819752488,0,0,1
38,Negative Regulation Of Synaptic Transmission (GO:0050805),0.03136744934117426,inf,inf,['HCN1'],0.13037531819752488,0,0,1
39,Response To Gamma Radiation (GO:0010332),0.03136744934117426,inf,inf,['RPL26'],0.13037531819752488,0,0,1
40,Positive Regulation Of Respiratory Burst (GO:0060267),0.03136744934117426,inf,inf,['RPS19'],0.13037531819752488,0,0,1
41,Regulation Of Microtubule Cytoskeleton Organization (GO:0070507),0.03136744934117426,inf,inf,['CDK2AP2'],0.13037531819752488,0,0,1
42,Regulation Of Microtubule-Based Process (GO:0032886),0.03136744934117426,inf,inf,['CDK2AP2'],0.13037531819752488,0,0,1
43,Negative Regulation Of RNA Metabolic Process (GO:0051253),0.03136744934117426,inf,inf,['RPS13'],0.13037531819752488,0,0,1
44,Negative Regulation Of RNA Splicing (GO:0033119),0.03136744934117426,inf,inf,['RPS13'],0.13037531819752488,0,0,1
45,Insulin Secretion (GO:0030073),0.03136744934117426,inf,inf,['RIMS2'],0.13037531819752488,0,0,1
46,Positive Regulation Of Telomerase RNA Localization To Cajal Body (GO:1904874),0.03136744934117426,inf,inf,['NOP10'],0.13037531819752488,0,0,1
47,Ribosomal Small Subunit Assembly (GO:0000028),0.03136744934117426,inf,inf,['RPS19'],0.13037531819752488,0,0,1
48,Positive Regulation Of Dendrite Extension (GO:1903861),0.03136744934117426,inf,inf,['RIMS2'],0.13037531819752488,0,0,1
49,Positive Regulation Of Ubiquitin-Protein Transferase Activity (GO:0051443),0.03136744934117426,inf,inf,['RPS2'],0.13037531819752488,0,0,1
50,snRNA Modification (GO:0040031),0.03136744934117426,inf,inf,['NOP10'],0.13037531819752488,0,0,1
51,Mitochondrion Organization (GO:0007005),0.04370169524764498,7.371980676328502,23.07701524239319,"['TIMM8B', 'FMC1']",0.13037531819752488,0,0,2
52,Nucleus Organization (GO:0006997),0.06178925033058051,32.125,89.43683115467843,['RPS19'],0.13037531819752488,0,0,1
53,Calcium Ion-Regulated Exocytosis Of Neurotransmitter (GO:0048791),0.06178925033058051,32.125,89.43683115467843,['RIMS2'],0.13037531819752488,0,0,1
54,Calcium-Ion Regulated Exocytosis (GO:0017156),0.06178925033058051,32.125,89.43683115467843,['RIMS2'],0.13037531819752488,0,0,1
55,Protein O-linked Glycosylation Via Threonine (GO:0018243),0.06178925033058051,32.125,89.43683115467843,['GALNT13'],0.13037531819752488,0,0,1
56,Positive Regulation Of Immune Effector Process (GO:0002699),0.06178925033058051,32.125,89.43683115467843,['RPS19'],0.13037531819752488,0,0,1
57,"DNA Damage Response, Signal Transduction By P53 Class Mediator (GO:0030330)",0.06178925033058051,32.125,89.43683115467843,['RPL26'],0.13037531819752488,0,0,1
58,"DNA Damage Response, Signal Transduction By P53 Class Mediator Resulting In Cell Cycle Arrest (GO:0006977)",0.06178925033058051,32.125,89.43683115467843,['RPL26'],0.13037531819752488,0,0,1
59,Protein Homotetramerization (GO:0051289),0.06178925033058051,32.125,89.43683115467843,['HCN1'],0.13037531819752488,0,0,1
60,Peptide Hormone Secretion (GO:0030072),0.06178925033058051,32.125,89.43683115467843,['RIMS2'],0.13037531819752488,0,0,1
61,Protein Insertion Into Mitochondrial Membrane (GO:0051204),0.06178925033058051,32.125,89.43683115467843,['TIMM8B'],0.13037531819752488,0,0,1
62,"Maturation Of SSU-rRNA From Tricistronic rRNA Transcript (SSU-rRNA, 5.8S rRNA, LSU-rRNA) (GO:0000462)",0.06178925033058051,32.125,89.43683115467843,['RPS19'],0.13037531819752488,0,0,1
63,Synaptic Vesicle Exocytosis (GO:0016079),0.06178925033058051,32.125,89.43683115467843,['RIMS2'],0.13037531819752488,0,0,1
64,Cellular Respiration (GO:0045333),0.06178925033058051,32.125,89.43683115467843,['UQCRQ'],0.13037531819752488,0,0,1
65,Telomere Maintenance Via Telomerase (GO:0007004),0.06178925033058051,32.125,89.43683115467843,['NOP10'],0.13037531819752488,0,0,1
66,Telomere Maintenance Via Telomere Lengthening (GO:0010833),0.06178925033058051,32.125,89.43683115467843,['NOP10'],0.13037531819752488,0,0,1
67,Cellular Response To cAMP (GO:0071320),0.06178925033058051,32.125,89.43683115467843,['HCN1'],0.13037531819752488,0,0,1
68,Protein Peptidyl-Prolyl Isomerization (GO:0000413),0.06178925033058051,32.125,89.43683115467843,['PPIB'],0.13037531819752488,0,0,1
69,Protein Tetramerization (GO:0051262),0.06178925033058051,32.125,89.43683115467843,['HCN1'],0.13037531819752488,0,0,1
70,Mitochondrial ATP Synthesis Coupled Electron Transport (GO:0042775),0.06178925033058051,32.125,89.43683115467843,['UQCRQ'],0.13037531819752488,0,0,1
71,Negative Regulation Of Mitotic Cell Cycle Phase Transition (GO:1901991),0.06178925033058051,32.125,89.43683115467843,['CDK2AP2'],0.13037531819752488,0,0,1
72,Regulation Of Synaptic Vesicle Exocytosis (GO:2000300),0.06178925033058051,32.125,89.43683115467843,['RIMS2'],0.13037531819752488,0,0,1
73,"Mitochondrial Electron Transport, Ubiquinol To Cytochrome C (GO:0006122)",0.06178925033058051,32.125,89.43683115467843,['UQCRQ'],0.13037531819752488,0,0,1
74,Proton-Transporting ATP Synthase Complex Assembly (GO:0043461),0.06178925033058051,32.125,89.43683115467843,['FMC1'],0.13037531819752488,0,0,1
75,Mitochondrial Proton-Transporting ATP Synthase Complex Assembly (GO:0033615),0.06178925033058051,32.125,89.43683115467843,['FMC1'],0.13037531819752488,0,0,1
76,RNA Processing (GO:0006396),0.06178925033058051,32.125,89.43683115467843,['SRRM4'],0.13037531819752488,0,0,1
77,Mitotic G1 DNA Damage Checkpoint Signaling (GO:0031571),0.06178925033058051,32.125,89.43683115467843,['RPL26'],0.13037531819752488,0,0,1
78,Positive Regulation By Host Of Viral Process (GO:0044794),0.06178925033058051,32.125,89.43683115467843,['PPIB'],0.13037531819752488,0,0,1
79,RNA-templated DNA Biosynthetic Process (GO:0006278),0.06178925033058051,32.125,89.43683115467843,['NOP10'],0.13037531819752488,0,0,1
80,Modulation By Host Of Viral Process (GO:0044788),0.06178925033058051,32.125,89.43683115467843,['PPIB'],0.13037531819752488,0,0,1
81,Regulation Of Ubiquitin-Protein Transferase Activity (GO:0051438),0.06178925033058051,32.125,89.43683115467843,['RPS2'],0.13037531819752488,0,0,1
82,Regulated Exocytosis (GO:0045055),0.06178925033058051,32.125,89.43683115467843,['RIMS2'],0.13037531819752488,0,0,1
83,Regulation Of Viral Transcription (GO:0046782),0.06178925033058051,32.125,89.43683115467843,['IFITM3'],0.13037531819752488,0,0,1
84,Regulation Of G1/S Transition Of Mitotic Cell Cycle (GO:2000045),0.06178925033058051,32.125,89.43683115467843,['CDK2AP2'],0.13037531819752488,0,0,1
85,Aerobic Electron Transport Chain (GO:0019646),0.06178925033058051,32.125,89.43683115467843,['UQCRQ'],0.13037531819752488,0,0,1
86,Regulation Of SA Node Cell Action Potential (GO:0098907),0.06178925033058051,32.125,89.43683115467843,['HCN1'],0.13037531819752488,0,0,1
87,Regulation Of Membrane Depolarization (GO:0003254),0.06178925033058051,32.125,89.43683115467843,['HCN1'],0.13037531819752488,0,0,1
88,Negative Regulation Of G1/S Transition Of Mitotic Cell Cycle (GO:2000134),0.06178925033058051,32.125,89.43683115467843,['CDK2AP2'],0.13037531819752488,0,0,1
89,Inner Mitochondrial Membrane Organization (GO:0007007),0.06178925033058051,32.125,89.43683115467843,['TIMM8B'],0.13037531819752488,0,0,1
90,Negative Regulation Of Viral Transcription (GO:0032897),0.06178925033058051,32.125,89.43683115467843,['IFITM3'],0.13037531819752488,0,0,1
91,Regulation Of Multicellular Organism Growth (GO:0040014),0.06178925033058051,32.125,89.43683115467843,['PPIB'],0.13037531819752488,0,0,1
92,Neuron Maturation (GO:0042551),0.06178925033058051,32.125,89.43683115467843,['SRRM4'],0.13037531819752488,0,0,1
93,Ribosome Assembly (GO:0042255),0.06178925033058051,32.125,89.43683115467843,['RPS19'],0.13037531819752488,0,0,1
94,Neurotransmitter Secretion (GO:0007269),0.06178925033058051,32.125,89.43683115467843,['RIMS2'],0.13037531819752488,0,0,1
95,Negative Regulation Of Cell Cycle G1/S Phase Transition (GO:1902807),0.06178925033058051,32.125,89.43683115467843,['CDK2AP2'],0.13037531819752488,0,0,1
96,Regulation Of Cell Division (GO:0051302),0.06178925033058051,32.125,89.43683115467843,['CDK2AP2'],0.13037531819752488,0,0,1
97,Bone Development (GO:0060348),0.06178925033058051,32.125,89.43683115467843,['PPIB'],0.13037531819752488,0,0,1
98,Positive Regulation Of Excitatory Postsynaptic Potential (GO:2000463),0.06178925033058051,32.125,89.43683115467843,['RIMS2'],0.13037531819752488,0,0,1
99,Sodium Ion Transmembrane Transport (GO:0035725),0.06178925033058051,32.125,89.43683115467843,['HCN1'],0.13037531819752488,0,0,1
100,Sodium Ion Transport (GO:0006814),0.06178925033058051,32.125,89.43683115467843,['HCN1'],0.13037531819752488,0,0,1
101,Modulation Of Chemical Synaptic Transmission (GO:0050804),0.06826766898315564,5.507246376811594,14.783206044122451,"['RIMS2', 'CLSTN2']",0.14261859559847367,0,0,2
102,Negative Regulation Of Immune Effector Process (GO:0002698),0.09129267922258272,16.041666666666668,38.39869171531855,['RPS19'],0.16463893432448679,0,0,1
103,Peptidyl-Proline Modification (GO:0018208),0.09129267922258272,16.041666666666668,38.39869171531855,['PPIB'],0.16463893432448679,0,0,1
104,Peptidyl-Threonine Modification (GO:0018210),0.09129267922258272,16.041666666666668,38.39869171531855,['GALNT13'],0.16463893432448679,0,0,1
105,Regulation Of Secretion By Cell (GO:1903530),0.09129267922258272,16.041666666666668,38.39869171531855,['RIMS2'],0.16463893432448679,0,0,1
106,protein-RNA Complex Assembly (GO:0022618),0.09129267922258272,16.041666666666668,38.39869171531855,['RPS19'],0.16463893432448679,0,0,1
107,Mitochondrial Transport (GO:0006839),0.09129267922258272,16.041666666666668,38.39869171531855,['TIMM8B'],0.16463893432448679,0,0,1
108,Positive Regulation Of Nervous System Process (GO:0031646),0.09129267922258272,16.041666666666668,38.39869171531855,['RIMS2'],0.16463893432448679,0,0,1
109,Modulation Of Excitatory Postsynaptic Potential (GO:0098815),0.09129267922258272,16.041666666666668,38.39869171531855,['RIMS2'],0.16463893432448679,0,0,1
110,Monocyte Chemotaxis (GO:0002548),0.09129267922258272,16.041666666666668,38.39869171531855,['RPS19'],0.16463893432448679,0,0,1
111,Response To UV (GO:0009411),0.09129267922258272,16.041666666666668,38.39869171531855,['RPL26'],0.16463893432448679,0,0,1
112,Positive Regulation Of Amide Metabolic Process (GO:0034250),0.09129267922258272,16.041666666666668,38.39869171531855,['RPL26'],0.16463893432448679,0,0,1
113,"Regulation Of mRNA Splicing, Via Spliceosome (GO:0048024)",0.09129267922258272,16.041666666666668,38.39869171531855,['SRRM4'],0.16463893432448679,0,0,1
114,"Regulation Of Alternative mRNA Splicing, Via Spliceosome (GO:0000381)",0.09129267922258272,16.041666666666668,38.39869171531855,['SRRM4'],0.16463893432448679,0,0,1
115,Positive Regulation Of Synapse Assembly (GO:0051965),0.09129267922258272,16.041666666666668,38.39869171531855,['CLSTN2'],0.16463893432448679,0,0,1
116,Ribosomal Large Subunit Biogenesis (GO:0042273),0.09129267922258272,16.041666666666668,38.39869171531855,['RPL26'],0.16463893432448679,0,0,1
117,Positive Regulation Of Translation (GO:0045727),0.09129267922258272,16.041666666666668,38.39869171531855,['RPL26'],0.16463893432448679,0,0,1
118,mRNA Metabolic Process (GO:0016071),0.11990432605148374,10.680555555555555,22.654111311563156,['SRRM4'],0.1744814675645729,0,0,1
119,Erythrocyte Differentiation (GO:0030218),0.11990432605148374,10.680555555555555,22.654111311563156,['RPS19'],0.1744814675645729,0,0,1
120,Cardiac Conduction (GO:0061337),0.11990432605148374,10.680555555555555,22.654111311563156,['HCN1'],0.1744814675645729,0,0,1
121,Establishment Of Protein Localization To Mitochondrion (GO:0072655),0.11990432605148374,10.680555555555555,22.654111311563156,['TIMM8B'],0.1744814675645729,0,0,1
122,Regulation Of Regulated Secretory Pathway (GO:1903305),0.11990432605148374,10.680555555555555,22.654111311563156,['RIMS2'],0.1744814675645729,0,0,1
123,Cellular Response To UV (GO:0034644),0.11990432605148374,10.680555555555555,22.654111311563156,['RPL26'],0.1744814675645729,0,0,1
124,Regulation Of Exocytosis (GO:0017157),0.11990432605148374,10.680555555555555,22.654111311563156,['RIMS2'],0.1744814675645729,0,0,1
125,Protein Targeting (GO:0006605),0.11990432605148374,10.680555555555555,22.654111311563156,['TIMM8B'],0.1744814675645729,0,0,1
126,Regulation Of Heart Rate By Cardiac Conduction (GO:0086091),0.11990432605148374,10.680555555555555,22.654111311563156,['HCN1'],0.1744814675645729,0,0,1
127,Type I Interferon-Mediated Signaling Pathway (GO:0060337),0.11990432605148374,10.680555555555555,22.654111311563156,['IFITM3'],0.1744814675645729,0,0,1
128,Cellular Response To Type I Interferon (GO:0071357),0.11990432605148374,10.680555555555555,22.654111311563156,['IFITM3'],0.1744814675645729,0,0,1
129,Regulation Of Viral Entry Into Host Cell (GO:0046596),0.11990432605148374,10.680555555555555,22.654111311563156,['IFITM3'],0.1744814675645729,0,0,1
130,Response To cAMP (GO:0051591),0.11990432605148374,10.680555555555555,22.654111311563156,['HCN1'],0.1744814675645729,0,0,1
131,Regulation Of RNA Metabolic Process (GO:0051252),0.11990432605148374,10.680555555555555,22.654111311563156,['SRRM4'],0.1744814675645729,0,0,1
132,Positive Regulation Of Protein Ubiquitination (GO:0031398),0.11990432605148374,10.680555555555555,22.654111311563156,['RPS2'],0.1744814675645729,0,0,1
133,Response To Interferon-Alpha (GO:0035455),0.11990432605148374,10.680555555555555,22.654111311563156,['IFITM3'],0.1744814675645729,0,0,1
134,Interferon-Mediated Signaling Pathway (GO:0140888),0.11990432605148374,10.680555555555555,22.654111311563156,['IFITM3'],0.1744814675645729,0,0,1
135,Negative Regulation Of Viral Entry Into Host Cell (GO:0046597),0.11990432605148374,10.680555555555555,22.654111311563156,['IFITM3'],0.1744814675645729,0,0,1
136,Negative Regulation Of Viral Life Cycle (GO:1903901),0.11990432605148374,10.680555555555555,22.654111311563156,['IFITM3'],0.1744814675645729,0,0,1
137,Regulation Of Monoatomic Cation Transmembrane Transport (GO:1904062),0.11990432605148374,10.680555555555555,22.654111311563156,['HCN1'],0.1744814675645729,0,0,1
138,Regulation Of Monoatomic Ion Transmembrane Transporter Activity (GO:0032412),0.11990432605148374,10.680555555555555,22.654111311563156,['HCN1'],0.1744814675645729,0,0,1
139,Antimicrobial Humoral Immune Response Mediated By Antimicrobial Peptide (GO:0061844),0.11990432605148374,10.680555555555555,22.654111311563156,['RPS19'],0.1744814675645729,0,0,1
140,Regulation Of Neurotransmitter Secretion (GO:0046928),0.11990432605148374,10.680555555555555,22.654111311563156,['RIMS2'],0.1744814675645729,0,0,1
141,Sensory Perception Of Mechanical Stimulus (GO:0050954),0.11990432605148374,10.680555555555555,22.654111311563156,['TIMM8B'],0.1744814675645729,0,0,1
142,Sensory Perception Of Sound (GO:0007605),0.11990432605148374,10.680555555555555,22.654111311563156,['TIMM8B'],0.1744814675645729,0,0,1
143,Regulation Of Cardiac Muscle Cell Action Potential (GO:0098901),0.11990432605148374,10.680555555555555,22.654111311563156,['HCN1'],0.1744814675645729,0,0,1
144,Regulation Of Cell Development (GO:0060284),0.11990432605148374,10.680555555555555,22.654111311563156,['RPS19'],0.1744814675645729,0,0,1
145,Energy Derivation By Oxidation Of Organic Compounds (GO:0015980),0.11990432605148374,10.680555555555555,22.654111311563156,['UQCRQ'],0.1744814675645729,0,0,1
146,Positive Regulation Of Innate Immune Response (GO:0045089),0.14765005152290867,8.0,15.303282574714228,['RPS19'],0.19843414567728487,0,0,1
147,Regulation Of Protein Modification Process (GO:0031399),0.14765005152290867,8.0,15.303282574714228,['PPIB'],0.19843414567728487,0,0,1
148,Protein Targeting To Mitochondrion (GO:0006626),0.14765005152290867,8.0,15.303282574714228,['TIMM8B'],0.19843414567728487,0,0,1
149,Cellular Response To Ionizing Radiation (GO:0071479),0.14765005152290867,8.0,15.303282574714228,['RPL26'],0.19843414567728487,0,0,1
150,Regulation Of Translation (GO:0006417),0.14765005152290867,8.0,15.303282574714228,['RPL26'],0.19843414567728487,0,0,1
151,Positive Regulation Of Nervous System Development (GO:0051962),0.14765005152290867,8.0,15.303282574714228,['CLSTN2'],0.19843414567728487,0,0,1
152,Granulocyte Chemotaxis (GO:0071621),0.14765005152290867,8.0,15.303282574714228,['PPIB'],0.19843414567728487,0,0,1
153,Defense Response To Gram-negative Bacterium (GO:0050829),0.14765005152290867,8.0,15.303282574714228,['RPS19'],0.19843414567728487,0,0,1
154,Antimicrobial Humoral Response (GO:0019730),0.14765005152290867,8.0,15.303282574714228,['RPS19'],0.19843414567728487,0,0,1
155,Neuropeptide Signaling Pathway (GO:0007218),0.14765005152290867,8.0,15.303282574714228,['SORCS3'],0.19843414567728487,0,0,1
156,Neutrophil Chemotaxis (GO:0030593),0.14765005152290867,8.0,15.303282574714228,['PPIB'],0.19843414567728487,0,0,1
157,Neutrophil Migration (GO:1990266),0.14765005152290867,8.0,15.303282574714228,['PPIB'],0.19843414567728487,0,0,1
158,Protein O-linked Glycosylation (GO:0006493),0.17455500027064544,6.391666666666667,11.156752593242365,['GALNT13'],0.22457990888479384,0,0,1
159,Peptidyl-Serine Modification (GO:0018209),0.17455500027064544,6.391666666666667,11.156752593242365,['GALNT13'],0.22457990888479384,0,0,1
160,Regulation Of Synapse Assembly (GO:0051963),0.17455500027064544,6.391666666666667,11.156752593242365,['CLSTN2'],0.22457990888479384,0,0,1
161,Positive Regulation Of Cell Cycle (GO:0045787),0.17455500027064544,6.391666666666667,11.156752593242365,['RPS15A'],0.22457990888479384,0,0,1
162,Positive Regulation Of Cell Junction Assembly (GO:1901890),0.17455500027064544,6.391666666666667,11.156752593242365,['CLSTN2'],0.22457990888479384,0,0,1
163,Regulation Of Cation Channel Activity (GO:2001257),0.17455500027064544,6.391666666666667,11.156752593242365,['HCN1'],0.22457990888479384,0,0,1
164,Regulation Of Cell Communication (GO:0010646),0.17455500027064544,6.391666666666667,11.156752593242365,['HCN1'],0.22457990888479384,0,0,1
165,Protein Glycosylation (GO:0006486),0.20064361858360624,5.319444444444445,8.544224580937827,['GALNT13'],0.2447156272898319,0,0,1
166,Negative Regulation Of Innate Immune Response (GO:0045824),0.20064361858360624,5.319444444444445,8.544224580937827,['RPS19'],0.2447156272898319,0,0,1
167,"Regulation Of Synaptic Transmission, Glutamatergic (GO:0051966)",0.20064361858360624,5.319444444444445,8.544224580937827,['HCN1'],0.2447156272898319,0,0,1
168,Regulation Of Vesicle-Mediated Transport (GO:0060627),0.20064361858360624,5.319444444444445,8.544224580937827,['RIMS2'],0.2447156272898319,0,0,1
169,Myeloid Cell Differentiation (GO:0030099),0.20064361858360624,5.319444444444445,8.544224580937827,['RPS19'],0.2447156272898319,0,0,1
170,Response To Interferon-Beta (GO:0035456),0.20064361858360624,5.319444444444445,8.544224580937827,['IFITM3'],0.2447156272898319,0,0,1
171,Negative Regulation Of Viral Genome Replication (GO:0045071),0.20064361858360624,5.319444444444445,8.544224580937827,['IFITM3'],0.2447156272898319,0,0,1
172,Positive Regulation Of Transferase Activity (GO:0051347),0.20064361858360624,5.319444444444445,8.544224580937827,['RPS2'],0.2447156272898319,0,0,1
173,Potassium Ion Transmembrane Transport (GO:0071805),0.20064361858360624,5.319444444444445,8.544224580937827,['HCN1'],0.2447156272898319,0,0,1
174,Positive Regulation Of Multicellular Organismal Process (GO:0051240),0.20601726400992001,2.5982608695652174,4.104720330259177,"['RPS19', 'PPIB']",0.24982553279363864,0,0,2
175,Protein Homooligomerization (GO:0051260),0.2259396723689569,4.553571428571429,6.773379449997987,['HCN1'],0.2648515048324995,0,0,1
176,Regulation Of Viral Genome Replication (GO:0045069),0.2259396723689569,4.553571428571429,6.773379449997987,['IFITM3'],0.2648515048324995,0,0,1
177,Adenylate Cyclase-Modulating G Protein-Coupled Receptor Signaling Pathway (GO:0007188),0.2259396723689569,4.553571428571429,6.773379449997987,['RIMS2'],0.2648515048324995,0,0,1
178,Positive Regulation Of Protein Metabolic Process (GO:0051247),0.2259396723689569,4.553571428571429,6.773379449997987,['RPL26'],0.2648515048324995,0,0,1
179,Negative Regulation Of Viral Process (GO:0048525),0.2259396723689569,4.553571428571429,6.773379449997987,['IFITM3'],0.2648515048324995,0,0,1
180,Positive Regulation Of Cell Growth (GO:0030307),0.2259396723689569,4.553571428571429,6.773379449997987,['RIMS2'],0.2648515048324995,0,0,1
181,Regulation Of Cytoskeleton Organization (GO:0051493),0.2504662651238483,3.9791666666666665,5.508881837476131,['CDK2AP2'],0.2872194670713695,0,0,1
182,Protein Secretion (GO:0009306),0.2504662651238483,3.9791666666666665,5.508881837476131,['RIMS2'],0.2872194670713695,0,0,1
