Rank,Term name,P-value,Z-score,Combined score,Overlapping genes,Adjusted p-value,Old p-value,Old adjusted p-value,gene count
1,NRF2 pathway WP2884,1.1750768291608927e-06,11.743993010048056,160.35455955113656,"['NQO1', 'DNAJB1', 'HGF', 'HMOX1', 'SLC5A3', 'SLC39A14', 'HSPA1A', 'EPHA2']",0.0001302986403056206,0,0,8
2,Nuclear Receptors Meta-Pathway WP2882,1.200909127240743e-06,7.283267130089374,99.28864157251718,"['NQO1', 'DNAJB1', 'GADD45B', 'HGF', 'HMOX1', 'CCL2', 'IRS2', 'SLC5A3', 'SLC39A14', 'HSPA1A', 'EPHA2']",0.0001302986403056206,0,0,11
3,Adipogenesis WP236,1.4685386895627617e-05,9.944291754756872,110.66661848401787,"['SOCS3', 'CDKN1A', 'CEBPD', 'GADD45B', 'GADD45A', 'NAMPT', 'IRS2']",0.0010622429854503976,0,0,7
4,Lung fibrosis WP3624,5.655546394749518e-05,22.762747576906868,222.62624378465478,"['EGF', 'HGF', 'HMOX1', 'CCL2']",0.0026073883968646618,0,0,4
5,Apoptosis-related network due to altered Notch3 in ovarian cancer WP2864,6.007807366047608e-05,13.677962662337663,132.9479589502826,"['SOCS3', 'NQO1', 'CDKN1A', 'HSPB1', 'YBX3']",0.0026073883968646618,0,0,5
6,IL1 and megakaryocytes in obesity WP2865,0.00016515324945979903,35.56578947368421,309.7295405601972,"['IL1R1', 'CCL2', 'ICAM1']",0.0056867299571469535,0,0,3
7,IL-18 signaling pathway WP4754,0.00018344290184345012,5.566722268557131,47.89389123630603,"['ACTA2', 'SOCS3', 'RGS16', 'HSPB1', 'HMOX1', 'CCL2', 'KLF2', 'ICAM1']",0.0056867299571469535,0,0,8
8,EV release from cardiac cells and their functional effects WP3297,0.0002175595246214534,235.2,1983.4505537012321,"['RGS16', 'KLF2']",0.0059013021053569235,0,0,2
9,Complement system WP2806,0.00033523128298954447,13.643489254108722,109.15732623091716,"['C1R', 'F11', 'ADM', 'ICAM1']",0.008082798712081238,0,0,4
10,Spinal Cord Injury WP2431,0.00045552127423595433,8.580994897959183,66.02275942914973,"['ZFP36', 'GADD45A', 'IL1R1', 'CCL2', 'ICAM1']",0.009884811650920209,0,0,5
11,Genotoxicity pathway WP4286,0.0005837059448677,11.641700841787179,86.68542255303397,"['ACTA2', 'CDKN1A', 'CEBPD', 'GADD45A']",0.011514926366935537,0,0,4
12,p53 transcriptional gene network WP4963,0.0009410920042095623,10.151007343249859,70.73698659194996,"['CDKN1A', 'GADD45A', 'CCL2', 'ICAM1']",0.01701808040945625,0,0,4
13,Mammary gland development pathway - Involution (Stage 4 of 4) WP2815,0.0010695936339387279,58.78695652173913,402.13079365342804,"['SOCS3', 'CHI3L1']",0.017853986043438765,0,0,2
14,Vitamin B12 metabolism WP1533,0.0012321668710695577,16.151913875598087,108.20136377452341,"['SERPINA3', 'CCL2', 'ICAM1']",0.019098586501578144,0,0,3
15,Platelet-mediated interactions with vascular and circulating cells WP4462,0.001489039459151928,47.02608695652174,306.12214546301567,"['CCL2', 'ICAM1']",0.021541437509064558,0,0,2
16,Endometrial cancer WP4155,0.0016261498574409042,8.66934835076428,55.67056815207311,"['CDKN1A', 'GADD45B', 'EGF', 'GADD45A']",0.022054657441542263,0,0,4
17,Focal Adhesion-PI3K-Akt-mTOR-signaling pathway WP3932,0.0022021742608511747,4.176175548589342,25.551137064526344,"['EFNA1', 'CDKN1A', 'EGF', 'HGF', 'TNC', 'IRS2', 'EPHA2']",0.026561408156699964,0,0,7
18,Oxidative Damage WP3941,0.0023197209014842123,12.68515037593985,76.95203430144127,"['CDKN1A', 'C1R', 'GADD45A']",0.026561408156699964,0,0,3
19,Non-small cell lung cancer WP4255,0.002325653248743315,7.813143769041056,47.37698422140255,"['CDKN1A', 'GADD45B', 'EGF', 'GADD45A']",0.026561408156699964,0,0,4
20,Transcriptional cascade regulating adipogenesis WP4211,0.002524134614745654,33.585093167701864,200.90122472241364,"['CEBPD', 'KLF2']",0.027386860569990346,0,0,2
21,Breast cancer pathway WP4262,0.0029747860686066595,5.49475753604194,31.966208867553345,"['CDKN1A', 'GADD45B', 'EGF', 'GADD45A', 'HES5']",0.030739456042268815,0,0,5
22,Ferroptosis WP4313,0.003294674604895,11.096217105263158,63.41985042054381,"['HMOX1', 'CP', 'SLC39A14']",0.031390571192294985,0,0,3
23,Myometrial relaxation and contraction pathways WP289,0.003327111232363063,5.346380739795919,30.504581808551336,"['ACTA2', 'OXTR', 'RGS16', 'PRKCQ', 'ADM']",0.031390571192294985,0,0,5
24,Leptin Insulin Overlap WP3935,0.003813308041332753,26.117874396135267,145.45718651911855,"['SOCS3', 'IRS2']",0.033531137746891496,0,0,2
25,Folate Metabolism WP176,0.0038630343026372694,10.441950464396285,58.01863354413354,"['SERPINA3', 'CCL2', 'ICAM1']",0.033531137746891496,0,0,3
26,Vitamin D Receptor Pathway WP2877,0.004297315595850571,6.522972481512911,35.548665372737,"['CDKN1A', 'GADD45A', 'HILPDA', 'PRKCQ']",0.03586605708844515,0,0,4
27,Pancreatic adenocarcinoma pathway WP4263,0.004500093662555672,6.4343458502750535,34.7689984351489,"['CDKN1A', 'GADD45B', 'EGF', 'GADD45A']",0.03616741943609558,0,0,4
28,TP53 network WP1742,0.005347727166459737,21.36600790513834,111.76737434140684,"['CDKN1A', 'GADD45A']",0.04001575155592286,0,0,2
29,Extracellular vesicles in the crosstalk of cardiac cells WP4300,0.005347727166459737,21.36600790513834,111.76737434140684,"['EGF', 'HSPB1']",0.04001575155592286,0,0,2
30,Phytochemical activity on NRF2 transcriptional activation WP3,0.006204204820513737,19.58405797101449,99.5365233819201,"['NQO1', 'HMOX1']",0.044877081535049365,0,0,2
31,MAPK Signaling Pathway WP382,0.006660123334927096,3.814099814099814,19.11480852013406,"['EGF', 'GADD45A', 'IL1R1', 'HSPB1', 'HSPA1B', 'HSPA1A']",0.04662086334448967,0,0,6
32,IL-4 signaling pathway WP395,0.007137604691765749,8.250917992656058,40.779155865881535,"['SOCS3', 'NFIL3', 'IRS2']",0.04840188181603649,0,0,3
33,Gastrin signaling pathway WP4659,0.008352683463824248,5.343939544595804,25.571672116724194,"['CDKN1A', 'ANXA2', 'PRKCQ', 'CD44']",0.052722972618377065,0,0,4
34,Selenium Micronutrient Network WP15,0.008503705261028558,7.711098398169336,36.76075926529628,"['SERPINA3', 'CCL2', 'ICAM1']",0.052722972618377065,0,0,3
35,The Overlap Between Signal Transduction Pathways that Contribute to a Range of LMNA Laminopathies WP4879,0.008503705261028558,7.711098398169336,36.76075926529628,"['CDKN1A', 'CEBPD', 'HES5']",0.052722972618377065,0,0,3
36,DNA damage response WP707,0.008990772571970524,7.546472564389697,35.55563184301665,"['CDKN1A', 'GADD45B', 'GADD45A']",0.05347632289934775,0,0,3
37,Transcription factor regulation in adipogenesis WP3599,0.009118082706340399,15.663768115942029,73.58048378654543,"['CEBPD', 'IRS2']",0.05347632289934775,0,0,2
38,miRNA regulation of DNA damage response WP1530,0.010013128343743844,7.237379162191193,33.3198674937513,"['CDKN1A', 'GADD45B', 'GADD45A']",0.055800521985900485,0,0,3
39,Photodynamic therapy-induced NFE2L2 (NRF2) survival signaling WP3612,0.01020076081995334,14.683695652173913,67.32904646635883,"['NQO1', 'HMOX1']",0.055800521985900485,0,0,2
40,PI3K-Akt signaling pathway WP4172,0.010285810504313453,3.4607588357588357,15.839858426143042,"['EFNA1', 'CDKN1A', 'EGF', 'HGF', 'TNC', 'EPHA2']",0.055800521985900485,0,0,6
41,Peptide GPCRs WP24,0.011337449820799653,13.818925831202046,61.903866659197824,"['OXTR', 'GNRHR']",0.06000552710032987,0,0,2
42,Differentiation Pathway WP2848,0.013768914483714863,12.362471395881007,52.97741544043132,"['EGF', 'HGF']",0.07113939149919346,0,0,2
43,Melanoma WP4685,0.014758670525928122,6.217913204062788,26.214252843679432,"['CDKN1A', 'GADD45B', 'GADD45A']",0.07263110012686429,0,0,3
44,Type II interferon signaling (IFNG) WP619,0.01506174887423453,11.743478260869566,49.27090141216897,"['SOCS3', 'ICAM1']",0.07263110012686429,0,0,2
45,NRF2-ARE regulation WP4357,0.01506174887423453,11.743478260869566,49.27090141216897,"['NQO1', 'HMOX1']",0.07263110012686429,0,0,2
46,Oxidative Stress WP408,0.01640471132681166,11.183436853002071,45.966013518430245,"['NQO1', 'HMOX1']",0.07574090123230065,0,0,2
47,Prostaglandin Synthesis and Regulation WP98,0.01640471132681166,11.183436853002071,45.966013518430245,"['ANXA2', 'S100A10']",0.07574090123230065,0,0,2
48,Chromosomal and microsatellite instability in colorectal cancer  WP4216,0.017532722517897156,5.808455565142364,23.487572111000794,"['CDKN1A', 'GADD45B', 'GADD45A']",0.07881467586926372,0,0,3
49,White fat cell differentiation WP4149,0.01779686229305955,10.674308300395257,43.00393930703409,"['CEBPD', 'KLF2']",0.07881467586926372,0,0,2
50,Regucalcin in proximal tubule epithelial kidney cells WP4838,0.02072503239377085,9.783333333333333,37.92424066276362,"['ACTA2', 'PRKCQ']",0.08994664058896548,0,0,2
51,Benzene metabolism WP3891,0.025511012843454518,58.28879310344828,213.84089193012096,['NQO1'],0.10645941898133905,0,0,1
52,COVID-19 adverse outcome pathway WP4891,0.025511012843454518,58.28879310344828,213.84089193012096,['CCL2'],0.10645941898133905,0,0,1
53,ATM Signaling Pathway WP2516,0.02713163082009693,8.383229813664597,30.2387713743172,"['CDKN1A', 'GADD45A']",0.10844537714960259,0,0,2
54,Bladder cancer WP2828,0.02713163082009693,8.383229813664597,30.2387713743172,"['CDKN1A', 'EGF']",0.10844537714960259,0,0,2
55,Senescence and Autophagy in Cancer WP615,0.0274861554987472,4.8493150684931505,17.428791568080182,"['CDKN1A', 'IFI16', 'CD44']",0.10844537714960259,0,0,3
56,Small cell lung cancer WP4658,0.028426245276166048,4.783428165007113,17.031120604892564,"['CDKN1A', 'GADD45B', 'GADD45A']",0.10980504847436347,0,0,3
57,The influence of laminopathies on Wnt signaling WP4844,0.028842800751330496,8.093553223388305,28.698888756550073,"['CEBPD', 'HES5']",0.10980504847436347,0,0,2
58,CAMKK2  Pathway WP4874,0.03059607022961091,7.823188405797102,27.278548150942783,"['HMOX1', 'ICAM1']",0.11447150413492357,0,0,2
59,Aryl Hydrocarbon Receptor Netpath WP2586,0.03239060457675434,7.5702664796633945,25.965157680000093,"['NQO1', 'CDKN1A']",0.11714601988592821,0,0,2
60,Hepatitis C and Hepatocellular Carcinoma WP3646,0.03239060457675434,7.5702664796633945,25.965157680000093,"['CDKN1A', 'CD44']",0.11714601988592821,0,0,2
61,Cells and molecules involved in local acute inflammatory response  WP4493,0.03387048459938995,38.85632183908046,131.5368599458388,['ICAM1'],0.11788810929635965,0,0,1
62,LncRNA-mediated mechanisms of therapeutic resistance WP3672,0.03387048459938995,38.85632183908046,131.5368599458388,['CDKN1A'],0.11788810929635965,0,0,1
63,Host-pathogen interaction of human coronaviruses - MAPK signaling WP4877,0.03422558011829796,7.333152173913043,24.747789650458458,"['IFITM3', 'IFITM2']",0.11788810929635965,0,0,2
64,Fas ligand pathway and stress induction of heat shock proteins WP314,0.03610018406513667,7.110408432147563,23.616918098876422,"['HSPB1', 'LMNB1']",0.12240218659585402,0,0,2
65,VEGFA-VEGFR2 Signaling Pathway WP3888,0.04050614865227548,2.3008741258741257,7.377296156081383,"['ADAMTS1', 'HSPB1', 'CCL2', 'DSC1', 'HSPA1A', 'EPHA2', 'ICAM1']",0.13522821934682738,0,0,7
66,Serotonin Transporter Activity WP1455,0.04215885767455614,29.14008620689655,92.26656005715104,['IL1R1'],0.1365443599310251,0,0,1
67,miR-517 relationship with ARCN1 and USP1 WP3596,0.04215885767455614,29.14008620689655,92.26656005715104,['CDKN1A'],0.1365443599310251,0,0,1
68,Netrin-UNC5B signaling pathway WP4747,0.04397900181466691,6.339835487661575,19.805918615898108,"['CCL2', 'ICAM1']",0.14007828303028635,0,0,2
69,Cell cycle WP179,0.04454102087138137,3.972797161442933,12.360741380862544,"['CDKN1A', 'GADD45B', 'GADD45A']",0.14007828303028635,0,0,3
70,Interleukin-11 Signaling Pathway WP2332,0.046039928022378704,6.17254004576659,19.000598301329347,"['SOCS3', 'ICAM1']",0.14272377686937399,0,0,2
71,Blood Clotting Cascade WP272,0.050376730411156076,23.310344827586206,69.65657635479428,['F11'],0.15396831689043478,0,0,1
72,Caloric restriction and aging WP4191,0.0585246966341447,19.423850574712645,55.130840353426606,['NAMPT'],0.17103757181344792,0,0,1
73,Estrogen metabolism WP697,0.0585246966341447,19.423850574712645,55.130840353426606,['NQO1'],0.17103757181344792,0,0,1
74,Farnesoid X receptor pathway WP2879,0.0585246966341447,19.423850574712645,55.130840353426606,['IRS2'],0.17103757181344792,0,0,1
75,G1 to S cell cycle control WP45,0.059114368138288444,5.328458498023715,15.070379359465026,"['CDKN1A', 'GADD45A']",0.17103757181344792,0,0,2
76,Interferon type I signaling pathways WP585,0.06140491022618452,5.2096618357487925,14.536339561487349,"['SOCS3', 'IRS2']",0.17532717788265842,0,0,2
77,Glucocorticoid Receptor Pathway WP2880,0.06607531445225652,4.987234042553191,13.550115700910744,"['GADD45B', 'CCL2']",0.1806615745936503,0,0,2
78,Complement Activation WP545,0.06660334547231347,16.647783251231527,45.098852658376735,['C1R'],0.1806615745936503,0,0,1
79,IL-10 Anti-inflammatory Signaling Pathway  WP4495,0.06660334547231347,16.647783251231527,45.098852658376735,['HMOX1'],0.1806615745936503,0,0,1
80,Mammary gland development pathway - Puberty (Stage 2 of 4) WP2814,0.06660334547231347,16.647783251231527,45.098852658376735,['EGF'],0.1806615745936503,0,0,1
81,IL-1 signaling pathway WP195,0.07329426456931915,4.6869565217391305,12.248296551427043,"['IL1R1', 'CCL2']",0.18826834525939223,0,0,2
82,"Non-genomic actions of 1,25 dihydroxyvitamin D3 WP4341",0.07329426456931915,4.6869565217391305,12.248296551427043,"['CCL2', 'PRKCQ']",0.18826834525939223,0,0,2
83,Notch Signaling Pathway Netpath WP61,0.07329426456931915,4.6869565217391305,12.248296551427043,"['CDKN1A', 'HES5']",0.18826834525939223,0,0,2
84,Dopamine metabolism WP2436,0.07461326125487434,14.56573275862069,37.804442065353236,['NQO1'],0.18826834525939223,0,0,1
85,"Metabolic pathway of LDL, HDL and TG, including diseases WP4522",0.07461326125487434,14.56573275862069,37.804442065353236,['ANXA2'],0.18826834525939223,0,0,1
86,MFAP5-mediated ovarian cancer cell motility and invasiveness WP3301,0.07461326125487434,14.56573275862069,37.804442065353236,['PRKCQ'],0.18826834525939223,0,0,1
87,Calcium Regulation in the Cardiac Cell WP536,0.076218384468061,3.1515507518796992,8.112572497075133,"['PLN', 'RGS16', 'PRKCQ']",0.19010792447780736,0,0,3
88,MET in type 1 papillary renal cell carcinoma WP4205,0.08075378142452408,4.420672682526662,11.123961867220983,"['CDKN1A', 'HGF']",0.19434528165334197,0,0,2
89,Development and heterogeneity of the ILC family WP3893,0.08255502353350425,12.946360153256705,32.29197998137281,['NFIL3'],0.19434528165334197,0,0,1
90,Ethanol metabolism resulting in production of ROS by CYP2E1 WP4269,0.08255502353350425,12.946360153256705,32.29197998137281,['PRKCQ'],0.19434528165334197,0,0,1
91,FGF23 signaling in hypophosphatemic rickets and related disorders WP4790,0.08255502353350425,12.946360153256705,32.29197998137281,['CDKN1A'],0.19434528165334197,0,0,1
92,miRNAs involved in DNA damage response WP1545,0.08255502353350425,12.946360153256705,32.29197998137281,['CDKN1A'],0.19434528165334197,0,0,1
93,Oncostatin M Signaling Pathway WP2374,0.08329083499428941,4.338486312399356,10.78294659361021,"['SOCS3', 'CCL2']",0.19434528165334197,0,0,2
94,Parkin-Ubiquitin Proteasomal System pathway WP2359,0.08843713627217445,4.182919254658385,10.145517155670676,"['HSPA1B', 'HSPA1A']",0.19821351450780147,0,0,2
95,Amplification and Expansion of Oncogenic Pathways as Metastatic Traits WP3678,0.09042920707959606,11.650862068965518,27.999211641183336,['TNC'],0.19821351450780147,0,0,1
96,Tryptophan catabolism leading to NAD+ production WP4210,0.09042920707959606,11.650862068965518,27.999211641183336,['NAMPT'],0.19821351450780147,0,0,1
97,Kynurenine Pathway and links to Cellular Senescence WP5044,0.09042920707959606,11.650862068965518,27.999211641183336,['CDKN1A'],0.19821351450780147,0,0,1
98,"NAD metabolism, sirtuins and aging WP3630",0.09042920707959606,11.650862068965518,27.999211641183336,['NAMPT'],0.19821351450780147,0,0,1
99,RalA downstream regulated genes WP2290,0.09042920707959606,11.650862068965518,27.999211641183336,['YBX3'],0.19821351450780147,0,0,1
100,Computational Model of Aerobic Glycolysis WP4629,0.09823638187649658,10.590909090909092,24.574919282447155,['PGAM2'],0.20302185587809296,0,0,1
101,Fatty acid transporters WP5061,0.09823638187649658,10.590909090909092,24.574919282447155,['FABP5'],0.20302185587809296,0,0,1
102,FOXA2 pathway WP5066,0.09823638187649658,10.590909090909092,24.574919282447155,['IRS2'],0.20302185587809296,0,0,1
103,Galanin receptor pathway WP4970,0.09823638187649658,10.590909090909092,24.574919282447155,['CDKN1A'],0.20302185587809296,0,0,1
104,Interactions between immune cells and microRNAs in tumor microenvironment WP4559,0.09823638187649658,10.590909090909092,24.574919282447155,['CCL2'],0.20302185587809296,0,0,1
105,Overview of nanoparticle effects WP3287,0.09823638187649658,10.590909090909092,24.574919282447155,['HMOX1'],0.20302185587809296,0,0,1
106,Nonalcoholic fatty liver disease WP4396,0.10095597908757968,2.7762121840033154,6.366050837690484,"['SOCS3', 'CCL2', 'IRS2']",0.20624504781797737,0,0,3
107,Prolactin Signaling Pathway WP2037,0.10169686689642203,3.8386315039201713,8.774185677525518,"['SOCS3', 'IRS2']",0.20624504781797737,0,0,2
108,Hypertrophy Model WP516,0.10597711319969606,9.707614942528735,21.789053560621355,['IL1R1'],0.21293549596605596,0,0,1
109,Apoptosis Modulation and Signaling WP1772,0.11267306136476303,3.6013377926421404,7.862674453709506,"['IL1R1', 'HSPA1A']",0.2202006755898367,0,0,2
110,Simplified Interaction Map Between LOXL4 and Oxidative Stress Pathway WP3670,0.11365196159475442,8.960212201591512,19.485007097725457,['NQO1'],0.2202006755898367,0,0,1
111,TGF-B Signaling in Thyroid Cells for Epithelial-Mesenchymal Transition WP3859,0.11365196159475442,8.960212201591512,19.485007097725457,['TNC'],0.2202006755898367,0,0,1
112,Imatinib and Chronic Myeloid Leukemia WP3640,0.11365196159475442,8.960212201591512,19.485007097725457,['GADD45A'],0.2202006755898367,0,0,1
113,Corticotropin-releasing hormone signaling pathway WP2355,0.12109781286908786,3.441687979539642,7.265942599876601,"['PRKCQ', 'FOSL2']",0.22299781186809234,0,0,2
114,Glioblastoma signaling pathways WP2261,0.12109781286908786,3.441687979539642,7.265942599876601,"['CDKN1A', 'PRKCQ']",0.22299781186809234,0,0,2
115,ERK Pathway in Huntington's Disease WP3853,0.12126148295131288,8.319581280788178,17.552702910486005,['EGF'],0.22299781186809234,0,0,1
116,MFAP5 effect on permeability and motility of endothelial cells via cytoskeleton rearrangement WP4560,0.12126148295131288,8.319581280788178,17.552702910486005,['PRKCQ'],0.22299781186809234,0,0,1
117,NAD+ metabolism WP3644,0.12126148295131288,8.319581280788178,17.552702910486005,['NAMPT'],0.22299781186809234,0,0,1
118,Photodynamic therapy-induced NF-kB survival signaling WP3617,0.12126148295131288,8.319581280788178,17.552702910486005,['ICAM1'],0.22299781186809234,0,0,1
119,Insulin Signaling WP481,0.12464261561794063,2.5159774436090228,5.239031685354129,"['SOCS3', 'IRS2', 'PRKCQ']",0.2272894755385976,0,0,3
120,Focal Adhesion WP306,0.12845305435272517,2.4801704966641958,5.089785499245538,"['EGF', 'HGF', 'TNC']",0.23228593995451136,0,0,3
121,EGFR Tyrosine Kinase Inhibitor Resistance WP4806,0.12967255957055127,3.295529699938763,6.731919495898469,"['EGF', 'HGF']",0.23255326799016218,0,0,2
122,Pathways Regulating Hippo Signaling WP4540,0.13256188409887948,3.2495169082125606,6.566317315232105,"['PRKCQ', 'EPHA2']",0.23578630204472825,0,0,2
123,Apoptosis Modulation by HSP70 WP384,0.13628674493671245,7.278556034482759,14.506119918803822,['HSPA1A'],0.23850180363924678,0,0,1
124,Monoamine Transport WP727,0.13628674493671245,7.278556034482759,14.506119918803822,['IL1R1'],0.23850180363924678,0,0,1
125,Wnt signaling pathway and pluripotency WP399,0.14131655602376458,3.118840579710145,6.102800120822332,"['PRKCQ', 'CD44']",0.2453255412572553,0,0,2
126,NAD+ biosynthetic pathways WP3645,0.14370357426273644,6.849898580121704,13.288821145033163,['NAMPT'],0.24748948900804613,0,0,1
127,Hippo-Merlin Signaling Dysregulation WP4541,0.1501918339132923,2.998216276477146,5.684144069843024,"['CD44', 'EPHA2']",0.2560892510658069,0,0,2
128,Kallmann's Syndrome WP5074,0.15105725408489992,6.468869731800766,12.226787055165076,['PRKCQ'],0.2560892510658069,0,0,1
129,Sleep regulation WP3591,0.15834831742946276,6.127949183303086,11.293553777992818,['OXTR'],0.26167572385603216,0,0,1
130,Striated Muscle Contraction Pathway WP383,0.15834831742946276,6.127949183303086,11.293553777992818,['ACTA2'],0.26167572385603216,0,0,1
131,NAD Metabolism in Oncogene-Induced Senescence and Mitochondrial Dysfunction-Associated Senescence WP5046,0.15834831742946276,6.127949183303086,11.293553777992818,['NAMPT'],0.26167572385603216,0,0,1
132,ErbB signaling pathway WP673,0.1591760163548214,2.886527106816962,5.3046997994703045,"['CDKN1A', 'EGF']",0.26167572385603216,0,0,2
133,EPO Receptor Signaling WP581,0.16557729289324377,5.821120689655173,10.468221265305854,['IRS2'],0.2661501670950659,0,0,1
134,FGFR3 signaling in chondrocyte proliferation and terminal differentiation WP4767,0.16557729289324377,5.821120689655173,10.468221265305854,['CDKN1A'],0.2661501670950659,0,0,1
135,Fibrin Complement Receptor 3 Signaling Pathway WP4136,0.16557729289324377,5.821120689655173,10.468221265305854,['CCL2'],0.2661501670950659,0,0,1
136,Extracellular vesicle-mediated signaling in recipient cells WP2870,0.17274470466206387,5.543513957307061,9.734080503592617,['HGF'],0.27562941846814604,0,0,1
137,Cell migration and invasion through p75NTR WP4561,0.17985107252223678,5.29114420062696,9.07762532984594,['EFNA1'],0.2777918174845712,0,0,1
138,Complement and Coagulation Cascades WP558,0.17985107252223678,5.29114420062696,9.07762532984594,['C1R'],0.2777918174845712,0,0,1
139,miRNAs involvement in the immune response in sepsis WP4329,0.17985107252223678,5.29114420062696,9.07762532984594,['ICAM1'],0.2777918174845712,0,0,1
140,Pre-implantation embryo WP3527,0.17985107252223678,5.29114420062696,9.07762532984594,['ZFP36'],0.2777918174845712,0,0,1
141,Metapathway biotransformation Phase I and II WP702,0.18050067403375367,2.6555335968379445,4.546328665138979,"['CYP39A1', 'HS3ST3B1']",0.2777918174845712,0,0,2
142,16p11.2 distal deletion syndrome WP4950,0.18689691194146935,5.06071964017991,8.487829300237035,['PLN'],0.2816432631340198,0,0,1
143,Aryl Hydrocarbon Receptor Pathway WP2873,0.18689691194146935,5.06071964017991,8.487829300237035,['NQO1'],0.2816432631340198,0,0,1
144,Intracellular trafficking proteins involved in CMT neuropathy WP4856,0.18689691194146935,5.06071964017991,8.487829300237035,['HSPB1'],0.2816432631340198,0,0,1
145,Signal transduction through IL1R WP4496,0.19388273401475864,4.849497126436781,7.955608602663773,['IL1R1'],0.29015553987036297,0,0,1
146,Vitamin A and carotenoid metabolism WP716,0.2008090456219434,4.655172413793103,7.473417723284641,['RBP2'],0.2924534422816223,0,0,1
147,Kisspeptin/kisspeptin receptor system in the ovary WP4871,0.2008090456219434,4.655172413793103,7.473417723284641,['PRKCQ'],0.2924534422816223,0,0,1
148,Oxidation by Cytochrome P450 WP43,0.2008090456219434,4.655172413793103,7.473417723284641,['CYP39A1'],0.2924534422816223,0,0,1
149,Oxysterols derived from cholesterol WP4545,0.2008090456219434,4.655172413793103,7.473417723284641,['CYP39A1'],0.2924534422816223,0,0,1
150,IL17 signaling pathway WP2112,0.20767634935019716,4.47579575596817,7.0349412956758,['CEBPD'],0.2984487934370383,0,0,1
151,Lipid Metabolism Pathway WP3965,0.20767634935019716,4.47579575596817,7.0349412956758,['HILPDA'],0.2984487934370383,0,0,1
152,Alpha 6 Beta 4 signaling pathway WP244,0.2212359226961068,4.155480295566503,6.26864850319067,['IRS2'],0.31174152743542327,0,0,1
153,Zinc homeostasis WP3529,0.2212359226961068,4.155480295566503,6.26864850319067,['SLC39A14'],0.31174152743542327,0,0,1
154,Proximal tubule transport WP4917,0.2212359226961068,4.155480295566503,6.26864850319067,['SLC22A6'],0.31174152743542327,0,0,1
155,"GPCRs, Other WP117",0.22792917660835857,4.011890606420928,5.9324641901915145,['GNRHR'],0.31705532900008854,0,0,1
156,miRNA regulation of prostate cancer signaling pathways WP3981,0.22792917660835857,4.011890606420928,5.9324641901915145,['CDKN1A'],0.31705532900008854,0,0,1
157,Type 2 papillary renal cell carcinoma WP4241,0.23456539137237065,3.8778735632183907,5.622997619224317,['CDKN1A'],0.32420821610066514,0,0,1
158,TGF-beta Signaling Pathway WP366,0.24006766214173744,2.1809020723283217,3.1117862520194985,"['CDKN1A', 'TNC']",0.327052972588939,0,0,2
159,Signaling of Hepatocyte Growth Factor Receptor WP313,0.2411450489135034,3.752502780867631,5.337397336394816,['HGF'],0.327052972588939,0,0,1
160,p38 MAPK Signaling Pathway WP400,0.2411450489135034,3.752502780867631,5.337397336394816,['HSPB1'],0.327052972588939,0,0,1
161,Glycolysis and Gluconeogenesis WP534,0.24766862711002022,3.634967672413793,5.073192094139815,['PGAM2'],0.33381423653959247,0,0,1
162,TNF related weak inducer of apoptosis (TWEAK) Signaling Pathway WP2036,0.2541365998783536,3.524555903866249,4.828230490182083,['CCL2'],0.3383290930895873,0,0,1
163,IL-2 signaling pathway WP49,0.2541365998783536,3.524555903866249,4.828230490182083,['SOCS3'],0.3383290930895873,0,0,1
164,Integrated Cancer Pathway WP1971,0.26054943707498035,3.4206389452332657,4.600631648369905,['CDKN1A'],0.3426619869410348,0,0,1
165,Mechanoregulation and pathology of YAP/TAZ via Hippo and non-Hippo mechanisms WP4534,0.26054943707498035,3.4206389452332657,4.600631648369905,['ACTA2'],0.3426619869410348,0,0,1
166,IL-6 signaling pathway WP364,0.26690760471394287,3.3226600985221677,4.388744662764059,['SOCS3'],0.34890933869232293,0,0,1
167,TGF-beta Receptor Signaling WP560,0.2732115648528449,3.230124521072797,4.191115059326858,['EGF'],0.35501143456926554,0,0,1
168,Notch Signaling WP268,0.27946177568417413,3.142590866728798,4.006456901301559,['HES5'],0.35672473719685754,0,0,1
169,Photodynamic therapy-induced AP-1 survival signaling. WP3611,0.27946177568417413,3.142590866728798,4.006456901301559,['CDKN1A'],0.35672473719685754,0,0,1
170,SARS-CoV-2 innate immunity evasion and cell-specific immune response WP5039,0.27946177568417413,3.142590866728798,4.006456901301559,['CCL2'],0.35672473719685754,0,0,1
171,T-Cell antigen Receptor (TCR) pathway during Staphylococcus aureus infection WP3863,0.2856586915851995,3.0596642468239565,3.833629470170907,['PRKCQ'],0.36039497717435054,0,0,1
