Rank,Term name,P-value,Z-score,Combined score,Overlapping genes,Adjusted p-value,Old p-value,Old adjusted p-value,gene count
953,miRNA Metabolic Process (GO:0010586),0.3178194744630588,2.8313978494623657,3.245551361526629,['DDX17'],0.6793662515996705,0,0,1
954,Microvillus Organization (GO:0032528),0.3178194744630588,2.8313978494623657,3.245551361526629,['RAP1A'],0.6793662515996705,0,0,1
955,"Mitochondrial Electron Transport, Ubiquinol To Cytochrome C (GO:0006122)",0.3178194744630588,2.8313978494623657,3.245551361526629,['UQCR10'],0.6793662515996705,0,0,1
956,Mitochondrion Distribution (GO:0048311),0.3178194744630588,2.8313978494623657,3.245551361526629,['MAPT'],0.6793662515996705,0,0,1
957,Negative Regulation Of Biosynthetic Process (GO:0009890),0.3178194744630588,2.8313978494623657,3.245551361526629,['GPER1'],0.6793662515996705,0,0,1
958,Negative Regulation Of Cell Communication (GO:0010648),0.3178194744630588,2.8313978494623657,3.245551361526629,['INPP5D'],0.6793662515996705,0,0,1
959,Negative Regulation Of Viral Transcription (GO:0032897),0.3178194744630588,2.8313978494623657,3.245551361526629,['LARP7'],0.6793662515996705,0,0,1
960,Negative Regulation Of Viral-Induced Cytoplasmic Pattern Recognition Receptor Signaling Pathway (GO:0039532),0.3178194744630588,2.8313978494623657,3.245551361526629,['DHX58'],0.6793662515996705,0,0,1
961,Negative Regulation Of Wound Healing (GO:0061045),0.3178194744630588,2.8313978494623657,3.245551361526629,['AJAP1'],0.6793662515996705,0,0,1
962,Neuron Cell-Cell Adhesion (GO:0007158),0.3178194744630588,2.8313978494623657,3.245551361526629,['ASTN2'],0.6793662515996705,0,0,1
963,Neurotrophin Signaling Pathway (GO:0038179),0.3178194744630588,2.8313978494623657,3.245551361526629,['RAP1A'],0.6793662515996705,0,0,1
964,Nucleotide-Sugar Metabolic Process (GO:0009225),0.3178194744630588,2.8313978494623657,3.245551361526629,['ENTPD5'],0.6793662515996705,0,0,1
965,Oxoacid Metabolic Process (GO:0043436),0.3178194744630588,2.8313978494623657,3.245551361526629,['PPA2'],0.6793662515996705,0,0,1
966,Platelet-Derived Growth Factor Receptor Signaling Pathway (GO:0048008),0.3178194744630588,2.8313978494623657,3.245551361526629,['PDGFRB'],0.6793662515996705,0,0,1
967,Positive Regulation Of ERAD Pathway (GO:1904294),0.3178194744630588,2.8313978494623657,3.245551361526629,['RNFT1'],0.6793662515996705,0,0,1
968,Positive Regulation Of Fatty Acid Oxidation (GO:0046321),0.3178194744630588,2.8313978494623657,3.245551361526629,['IRS1'],0.6793662515996705,0,0,1
969,Positive Regulation Of Granulocyte Chemotaxis (GO:0071624),0.3178194744630588,2.8313978494623657,3.245551361526629,['MDK'],0.6793662515996705,0,0,1
970,Positive Regulation Of mRNA Metabolic Process (GO:1903313),0.3178194744630588,2.8313978494623657,3.245551361526629,['MOV10'],0.6793662515996705,0,0,1
971,Positive Regulation Of Natural Killer Cell Activation (GO:0032816),0.3178194744630588,2.8313978494623657,3.245551361526629,['HLA-E'],0.6793662515996705,0,0,1
972,Positive Regulation Of Neutrophil Chemotaxis (GO:0090023),0.3178194744630588,2.8313978494623657,3.245551361526629,['MDK'],0.6793662515996705,0,0,1
973,Positive Regulation Of Regulated Secretory Pathway (GO:1903307),0.3178194744630588,2.8313978494623657,3.245551361526629,['UNC13D'],0.6793662515996705,0,0,1
974,Protein Localization To Synapse (GO:0035418),0.3178194744630588,2.8313978494623657,3.245551361526629,['STAU1'],0.6793662515996705,0,0,1
975,Regulation Of Cell Projection Organization (GO:0031344),0.3178194744630588,2.8313978494623657,3.245551361526629,['MOV10'],0.6793662515996705,0,0,1
976,Positive Regulation Of Protein Localization To Nucleus (GO:1900182),0.3180955804503674,1.5457687021401925,1.7705286867148116,"['PPP3CB', 'LARP7', 'IPO5']",0.6793662515996705,0,0,3
977,Purine Ribonucleotide Metabolic Process (GO:0009150),0.3180955804503674,1.5457687021401925,1.7705286867148116,"['AMPD2', 'AK4', 'RHOQ']",0.6793662515996705,0,0,3
978,Regulation Of Neurotransmitter Receptor Activity (GO:0099601),0.32443844516198117,1.7704741379310345,1.9929509481776746,"['DLGAP1', 'SHISA6']",0.6793662515996705,0,0,2
979,Regulation Of Trans-Synaptic Signaling (GO:0099177),0.32443844516198117,1.7704741379310345,1.9929509481776746,"['CDKL5', 'NOL3']",0.6793662515996705,0,0,2
980,Response To Glucose (GO:0009749),0.32443844516198117,1.7704741379310345,1.9929509481776746,"['GPER1', 'PDK3']",0.6793662515996705,0,0,2
981,Negative Regulation Of Cysteine-Type Endopeptidase Activity (GO:2000117),0.32443844516198117,1.7704741379310345,1.9929509481776746,"['RPS6KA3', 'FNIP1']",0.6793662515996705,0,0,2
982,Non-Canonical Wnt Signaling Pathway (GO:0035567),0.32443844516198117,1.7704741379310345,1.9929509481776746,"['FZD3', 'FZD9']",0.6793662515996705,0,0,2
983,Peptidyl-Tyrosine Modification (GO:0018212),0.32443844516198117,1.7704741379310345,1.9929509481776746,"['PDGFRB', 'EPHB2']",0.6793662515996705,0,0,2
984,Positive Regulation Of B Cell Activation (GO:0050871),0.32443844516198117,1.7704741379310345,1.9929509481776746,"['INPP5D', 'EPHB2']",0.6793662515996705,0,0,2
985,Wnt Signaling Pathway (GO:0016055),0.32752362679019775,1.5180499845726627,1.694439929497005,"['FZD3', 'USP34', 'FZD9']",0.6793662515996705,0,0,3
986,Regulation Of Osteoblast Differentiation (GO:0045667),0.32752362679019775,1.5180499845726627,1.694439929497005,"['GDF10', 'RANBP3L', 'NPNT']",0.6793662515996705,0,0,3
987,Cellular Response To Reactive Oxygen Species (GO:0034614),0.32752362679019775,1.5180499845726627,1.694439929497005,"['PLEKHA1', 'PTPRK', 'MAPT']",0.6793662515996705,0,0,3
988,Positive Regulation Of MAP Kinase Activity (GO:0043406),0.32752362679019775,1.5180499845726627,1.694439929497005,"['PDGFRB', 'RASGRP1', 'SASH1']",0.6793662515996705,0,0,3
989,Negative Regulation Of Nucleic Acid-Templated Transcription (GO:1903507),0.32893440738742336,1.1658189084680664,1.296270450964719,"['TLE2', 'HMGB2', 'RFX3', 'ARID4A', 'PTPRK', 'DKK3', 'GLIS2', 'HMBOX1', 'DEAF1', 'BAHD1', 'CRY2', 'EPC1', 'CALR', 'MTA2']",0.6793662515996705,0,0,14
990,"Regulation Of mRNA Splicing, Via Spliceosome (GO:0048024)",0.3306706079034463,1.3997113997113997,1.5489661834521744,"['DDX17', 'LARP7', 'CELF6', 'PRDX6']",0.6793662515996705,0,0,4
991,Synapse Organization (GO:0050808),0.3363932519229057,1.3247308776126665,1.4432603923115777,"['PCDHB16', 'RAB29', 'PCDHB14', 'PCDHB4', 'MAPT']",0.6793662515996705,0,0,5
992,Glucose Homeostasis (GO:0042593),0.33694983442159837,1.49130385358645,1.6222719758981297,"['IRS1', 'CRY2', 'ADCY8']",0.6793662515996705,0,0,3
993,Negative Regulation Of Inflammatory Response (GO:0050728),0.33694983442159837,1.49130385358645,1.6222719758981297,"['MDK', 'GPER1', 'RORA']",0.6793662515996705,0,0,3
994,Regulation Of Dendrite Development (GO:0050773),0.3370562599584465,1.716692789968652,1.866912711963154,"['ALK', 'CDKL5']",0.6793662515996705,0,0,2
995,Regulation Of Microtubule Cytoskeleton Organization (GO:0070507),0.3370562599584465,1.716692789968652,1.866912711963154,"['CAMSAP3', 'MAPT']",0.6793662515996705,0,0,2
996,Cellular Response To Glucose Starvation (GO:0042149),0.3370562599584465,1.716692789968652,1.866912711963154,"['SESN1', 'PLIN2']",0.6793662515996705,0,0,2
997,Dendrite Morphogenesis (GO:0048813),0.3370562599584465,1.716692789968652,1.866912711963154,"['NOL3', 'EPHB2']",0.6793662515996705,0,0,2
998,Synaptic Vesicle Exocytosis (GO:0016079),0.3370562599584465,1.716692789968652,1.866912711963154,"['RIMS1', 'SNAP29']",0.6793662515996705,0,0,2
999,Intracellular Glucose Homeostasis (GO:0001678),0.3370562599584465,1.716692789968652,1.866912711963154,"['GPER1', 'PDK3']",0.6793662515996705,0,0,2
1000,Learning (GO:0007612),0.3370562599584465,1.716692789968652,1.866912711963154,"['PPP3CB', 'EPHB2']",0.6793662515996705,0,0,2
1001,Neural Crest Cell Development (GO:0014032),0.3370562599584465,1.716692789968652,1.866912711963154,"['SEMA5B', 'PDCD6']",0.6793662515996705,0,0,2
1002,Positive Regulation Of Axonogenesis (GO:0050772),0.3370562599584465,1.716692789968652,1.866912711963154,"['CDKL5', 'MAPT']",0.6793662515996705,0,0,2
1003,Positive Regulation Of Viral Process (GO:0048524),0.3370562599584465,1.716692789968652,1.866912711963154,"['DDB1', 'STAU1']",0.6793662515996705,0,0,2
1004,protein-DNA Complex Assembly (GO:0065004),0.3370562599584465,1.716692789968652,1.866912711963154,"['ATRX', 'HMGB2']",0.6793662515996705,0,0,2
1005,Regulation Of DNA Binding (GO:0051101),0.3370562599584465,1.716692789968652,1.866912711963154,"['ILRUN', 'HMGB2']",0.6793662515996705,0,0,2
1006,Regulation Of Dosage Compensation By Inactivation Of X Chromosome (GO:1900095),0.3411409932925384,2.573802541544477,2.768020181028312,['MSL2'],0.6793662515996705,0,0,1
1007,GTP Metabolic Process (GO:0046039),0.3411409932925384,2.573802541544477,2.768020181028312,['RHOQ'],0.6793662515996705,0,0,1
1008,Regulation Of Fatty Acid Beta-Oxidation (GO:0031998),0.3411409932925384,2.573802541544477,2.768020181028312,['IRS1'],0.6793662515996705,0,0,1
1009,Regulation Of Granulocyte Chemotaxis (GO:0071622),0.3411409932925384,2.573802541544477,2.768020181028312,['MDK'],0.6793662515996705,0,0,1
1010,Regulation Of Hemopoiesis (GO:1903706),0.3411409932925384,2.573802541544477,2.768020181028312,['NOTCH2'],0.6793662515996705,0,0,1
1011,Regulation Of Interleukin-4 Production (GO:0032673),0.3411409932925384,2.573802541544477,2.768020181028312,['HLA-E'],0.6793662515996705,0,0,1
1012,Activation Of Cysteine-Type Endopeptidase Activity (GO:0097202),0.3411409932925384,2.573802541544477,2.768020181028312,['CYFIP2'],0.6793662515996705,0,0,1
1013,Acute Inflammatory Response (GO:0002526),0.3411409932925384,2.573802541544477,2.768020181028312,['ITIH4'],0.6793662515996705,0,0,1
1014,Amyloid-Beta Metabolic Process (GO:0050435),0.3411409932925384,2.573802541544477,2.768020181028312,['BACE1'],0.6793662515996705,0,0,1
1015,Axonal Fasciculation (GO:0007413),0.3411409932925384,2.573802541544477,2.768020181028312,['EPHB2'],0.6793662515996705,0,0,1
1016,Calcium-Mediated Signaling Using Intracellular Calcium Source (GO:0035584),0.3411409932925384,2.573802541544477,2.768020181028312,['STIMATE'],0.6793662515996705,0,0,1
1017,Cardiac Conduction System Development (GO:0003161),0.3411409932925384,2.573802541544477,2.768020181028312,['NOTCH2'],0.6793662515996705,0,0,1
1018,Regulation Of Short-Term Neuronal Synaptic Plasticity (GO:0048172),0.3411409932925384,2.573802541544477,2.768020181028312,['SHISA6'],0.6793662515996705,0,0,1
1019,Cellular Response To Corticosteroid Stimulus (GO:0071384),0.3411409932925384,2.573802541544477,2.768020181028312,['GPER1'],0.6793662515996705,0,0,1
1020,Regulation Of Transcription From RNA Polymerase II Promoter In Response To Stress (GO:0043618),0.3411409932925384,2.573802541544477,2.768020181028312,['KLF2'],0.6793662515996705,0,0,1
1021,Signal Peptide Processing (GO:0006465),0.3411409932925384,2.573802541544477,2.768020181028312,['SEC11A'],0.6793662515996705,0,0,1
1022,Hematopoietic Progenitor Cell Differentiation (GO:0002244),0.3411409932925384,2.573802541544477,2.768020181028312,['LMBR1L'],0.6793662515996705,0,0,1
1023,Inner Ear Morphogenesis (GO:0042472),0.3411409932925384,2.573802541544477,2.768020181028312,['EPHB2'],0.6793662515996705,0,0,1
1024,Microvillus Assembly (GO:0030033),0.3411409932925384,2.573802541544477,2.768020181028312,['RAP1A'],0.6793662515996705,0,0,1
1025,Negative Regulation Of Defense Response To Virus (GO:0050687),0.3411409932925384,2.573802541544477,2.768020181028312,['ILRUN'],0.6793662515996705,0,0,1
1026,Negative Regulation Of Interleukin-2 Production (GO:0032703),0.3411409932925384,2.573802541544477,2.768020181028312,['SFTPD'],0.6793662515996705,0,0,1
1027,Negative Regulation Of Translational Initiation (GO:0045947),0.3411409932925384,2.573802541544477,2.768020181028312,['EIF3E'],0.6793662515996705,0,0,1
1028,Negative Regulation Of Tumor Necrosis Factor-Mediated Signaling Pathway (GO:0010804),0.3411409932925384,2.573802541544477,2.768020181028312,['CCDC3'],0.6793662515996705,0,0,1
1029,Negative Regulation Of Viral Life Cycle (GO:1903901),0.3411409932925384,2.573802541544477,2.768020181028312,['TRIM26'],0.6793662515996705,0,0,1
1030,Oligosaccharide-Lipid Intermediate Biosynthetic Process (GO:0006490),0.3411409932925384,2.573802541544477,2.768020181028312,['PDCD6'],0.6793662515996705,0,0,1
1031,Phagolysosome Assembly (GO:0001845),0.3411409932925384,2.573802541544477,2.768020181028312,['VPS33B'],0.6793662515996705,0,0,1
1032,Phosphatidylglycerol Metabolic Process (GO:0046471),0.3411409932925384,2.573802541544477,2.768020181028312,['MBOAT2'],0.6793662515996705,0,0,1
1033,Positive Regulation Of Cardiac Muscle Cell Proliferation (GO:0060045),0.3411409932925384,2.573802541544477,2.768020181028312,['GLI1'],0.6793662515996705,0,0,1
1034,Positive Regulation Of Cardiac Muscle Tissue Growth (GO:0055023),0.3411409932925384,2.573802541544477,2.768020181028312,['GLI1'],0.6793662515996705,0,0,1
1035,Positive Regulation Of Cartilage Development (GO:0061036),0.3411409932925384,2.573802541544477,2.768020181028312,['MDK'],0.6793662515996705,0,0,1
1036,Positive Regulation Of Cell Morphogenesis Involved In Differentiation (GO:0010770),0.3411409932925384,2.573802541544477,2.768020181028312,['CDKL5'],0.6793662515996705,0,0,1
1037,Positive Regulation Of Heterochromatin Formation (GO:0031453),0.3411409932925384,2.573802541544477,2.768020181028312,['ATF7IP2'],0.6793662515996705,0,0,1
1038,Positive Regulation Of Histone Acetylation (GO:0035066),0.3411409932925384,2.573802541544477,2.768020181028312,['DEK'],0.6793662515996705,0,0,1
1039,Positive Regulation Of Lipid Catabolic Process (GO:0050996),0.3411409932925384,2.573802541544477,2.768020181028312,['IRS1'],0.6793662515996705,0,0,1
1040,Positive Regulation Of Lipid Storage (GO:0010884),0.3411409932925384,2.573802541544477,2.768020181028312,['PLIN2'],0.6793662515996705,0,0,1
1041,Positive Regulation Of Macrophage Migration (GO:1905523),0.3411409932925384,2.573802541544477,2.768020181028312,['MDK'],0.6793662515996705,0,0,1
1042,Positive Regulation Of Mononuclear Cell Migration (GO:0071677),0.3411409932925384,2.573802541544477,2.768020181028312,['CALR'],0.6793662515996705,0,0,1
1043,Positive Regulation Of Morphogenesis Of An Epithelium (GO:1905332),0.3411409932925384,2.573802541544477,2.768020181028312,['MDK'],0.6793662515996705,0,0,1
1044,Positive Regulation Of Neuron Migration (GO:2001224),0.3411409932925384,2.573802541544477,2.768020181028312,['MDK'],0.6793662515996705,0,0,1
1045,Positive Regulation Of Nuclear-Transcribed mRNA poly(A) Tail Shortening (GO:0060213),0.3411409932925384,2.573802541544477,2.768020181028312,['TNRC6A'],0.6793662515996705,0,0,1
1046,Pulmonary Valve Morphogenesis (GO:0003184),0.3411409932925384,2.573802541544477,2.768020181028312,['NOTCH2'],0.6793662515996705,0,0,1
1047,Pyrimidine Deoxyribonucleotide Catabolic Process (GO:0009223),0.3411409932925384,2.573802541544477,2.768020181028312,['UPP2'],0.6793662515996705,0,0,1
1048,Regulation Of ATP Biosynthetic Process (GO:2001169),0.3411409932925384,2.573802541544477,2.768020181028312,['PID1'],0.6793662515996705,0,0,1
1049,Regulation Of DNA-templated DNA Replication (GO:0090329),0.3411409932925384,2.573802541544477,2.768020181028312,['MCM5'],0.6793662515996705,0,0,1
1050,Regulation Of cAMP-mediated Signaling (GO:0043949),0.3411409932925384,2.573802541544477,2.768020181028312,['PEX5L'],0.6793662515996705,0,0,1
1051,Regulation Of Calcium Ion Import (GO:0090279),0.3411409932925384,2.573802541544477,2.768020181028312,['PDGFRB'],0.6793662515996705,0,0,1
1052,Regulation Of Cell Fate Commitment (GO:0010453),0.3411409932925384,2.573802541544477,2.768020181028312,['MTA2'],0.6793662515996705,0,0,1
1053,Regulation Of Cell Fate Specification (GO:0042659),0.3411409932925384,2.573802541544477,2.768020181028312,['MTA2'],0.6793662515996705,0,0,1
1054,Regulation Of Double-Strand Break Repair Via Homologous Recombination (GO:0010569),0.3463686711139218,1.465480002979072,1.5537774413419903,"['PPP4R2', 'EPC1', 'ARID2']",0.6851836845007601,0,0,3
1055,Regulation Of Kinase Activity (GO:0043549),0.3463686711139218,1.465480002979072,1.5537774413419903,"['PDGFRB', 'PLCE1', 'MAPT']",0.6851836845007601,0,0,3
1056,Sphingolipid Biosynthetic Process (GO:0030148),0.3463686711139218,1.465480002979072,1.5537774413419903,"['ELOVL6', 'DEGS2', 'PLPP1']",0.6851836845007601,0,0,3
1057,Spliceosomal Complex Assembly (GO:0000245),0.3463686711139218,1.465480002979072,1.5537774413419903,"['SNRPD1', 'CELF6', 'NOL3']",0.6851836845007601,0,0,3
1058,Positive Regulation Of Endothelial Cell Migration (GO:0010595),0.3463686711139218,1.465480002979072,1.5537774413419903,"['PDCD6', 'CALR', 'SASH1']",0.6851836845007601,0,0,3
1059,Protein Phosphorylation (GO:0006468),0.34843361343186074,1.1416096490967347,1.2036076827349722,"['ALK', 'PDGFRB', 'CDKL5', 'ADAM10', 'RPS6KA3', 'PPP3CB', 'GRK3', 'ACVR1C', 'PPP4R1', 'STK17A', 'PEAK1', 'PDK3', 'SIK2', 'EPHB2', 'MAP4K5']",0.6851836845007601,0,0,15
1060,DNA Recombination (GO:0006310),0.3496022633384341,1.666075050709939,1.7509768376929402,"['MSH2', 'RAD54B']",0.6851836845007601,0,0,2
1061,Axonal Transport (GO:0098930),0.3496022633384341,1.666075050709939,1.7509768376929402,"['MAPT', 'AP3B2']",0.6851836845007601,0,0,2
1062,Regulation Of Small Molecule Metabolic Process (GO:0062012),0.3496022633384341,1.666075050709939,1.7509768376929402,"['PDK3', 'RORA']",0.6851836845007601,0,0,2
1063,Skin Development (GO:0043588),0.3496022633384341,1.666075050709939,1.7509768376929402,"['COL5A1', 'VPS33B']",0.6851836845007601,0,0,2
1064,Energy Derivation By Oxidation Of Organic Compounds (GO:0015980),0.3496022633384341,1.666075050709939,1.7509768376929402,"['PID1', 'UQCR10']",0.6851836845007601,0,0,2
1065,Glycolipid Biosynthetic Process (GO:0009247),0.3496022633384341,1.666075050709939,1.7509768376929402,"['SCCPDH', 'PIGM']",0.6851836845007601,0,0,2
1066,Positive Regulation Of Signal Transduction (GO:0009967),0.35479308977959184,1.2067267490476632,1.2504350014382835,"['ASXL1', 'RIMS1', 'IRS1', 'GPER1', 'ASXL2', 'GLI1', 'SASH1', 'KLF2']",0.6851836845007601,0,0,8
1067,Regulation Of TOR Signaling (GO:0032006),0.35577480098138703,1.4405315371380458,1.4887278758736993,"['PDCD6', 'RRAGD', 'FNIP1']",0.6851836845007601,0,0,3
1068,Organelle Assembly (GO:0070925),0.3567369555085849,1.1644087256027555,1.2002219651456145,"['CFAP221', 'SEPTIN2', 'AVIL', 'IQUB', 'AP1B1', 'RFX3', 'AP3B1', 'BBIP1', 'CEP41', 'SNAP29', 'SEPTIN7']",0.6851836845007601,0,0,11
1069,DNA-templated DNA Replication Maintenance Of Fidelity (GO:0045005),0.36206664835091396,1.6183497536945812,1.644125165937458,"['CAMSAP3', 'ATRX']",0.6851836845007601,0,0,2
1070,Regulation Of Immune Response (GO:0050776),0.36206664835091396,1.6183497536945812,1.644125165937458,"['INPP5D', 'DHX58']",0.6851836845007601,0,0,2
1071,Regulation Of Microtubule Polymerization (GO:0031113),0.36206664835091396,1.6183497536945812,1.644125165937458,"['CAMSAP3', 'MAPT']",0.6851836845007601,0,0,2
1072,Regulation Of Microtubule-Based Process (GO:0032886),0.36206664835091396,1.6183497536945812,1.644125165937458,"['CAMSAP3', 'MAPT']",0.6851836845007601,0,0,2
1073,Histone H4 Acetylation (GO:0043967),0.36206664835091396,1.6183497536945812,1.644125165937458,"['MSL2', 'EPC1']",0.6851836845007601,0,0,2
1074,Negative Regulation Of Protein Localization (GO:1903828),0.36206664835091396,1.6183497536945812,1.644125165937458,"['ILRUN', 'CTNNA1']",0.6851836845007601,0,0,2
1075,Regulation Of Cell Development (GO:0060284),0.36206664835091396,1.6183497536945812,1.644125165937458,"['DOCK7', 'HMGB2']",0.6851836845007601,0,0,2
1076,2-Oxoglutarate Metabolic Process (GO:0006103),0.3636668768952532,2.3591397849462368,2.38631000666534,['L2HGDH'],0.6851836845007601,0,0,1
1077,DNA Unwinding Involved In DNA Replication (GO:0006268),0.3636668768952532,2.3591397849462368,2.38631000666534,['MCM5'],0.6851836845007601,0,0,1
1078,Regulation Of Megakaryocyte Differentiation (GO:0045652),0.3636668768952532,2.3591397849462368,2.38631000666534,['HMGB2'],0.6851836845007601,0,0,1
1079,Regulation Of miRNA-mediated Gene Silencing (GO:0060964),0.3636668768952532,2.3591397849462368,2.38631000666534,['PUM2'],0.6851836845007601,0,0,1
1080,Aorta Morphogenesis (GO:0035909),0.3636668768952532,2.3591397849462368,2.38631000666534,['PDGFRB'],0.6851836845007601,0,0,1
1081,Regulation Of Muscle Contraction (GO:0006937),0.3636668768952532,2.3591397849462368,2.38631000666534,['PLCE1'],0.6851836845007601,0,0,1
1082,Calcium Ion-Regulated Exocytosis Of Neurotransmitter (GO:0048791),0.3636668768952532,2.3591397849462368,2.38631000666534,['RIMS1'],0.6851836845007601,0,0,1
1083,Regulation Of Receptor Recycling (GO:0001919),0.3636668768952532,2.3591397849462368,2.38631000666534,['RAB29'],0.6851836845007601,0,0,1
1084,Cellular Response To Chemokine (GO:1990869),0.3636668768952532,2.3591397849462368,2.38631000666534,['GPR35'],0.6851836845007601,0,0,1
1085,Cellular Response To Nitrogen Compound (GO:1901699),0.3636668768952532,2.3591397849462368,2.38631000666534,['ATRX'],0.6851836845007601,0,0,1
1086,Detection Of Mechanical Stimulus Involved In Sensory Perception (GO:0050974),0.3636668768952532,2.3591397849462368,2.38631000666534,['COL11A1'],0.6851836845007601,0,0,1
1087,Dolichol Metabolic Process (GO:0019348),0.3636668768952532,2.3591397849462368,2.38631000666534,['PDCD6'],0.6851836845007601,0,0,1
1088,Ruffle Organization (GO:0031529),0.3636668768952532,2.3591397849462368,2.38631000666534,['PLEKHA1'],0.6851836845007601,0,0,1
1089,Embryonic Skeletal System Development (GO:0048706),0.3636668768952532,2.3591397849462368,2.38631000666534,['DEAF1'],0.6851836845007601,0,0,1
1090,Synaptic Vesicle Membrane Organization (GO:0048499),0.3636668768952532,2.3591397849462368,2.38631000666534,['SNAP29'],0.6851836845007601,0,0,1
1091,fatty-acyl-CoA Metabolic Process (GO:0035337),0.3636668768952532,2.3591397849462368,2.38631000666534,['NUDT7'],0.6851836845007601,0,0,1
1092,Glycoprotein Catabolic Process (GO:0006516),0.3636668768952532,2.3591397849462368,2.38631000666534,['FBXO2'],0.6851836845007601,0,0,1
1093,Hexose Transmembrane Transport (GO:0008645),0.3636668768952532,2.3591397849462368,2.38631000666534,['SLC5A3'],0.6851836845007601,0,0,1
1094,Intracellular Monoatomic Ion Homeostasis (GO:0006873),0.3636668768952532,2.3591397849462368,2.38631000666534,['LETM1'],0.6851836845007601,0,0,1
1095,miRNA-mediated Gene Silencing By Inhibition Of Translation (GO:0035278),0.3636668768952532,2.3591397849462368,2.38631000666534,['TNRC6A'],0.6851836845007601,0,0,1
1096,Mitochondrion Transport Along Microtubule (GO:0047497),0.3636668768952532,2.3591397849462368,2.38631000666534,['MAPT'],0.6851836845007601,0,0,1
1097,Monocarboxylic Acid Catabolic Process (GO:0072329),0.3636668768952532,2.3591397849462368,2.38631000666534,['LPIN2'],0.6851836845007601,0,0,1
1098,Negative Regulation Of Lymphocyte Proliferation (GO:0050672),0.3636668768952532,2.3591397849462368,2.38631000666534,['SFTPD'],0.6851836845007601,0,0,1
1099,Negative Regulation Of Peptide Hormone Secretion (GO:0090278),0.3636668768952532,2.3591397849462368,2.38631000666534,['IRS1'],0.6851836845007601,0,0,1
1100,Negative Regulation Of Release Of Cytochrome C From Mitochondria (GO:0090201),0.3636668768952532,2.3591397849462368,2.38631000666534,['NOL3'],0.6851836845007601,0,0,1
1101,Negative Regulation Of Transposition (GO:0010529),0.3636668768952532,2.3591397849462368,2.38631000666534,['MOV10'],0.6851836845007601,0,0,1
1102,Peptide Catabolic Process (GO:0043171),0.3636668768952532,2.3591397849462368,2.38631000666534,['TPP1'],0.6851836845007601,0,0,1
1103,Phosphatidylserine Metabolic Process (GO:0006658),0.3636668768952532,2.3591397849462368,2.38631000666534,['MBOAT2'],0.6851836845007601,0,0,1
1104,Positive Regulation Of Antigen Receptor-Mediated Signaling Pathway (GO:0050857),0.3636668768952532,2.3591397849462368,2.38631000666534,['RAB29'],0.6851836845007601,0,0,1
1105,Positive Regulation Of Interleukin-12 Production (GO:0032735),0.3636668768952532,2.3591397849462368,2.38631000666534,['MDK'],0.6851836845007601,0,0,1
1106,Positive Regulation Of Nervous System Process (GO:0031646),0.3636668768952532,2.3591397849462368,2.38631000666534,['RIMS1'],0.6851836845007601,0,0,1
1107,Positive Regulation Of Neutrophil Migration (GO:1902624),0.3636668768952532,2.3591397849462368,2.38631000666534,['MDK'],0.6851836845007601,0,0,1
1108,Post-Translational Protein Targeting To Endoplasmic Reticulum Membrane (GO:0006620),0.3636668768952532,2.3591397849462368,2.38631000666534,['SEC62'],0.6851836845007601,0,0,1
1109,Protein Hydroxylation (GO:0018126),0.3636668768952532,2.3591397849462368,2.38631000666534,['VPS33B'],0.6851836845007601,0,0,1
1110,Protein Import Into Peroxisome Matrix (GO:0016558),0.3636668768952532,2.3591397849462368,2.38631000666534,['PEX5L'],0.6851836845007601,0,0,1
1111,Regulation Of T Cell Mediated Cytotoxicity (GO:0001914),0.3636668768952532,2.3591397849462368,2.38631000666534,['HLA-E'],0.6851836845007601,0,0,1
1112,Regulation Of Brown Fat Cell Differentiation (GO:0090335),0.3636668768952532,2.3591397849462368,2.38631000666534,['RREB1'],0.6851836845007601,0,0,1
1113,Regulation Of Carbohydrate Catabolic Process (GO:0043470),0.3636668768952532,2.3591397849462368,2.38631000666534,['SCARB2'],0.6851836845007601,0,0,1
1114,Regulation Of Protein Secretion (GO:0050708),0.3651630837037535,1.416414686825054,1.426912048415905,"['PPP3CB', 'RFX3', 'ADCY8']",0.6861532137336659,0,0,3
1115,Response To Lipid (GO:0033993),0.3651630837037535,1.416414686825054,1.426912048415905,"['ASXL1', 'RPS6KA3', 'HMGB2']",0.6861532137336659,0,0,3
1116,Positive Regulation Of Vasculature Development (GO:1904018),0.3651630837037535,1.416414686825054,1.426912048415905,"['BTG1', 'PDCD6', 'SASH1']",0.6861532137336659,0,0,3
1117,Double-Strand Break Repair Via Homologous Recombination (GO:0000724),0.3697141274694751,1.317829457364341,1.311273519954346,"['ATRX', 'EPC1', 'MCM5', 'RAD54B']",0.6862342466436371,0,0,4
