Rank,Term name,P-value,Z-score,Combined score,Overlapping genes,Adjusted p-value,Old p-value,Old adjusted p-value,gene count
1437,Cellular Response To cAMP (GO:0071320),0.5182959516305419,1.4146236559139784,0.9297032068503915,['RAP1A'],0.7490465958437259,0,0,1
1438,Regulation Of Synapse Organization (GO:0050807),0.5182959516305419,1.4146236559139784,0.9297032068503915,['CDKL5'],0.7490465958437259,0,0,1
1439,Establishment Of Endothelial Barrier (GO:0061028),0.5182959516305419,1.4146236559139784,0.9297032068503915,['RAP1A'],0.7490465958437259,0,0,1
1440,Fatty Acid Transport (GO:0015908),0.5182959516305419,1.4146236559139784,0.9297032068503915,['ARID4A'],0.7490465958437259,0,0,1
1441,fatty-acyl-CoA Biosynthetic Process (GO:0046949),0.5182959516305419,1.4146236559139784,0.9297032068503915,['ELOVL6'],0.7490465958437259,0,0,1
1442,"Wound Healing, Spreading Of Cells (GO:0044319)",0.5182959516305419,1.4146236559139784,0.9297032068503915,['COL5A1'],0.7490465958437259,0,0,1
1443,Muscle Cell Development (GO:0055001),0.5182959516305419,1.4146236559139784,0.9297032068503915,['SGCZ'],0.7490465958437259,0,0,1
1444,Negative Regulation Of Oxidative Stress-Induced Cell Death (GO:1903202),0.5182959516305419,1.4146236559139784,0.9297032068503915,['NOL3'],0.7490465958437259,0,0,1
1445,Positive Regulation Of Cell Communication (GO:0010647),0.5182959516305419,1.4146236559139784,0.9297032068503915,['RIMS1'],0.7490465958437259,0,0,1
1446,Positive Regulation Of Cilium Assembly (GO:0045724),0.5182959516305419,1.4146236559139784,0.9297032068503915,['SEPTIN7'],0.7490465958437259,0,0,1
1447,Positive Regulation Of Erythrocyte Differentiation (GO:0045648),0.5182959516305419,1.4146236559139784,0.9297032068503915,['HMGB2'],0.7490465958437259,0,0,1
1448,Positive Regulation Of Leukocyte Cell-Cell Adhesion (GO:1903039),0.5182959516305419,1.4146236559139784,0.9297032068503915,['MDK'],0.7490465958437259,0,0,1
1449,Positive Regulation Of Response To Biotic Stimulus (GO:0002833),0.5182959516305419,1.4146236559139784,0.9297032068503915,['SASH1'],0.7490465958437259,0,0,1
1450,Regulation Of B Cell Proliferation (GO:0030888),0.5182959516305419,1.4146236559139784,0.9297032068503915,['EPHB2'],0.7490465958437259,0,0,1
1451,Regulation Of Axon Extension Involved In Axon Guidance (GO:0048841),0.5182959516305419,1.4146236559139784,0.9297032068503915,['SEMA5B'],0.7490465958437259,0,0,1
1452,Positive Regulation Of Protein Polymerization (GO:0032273),0.524068870427104,1.1547325826882477,0.7461098707901248,"['VASP', 'MAPT']",0.7556772823198795,0,0,2
1453,Regulation Of Actin Filament-Based Process (GO:0032970),0.524068870427104,1.1547325826882477,0.7461098707901248,"['PDGFRB', 'RHOQ']",0.7556772823198795,0,0,2
1454,Transcription By RNA Polymerase II (GO:0006366),0.5259929124504067,1.0348886532343584,0.6648823680081422,"['NCOA1', 'DEAF1', 'ETV1', 'DEK', 'GTF2H3', 'RREB1']",0.7556772823198795,0,0,6
1455,Positive Regulation Of Cell Population Proliferation (GO:0008284),0.5334729352356044,1.0100250626566416,0.6346461575517868,"['PDGFRB', 'PID1', 'IRS1', 'MDK', 'GPER1', 'FZD9', 'ADAM10', 'CALR', 'GLI1', 'S100B']",0.7556772823198795,0,0,10
1456,Regulation Of Embryonic Development (GO:0045995),0.5345586912959106,1.131551724137931,0.7087064020411701,"['RACGAP1', 'SEPTIN7']",0.7556772823198795,0,0,2
1457,Positive Regulation Of Secretion By Cell (GO:1903532),0.5345586912959106,1.131551724137931,0.7087064020411701,"['GPER1', 'UNC13D']",0.7556772823198795,0,0,2
1458,Post-Transcriptional Regulation Of Gene Expression (GO:0010608),0.5345586912959106,1.131551724137931,0.7087064020411701,"['PUM3', 'PUM2']",0.7556772823198795,0,0,2
1459,Negative Regulation Of Developmental Process (GO:0051093),0.534677766508345,1.0741996336495612,0.6725467433881256,"['NFIB', 'ARID4A', 'MAPT']",0.7556772823198795,0,0,3
1460,Blood Circulation (GO:0008015),0.5347759117609447,1.34715821812596,0.8431964005549181,['SGCZ'],0.7556772823198795,0,0,1
1461,Regulation Of Response To Biotic Stimulus (GO:0002831),0.5347759117609447,1.34715821812596,0.8431964005549181,['DHX58'],0.7556772823198795,0,0,1
1462,Cellular Response To Epidermal Growth Factor Stimulus (GO:0071364),0.5347759117609447,1.34715821812596,0.8431964005549181,['IQGAP1'],0.7556772823198795,0,0,1
1463,Regulatory ncRNA Processing (GO:0070918),0.5347759117609447,1.34715821812596,0.8431964005549181,['PUM2'],0.7556772823198795,0,0,1
1464,Cortical Cytoskeleton Organization (GO:0030865),0.5347759117609447,1.34715821812596,0.8431964005549181,['RHOQ'],0.7556772823198795,0,0,1
1465,Secondary Alcohol Biosynthetic Process (GO:1902653),0.5347759117609447,1.34715821812596,0.8431964005549181,['TM7SF2'],0.7556772823198795,0,0,1
1466,Endosome Transport Via Multivesicular Body Sorting Pathway (GO:0032509),0.5347759117609447,1.34715821812596,0.8431964005549181,['TMEM50B'],0.7556772823198795,0,0,1
1467,Vascular Endothelial Growth Factor Receptor Signaling Pathway (GO:0048010),0.5347759117609447,1.34715821812596,0.8431964005549181,['PDCD6'],0.7556772823198795,0,0,1
1468,Gonad Development (GO:0008406),0.5347759117609447,1.34715821812596,0.8431964005549181,['MSH2'],0.7556772823198795,0,0,1
1469,Lipid Droplet Organization (GO:0034389),0.5347759117609447,1.34715821812596,0.8431964005549181,['PLIN2'],0.7556772823198795,0,0,1
1470,Negative Regulation Of DNA Binding (GO:0043392),0.5347759117609447,1.34715821812596,0.8431964005549181,['ILRUN'],0.7556772823198795,0,0,1
1471,Negative Regulation Of TORC1 Signaling (GO:1904262),0.5347759117609447,1.34715821812596,0.8431964005549181,['SESN1'],0.7556772823198795,0,0,1
1472,Negative Regulation Of Immune System Process (GO:0002683),0.5347759117609447,1.34715821812596,0.8431964005549181,['GPER1'],0.7556772823198795,0,0,1
1473,Organic Cation Transport (GO:0015695),0.5347759117609447,1.34715821812596,0.8431964005549181,['SLC44A2'],0.7556772823198795,0,0,1
1474,Positive Regulation Of JUN Kinase Activity (GO:0043507),0.5347759117609447,1.34715821812596,0.8431964005549181,['SASH1'],0.7556772823198795,0,0,1
1475,Positive Regulation Of T Cell Mediated Immunity (GO:0002711),0.5347759117609447,1.34715821812596,0.8431964005549181,['HLA-E'],0.7556772823198795,0,0,1
1476,Positive Regulation Of Calcium Ion Transmembrane Transporter Activity (GO:1901021),0.5347759117609447,1.34715821812596,0.8431964005549181,['PPP3CB'],0.7556772823198795,0,0,1
1477,Positive Regulation Of Cell Division (GO:0051781),0.5347759117609447,1.34715821812596,0.8431964005549181,['RACGAP1'],0.7556772823198795,0,0,1
1478,Positive Regulation Of Excitatory Postsynaptic Potential (GO:2000463),0.5347759117609447,1.34715821812596,0.8431964005549181,['RIMS1'],0.7556772823198795,0,0,1
1479,Positive Regulation Of Pathway-Restricted SMAD Protein Phosphorylation (GO:0010862),0.5347759117609447,1.34715821812596,0.8431964005549181,['GDF10'],0.7556772823198795,0,0,1
1480,Positive Regulation Of Protein Import Into Nucleus (GO:0042307),0.5347759117609447,1.34715821812596,0.8431964005549181,['IPO5'],0.7556772823198795,0,0,1
1481,Positive Regulation Of Release Of Sequestered Calcium Ion Into Cytosol (GO:0051281),0.5347759117609447,1.34715821812596,0.8431964005549181,['GPER1'],0.7556772823198795,0,0,1
1482,Positive Regulation Of Ubiquitin-Protein Transferase Activity (GO:0051443),0.5347759117609447,1.34715821812596,0.8431964005549181,['TOPORS'],0.7556772823198795,0,0,1
1483,Regulation Of T Cell Receptor Signaling Pathway (GO:0050856),0.5347759117609447,1.34715821812596,0.8431964005549181,['RAB29'],0.7556772823198795,0,0,1
1484,Regulation Of Cell Cycle Phase Transition (GO:1901987),0.5347759117609447,1.34715821812596,0.8431964005549181,['DDB1'],0.7556772823198795,0,0,1
1485,Negative Regulation Of Cell Migration (GO:0030336),0.5353835756400248,1.0476190476190477,0.6545228644625232,"['ARID4A', 'CALR', 'PTPRK', 'ARID2']",0.7560265037825805,0,0,4
1486,Membrane Organization (GO:0061024),0.5363686678680799,1.0322687904745318,0.6430348530789399,"['RIMS1', 'SERP1', 'VPS33B', 'SNAP29', 'SGCZ']",0.7562667912406543,0,0,5
1487,Vesicle-Mediated Transport (GO:0016192),0.5366399195912904,1.0039360842478429,0.6248778790347821,"['SNX27', 'SCFD2', 'VPS33B', 'AP1B1', 'MYCBPAP', 'AP2A1', 'AP3B1', 'VPS45', 'SNAP29', 'AP3B2', 'RHOQ', 'RHOBTB2']",0.7562667912406543,0,0,12
1488,Negative Regulation Of Cellular Process (GO:0048523),0.538129349591923,1.0015999903759978,0.6206477651174198,"['KANK2', 'BTG1', 'ADAM10', 'PTPRK', 'PDS5B', 'CGRRF1', 'PPM1D', 'MDK', 'GPER1', 'FTH1', 'EPHB2', 'ARID2', 'PLPP1']",0.7562667912406543,0,0,13
1489,Negative Regulation Of Transcription By RNA Polymerase II (GO:0000122),0.5397162920972649,0.996555058875289,0.614587127123736,"['KANK2', 'ZNF891', 'HMGB2', 'LARP7', 'ARID4A', 'ZNF69', 'PHF21A', 'KLF2', 'GLIS2', 'HMBOX1', 'DEAF1', 'CRY2', 'EPC1', 'LCOR', 'CALR', 'FNIP1', 'MTA2', 'RREB1', 'JAZF1']",0.7562667912406543,0,0,19
1490,Cellular Response To Salt (GO:1902075),0.542911961063256,1.0606911447084233,0.647878749696796,"['CPNE3', 'IQGAP1', 'ADCY8']",0.7562667912406543,0,0,3
1491,Protein Homooligomerization (GO:0051260),0.542911961063256,1.0606911447084233,0.647878749696796,"['LETM1', 'ADCY8', 'NOL3']",0.7562667912406543,0,0,3
1492,Protein Processing (GO:0016485),0.542911961063256,1.0606911447084233,0.647878749696796,"['BACE1', 'ADAM10', 'SEC11A']",0.7562667912406543,0,0,3
1493,Activation Of Protein Kinase Activity (GO:0032147),0.5448890208348348,1.1092799188640974,0.673524967648995,"['CAB39L', 'ADCY8']",0.7562667912406543,0,0,2
1494,Regulation Of Transcription Initiation By RNA Polymerase II (GO:0060260),0.5448890208348348,1.1092799188640974,0.673524967648995,"['MED13', 'PPM1D']",0.7562667912406543,0,0,2
1495,Negative Regulation Of Kinase Activity (GO:0033673),0.5448890208348348,1.1092799188640974,0.673524967648995,"['MAPT', 'EPHB2']",0.7562667912406543,0,0,2
1496,Positive Regulation Of DNA Biosynthetic Process (GO:2000573),0.5448890208348348,1.1092799188640974,0.673524967648995,"['PDGFRB', 'HMBOX1']",0.7562667912406543,0,0,2
1497,Positive Regulation Of T Cell Activation (GO:0050870),0.5448890208348348,1.1092799188640974,0.673524967648995,"['MDK', 'ARID2']",0.7562667912406543,0,0,2
1498,Defense Response To Virus (GO:0051607),0.5494345959679595,1.0284140102321921,0.6158817083402732,"['MOV10', 'TTC4', 'DHX58', 'TRIM26']",0.7562667912406543,0,0,4
1499,Regulation Of Chromatin Organization (GO:1902275),0.5506932295595334,1.2858260019550343,0.7670947035682092,['MSL2'],0.7562667912406543,0,0,1
1500,GPI Anchor Metabolic Process (GO:0006505),0.5506932295595334,1.2858260019550343,0.7670947035682092,['PIGM'],0.7562667912406543,0,0,1
1501,RNA Phosphodiester Bond Hydrolysis (GO:0090501),0.5506932295595334,1.2858260019550343,0.7670947035682092,['NUDT16'],0.7562667912406543,0,0,1
1502,Regulation Of Hippo Signaling (GO:0035330),0.5506932295595334,1.2858260019550343,0.7670947035682092,['ARRDC3'],0.7562667912406543,0,0,1
1503,U2-type Prespliceosome Assembly (GO:1903241),0.5506932295595334,1.2858260019550343,0.7670947035682092,['SNRPD1'],0.7562667912406543,0,0,1
1504,Cell-Cell Signaling By Wnt (GO:0198738),0.5506932295595334,1.2858260019550343,0.7670947035682092,['USP34'],0.7562667912406543,0,0,1
1505,Regulation Of Sprouting Angiogenesis (GO:1903670),0.5506932295595334,1.2858260019550343,0.7670947035682092,['KLF2'],0.7562667912406543,0,0,1
1506,Regulation Of Viral Entry Into Host Cell (GO:0046596),0.5506932295595334,1.2858260019550343,0.7670947035682092,['TRIM26'],0.7562667912406543,0,0,1
1507,Cholesterol Biosynthetic Process (GO:0006695),0.5506932295595334,1.2858260019550343,0.7670947035682092,['TM7SF2'],0.7562667912406543,0,0,1
1508,Chromosome Organization (GO:0051276),0.5506932295595334,1.2858260019550343,0.7670947035682092,['MSH2'],0.7562667912406543,0,0,1
1509,Response To Peptide (GO:1901652),0.5506932295595334,1.2858260019550343,0.7670947035682092,['IRS1'],0.7562667912406543,0,0,1
1510,Sensory Perception (GO:0007600),0.5506932295595334,1.2858260019550343,0.7670947035682092,['CDH23'],0.7562667912406543,0,0,1
1511,Stress Granule Assembly (GO:0034063),0.5506932295595334,1.2858260019550343,0.7670947035682092,['MAPT'],0.7562667912406543,0,0,1
1512,Heart Contraction (GO:0060047),0.5506932295595334,1.2858260019550343,0.7670947035682092,['SGCZ'],0.7562667912406543,0,0,1
1513,Late Endosome To Vacuole Transport Via Multivesicular Body Sorting Pathway (GO:0032511),0.5506932295595334,1.2858260019550343,0.7670947035682092,['TMEM50B'],0.7562667912406543,0,0,1
1514,Negative Regulation Of Blood Vessel Endothelial Cell Migration (GO:0043537),0.5506932295595334,1.2858260019550343,0.7670947035682092,['STARD13'],0.7562667912406543,0,0,1
1515,Negative Regulation Of Carbohydrate Metabolic Process (GO:0045912),0.5506932295595334,1.2858260019550343,0.7670947035682092,['AP2A1'],0.7562667912406543,0,0,1
1516,Negative Regulation Of Smooth Muscle Cell Proliferation (GO:0048662),0.5506932295595334,1.2858260019550343,0.7670947035682092,['GPER1'],0.7562667912406543,0,0,1
1517,Negative Regulation Of Telomere Maintenance Via Telomere Lengthening (GO:1904357),0.5506932295595334,1.2858260019550343,0.7670947035682092,['NAT10'],0.7562667912406543,0,0,1
1518,Negative Regulation Of Tumor Necrosis Factor Production (GO:0032720),0.5506932295595334,1.2858260019550343,0.7670947035682092,['ILRUN'],0.7562667912406543,0,0,1
1519,Negative Regulation Of Tumor Necrosis Factor Superfamily Cytokine Production (GO:1903556),0.5506932295595334,1.2858260019550343,0.7670947035682092,['ILRUN'],0.7562667912406543,0,0,1
1520,Phospholipid Biosynthetic Process (GO:0008654),0.5506932295595334,1.2858260019550343,0.7670947035682092,['AGPAT3'],0.7562667912406543,0,0,1
1521,Positive Regulation Of Cell-Cell Adhesion (GO:0022409),0.5506932295595334,1.2858260019550343,0.7670947035682092,['MDK'],0.7562667912406543,0,0,1
1522,Positive Regulation Of Filopodium Assembly (GO:0051491),0.5506932295595334,1.2858260019550343,0.7670947035682092,['RHOQ'],0.7562667912406543,0,0,1
1523,Positive Regulation Of mRNA Processing (GO:0050685),0.5506932295595334,1.2858260019550343,0.7670947035682092,['PRDX6'],0.7562667912406543,0,0,1
1524,Positive Regulation Of Microtubule Polymerization Or Depolymerization (GO:0031112),0.5506932295595334,1.2858260019550343,0.7670947035682092,['MAPT'],0.7562667912406543,0,0,1
1525,Protein Localization To Chromatin (GO:0071168),0.5506932295595334,1.2858260019550343,0.7670947035682092,['MSH2'],0.7562667912406543,0,0,1
1526,Purine Ribonucleotide Catabolic Process (GO:0009154),0.5506932295595334,1.2858260019550343,0.7670947035682092,['NUDT7'],0.7562667912406543,0,0,1
1527,Cellular Response To Insulin Stimulus (GO:0032869),0.5510613528925703,1.0475161987041037,0.6242244642901016,"['IRS1', 'LPIN2', 'RHOQ']",0.7562667912406543,0,0,3
1528,Response To Cytokine (GO:0034097),0.5510613528925703,1.0475161987041037,0.6242244642901016,"['ITIH4', 'PID1', 'AFF3']",0.7562667912406543,0,0,3
1529,Proteolysis (GO:0006508),0.5545013545955922,1.0038847440185232,0.5919768085561539,"['BACE1', 'FBXO2', 'ADAM33', 'CAPN2', 'ADAM10', 'TPP1']",0.75926788293606,0,0,6
1530,Regulation Of Intracellular Signal Transduction (GO:1902531),0.5545698438123505,0.9964026701036878,0.5874416710550793,"['STARD13', 'PEX5L', 'RACGAP1', 'SPATA13', 'ARHGAP29', 'MAPT', 'ARHGAP27', 'STYXL1']",0.75926788293606,0,0,8
1531,Sensory Perception Of Mechanical Stimulus (GO:0050954),0.555058495250825,1.0878647214854111,0.6404061340521106,"['COL11A1', 'CDH23']",0.75926788293606,0,0,2
1532,Negative Regulation Of Angiogenesis (GO:0016525),0.555058495250825,1.0878647214854111,0.6404061340521106,"['HSPG2', 'KLF2']",0.75926788293606,0,0,2
1533,Positive Regulation Of Cell Adhesion (GO:0045785),0.555058495250825,1.0878647214854111,0.6404061340521106,"['MDK', 'NPNT']",0.75926788293606,0,0,2
1534,Response To UV (GO:0009411),0.5591244241384564,1.0346625928462307,0.6015354979471458,"['DDB1', 'MSH2', 'PTPRK']",0.7632915522443551,0,0,3
1535,Fatty Acid Metabolic Process (GO:0006631),0.5591244241384564,1.0346625928462307,0.6015354979471458,"['CPT2', 'NAAA', 'LPIN2']",0.7632915522443551,0,0,3
1536,Protein-Containing Complex Assembly (GO:0065003),0.5595129710621459,0.9899701146880774,0.5748643284476513,"['RIMS1', 'SHQ1', 'PDCD6', 'PDE4DIP', 'FANCC', 'MAPT', 'ADCY8', 'NOL3', 'TEAD1']",0.7632915522443551,0,0,9
1537,Regulation Of Cytokinesis (GO:0032465),0.5650660291854646,1.0672576447625244,0.6092042059015388,"['RACGAP1', 'KLHL13']",0.7632915522443551,0,0,2
1538,Calcium Ion Transmembrane Import Into Cytosol (GO:0097553),0.5650660291854646,1.0672576447625244,0.6092042059015388,"['PLCE1', 'PLCD1']",0.7632915522443551,0,0,2
1539,Regulation Of Translation (GO:0006417),0.5656833914766758,0.9919908466819222,0.5651577555806738,"['RPS6KA3', 'SAMD4A', 'NAT10', 'EIF3E', 'CALR', 'PUM3']",0.7632915522443551,0,0,6
1540,Regulation Of Establishment Of Planar Polarity (GO:0090175),0.5660670742948688,1.2298270219728846,0.6998240915501036,['FZD3'],0.7632915522443551,0,0,1
1541,"Wnt Signaling Pathway, Planar Cell Polarity Pathway (GO:0060071)",0.5660670742948688,1.2298270219728846,0.6998240915501036,['FZD3'],0.7632915522443551,0,0,1
1542,Regulation Of Mitochondrial Fission (GO:0090140),0.5660670742948688,1.2298270219728846,0.6998240915501036,['MAPT'],0.7632915522443551,0,0,1
1543,Regulation Of Nitric Oxide Biosynthetic Process (GO:0045428),0.5660670742948688,1.2298270219728846,0.6998240915501036,['KLF2'],0.7632915522443551,0,0,1
1544,Bone Development (GO:0060348),0.5660670742948688,1.2298270219728846,0.6998240915501036,['RANBP3L'],0.7632915522443551,0,0,1
1545,Cell Surface Receptor Signaling Pathway Involved In Cell-Cell Signaling (GO:1905114),0.5660670742948688,1.2298270219728846,0.6998240915501036,['USP34'],0.7632915522443551,0,0,1
1546,Central Nervous System Neuron Differentiation (GO:0021953),0.5660670742948688,1.2298270219728846,0.6998240915501036,['MAPT'],0.7632915522443551,0,0,1
1547,Triglyceride Metabolic Process (GO:0006641),0.5660670742948688,1.2298270219728846,0.6998240915501036,['LPIN2'],0.7632915522443551,0,0,1
1548,Icosanoid Metabolic Process (GO:0006690),0.5660670742948688,1.2298270219728846,0.6998240915501036,['TBXAS1'],0.7632915522443551,0,0,1
1549,Negative Regulation Of DNA Recombination (GO:0045910),0.5660670742948688,1.2298270219728846,0.6998240915501036,['MSH2'],0.7632915522443551,0,0,1
1550,Negative Regulation Of JNK Cascade (GO:0046329),0.5660670742948688,1.2298270219728846,0.6998240915501036,['DUSP16'],0.7632915522443551,0,0,1
1551,Negative Regulation Of Cell-Matrix Adhesion (GO:0001953),0.5660670742948688,1.2298270219728846,0.6998240915501036,['AJAP1'],0.7632915522443551,0,0,1
1552,"Nuclear-Transcribed mRNA Catabolic Process, Nonsense-Mediated Decay (GO:0000184)",0.5660670742948688,1.2298270219728846,0.6998240915501036,['EIF3E'],0.7632915522443551,0,0,1
1553,Positive Regulation Of Carbohydrate Metabolic Process (GO:0045913),0.5660670742948688,1.2298270219728846,0.6998240915501036,['IRS1'],0.7632915522443551,0,0,1
1554,Positive Regulation Of Nitrogen Compound Metabolic Process (GO:0051173),0.5660670742948688,1.2298270219728846,0.6998240915501036,['KLF2'],0.7632915522443551,0,0,1
1555,Protein Targeting To Lysosome (GO:0006622),0.5660670742948688,1.2298270219728846,0.6998240915501036,['SCARB2'],0.7632915522443551,0,0,1
1556,Circulatory System Development (GO:0072359),0.5670997798744422,1.0221187124307163,0.5797661884553484,"['ADAP2', 'PLCE1', 'HSPG2']",0.7632915522443551,0,0,3
1557,Inflammatory Response (GO:0006954),0.5670997798744422,1.0221187124307163,0.5797661884553484,"['ADORA1', 'ADCY8', 'HSPG2']",0.7632915522443551,0,0,3
1558,Protein Maturation (GO:0051604),0.5670997798744422,1.0221187124307163,0.5797661884553484,"['BACE1', 'DNAJB11', 'ADAM10']",0.7632915522443551,0,0,3
1559,Response To Reactive Oxygen Species (GO:0000302),0.5749107985167451,1.0474137931034482,0.579785832438551,"['PTPRK', 'MAPT']",0.7695393401741464,0,0,2
1560,Sensory Perception Of Sound (GO:0007605),0.5749107985167451,1.0474137931034482,0.579785832438551,"['COL11A1', 'CDH23']",0.7695393401741464,0,0,2
1561,Positive Regulation Of Programmed Cell Death (GO:0043068),0.5767297510240074,0.9803719527519478,0.5395785773865475,"['SHQ1', 'ACVR1C', 'STK17A', 'GPER1', 'FZD9', 'SEPTIN4']",0.7695393401741464,0,0,6
1562,Regulation Of Gluconeogenesis (GO:0006111),0.5809159635172502,1.178494623655914,0.6400983810462939,['DDB1'],0.7695393401741464,0,0,1
1563,TOR Signaling (GO:0031929),0.5809159635172502,1.178494623655914,0.6400983810462939,['FNIP1'],0.7695393401741464,0,0,1
1564,Regulation Of Ossification (GO:0030278),0.5809159635172502,1.178494623655914,0.6400983810462939,['MDK'],0.7695393401741464,0,0,1
1565,Regulation Of Protein Localization To Membrane (GO:1905475),0.5809159635172502,1.178494623655914,0.6400983810462939,['SLC5A3'],0.7695393401741464,0,0,1
1566,Cellular Response To Hydrogen Peroxide (GO:0070301),0.5809159635172502,1.178494623655914,0.6400983810462939,['PLEKHA1'],0.7695393401741464,0,0,1
1567,Regulation Of Transmembrane Receptor Protein Serine/Threonine Kinase Signaling Pathway (GO:0090092),0.5809159635172502,1.178494623655914,0.6400983810462939,['DKK3'],0.7695393401741464,0,0,1
1568,Response To Epidermal Growth Factor (GO:0070849),0.5809159635172502,1.178494623655914,0.6400983810462939,['IQGAP1'],0.7695393401741464,0,0,1
1569,Digestive Tract Development (GO:0048565),0.5809159635172502,1.178494623655914,0.6400983810462939,['GLI1'],0.7695393401741464,0,0,1
1570,Signal Transduction By P53 Class Mediator (GO:0072331),0.5809159635172502,1.178494623655914,0.6400983810462939,['ATRX'],0.7695393401741464,0,0,1
1571,Epidermis Development (GO:0008544),0.5809159635172502,1.178494623655914,0.6400983810462939,['GLI1'],0.7695393401741464,0,0,1
1572,Spermatid Development (GO:0007286),0.5809159635172502,1.178494623655914,0.6400983810462939,['EPC1'],0.7695393401741464,0,0,1
1573,Sterol Biosynthetic Process (GO:0016126),0.5809159635172502,1.178494623655914,0.6400983810462939,['TM7SF2'],0.7695393401741464,0,0,1
1574,Zymogen Activation (GO:0031638),0.5809159635172502,1.178494623655914,0.6400983810462939,['CYFIP2'],0.7695393401741464,0,0,1
1575,Negative Regulation Of DNA Biosynthetic Process (GO:2000279),0.5809159635172502,1.178494623655914,0.6400983810462939,['NAT10'],0.7695393401741464,0,0,1
1576,Negative Regulation Of G1/S Transition Of Mitotic Cell Cycle (GO:2000134),0.5809159635172502,1.178494623655914,0.6400983810462939,['KANK2'],0.7695393401741464,0,0,1
1577,Negative Regulation Of Cell Cycle G1/S Phase Transition (GO:1902807),0.5809159635172502,1.178494623655914,0.6400983810462939,['KANK2'],0.7695393401741464,0,0,1
1578,Nuclear Membrane Organization (GO:0071763),0.5809159635172502,1.178494623655914,0.6400983810462939,['GPER1'],0.7695393401741464,0,0,1
1579,Positive Regulation Of Bone Mineralization (GO:0030501),0.5809159635172502,1.178494623655914,0.6400983810462939,['FZD9'],0.7695393401741464,0,0,1
1580,Positive Regulation Of Cation Channel Activity (GO:2001259),0.5809159635172502,1.178494623655914,0.6400983810462939,['PPP3CB'],0.7695393401741464,0,0,1
1581,Positive Regulation Of Small Molecule Metabolic Process (GO:0062013),0.5809159635172502,1.178494623655914,0.6400983810462939,['IRS1'],0.7695393401741464,0,0,1
1582,Positive Regulation Of Type II Interferon Production (GO:0032729),0.5809159635172502,1.178494623655914,0.6400983810462939,['RASGRP1'],0.7695393401741464,0,0,1
1583,Regulation Of T Cell Proliferation (GO:0042129),0.5809159635172502,1.178494623655914,0.6400983810462939,['SFTPD'],0.7695393401741464,0,0,1
1584,Regulation Of Cell Growth (GO:0001558),0.5822003000507346,0.9746626686656672,0.5272347377303214,"['RPS6KA3', 'BTG1', 'PLCE1', 'ADAM10', 'CGRRF1', 'TEAD1']",0.7707538063171658,0,0,6
1585,Cellular Response To Hypoxia (GO:0071456),0.5845922237497312,1.0282915360501568,0.5520287770399811,"['RORA', 'AK4']",0.7714851436143401,0,0,2
1586,Positive Regulation Of Macroautophagy (GO:0016239),0.5845922237497312,1.0282915360501568,0.5520287770399811,"['RNF31', 'SESN1']",0.7714851436143401,0,0,2
1587,Protein N-linked Glycosylation (GO:0006487),0.5845922237497312,1.0282915360501568,0.5520287770399811,"['PDCD6', 'ENTPD5']",0.7714851436143401,0,0,2
1588,Protein-Containing Complex Disassembly (GO:0032984),0.5845922237497312,1.0282915360501568,0.5520287770399811,"['VPS33B', 'SNAP29']",0.7714851436143401,0,0,2
1589,Regulation Of Cellular Biosynthetic Process (GO:0031326),0.5845922237497312,1.0282915360501568,0.5520287770399811,"['AVIL', 'PUM3']",0.7714851436143401,0,0,2
1590,Regulation Of Protein Kinase B Signaling (GO:0051896),0.5904873652742615,0.9862373800793611,0.5195567951640535,"['PLEKHA1', 'PDCD6', 'GPER1']",0.771957684191057,0,0,3
1591,Regulation Of Cell Motility (GO:2000145),0.5904873652742615,0.9862373800793611,0.5195567951640535,"['CAMSAP3', 'SPATA13', 'AMOTL2']",0.771957684191057,0,0,3
1592,Regulation Of Phosphatidylinositol 3-Kinase Signaling (GO:0014066),0.5941099543278273,1.0098522167487685,0.5258208277490256,"['PDGFRB', 'GPER1']",0.771957684191057,0,0,2
1593,Cellular Response To Decreased Oxygen Levels (GO:0036294),0.5941099543278273,1.0098522167487685,0.5258208277490256,"['RORA', 'AK4']",0.771957684191057,0,0,2
1594,Cellular Response To Hormone Stimulus (GO:0032870),0.5941099543278273,1.0098522167487685,0.5258208277490256,"['NCOA1', 'GPER1']",0.771957684191057,0,0,2
1595,Negative Regulation Of Cellular Component Organization (GO:0051129),0.5941099543278273,1.0098522167487685,0.5258208277490256,"['SACS', 'HSPA2']",0.771957684191057,0,0,2
1596,Regulation Of Centrosome Duplication (GO:0010824),0.5952577850915304,1.131268817204301,0.5868578204797155,['NAT10'],0.771957684191057,0,0,1
1597,GPI Anchor Biosynthetic Process (GO:0006506),0.5952577850915304,1.131268817204301,0.5868578204797155,['PIGM'],0.771957684191057,0,0,1
1598,SMAD Protein Signal Transduction (GO:0060395),0.5952577850915304,1.131268817204301,0.5868578204797155,['GDF10'],0.771957684191057,0,0,1
1599,Regulation Of Interleukin-2 Production (GO:0032663),0.5952577850915304,1.131268817204301,0.5868578204797155,['SFTPD'],0.771957684191057,0,0,1
