Rank,Term name,P-value,Z-score,Combined score,Overlapping genes,Adjusted p-value,Old p-value,Old adjusted p-value,gene count
1325,Negative Regulation Of Fat Cell Differentiation (GO:0045599),0.5913304472830564,1.1436786469344609,0.6008662139022446,['SMAD3'],0.8350544829875594,0,0,1
1326,Peptidyl-Tyrosine Dephosphorylation (GO:0035335),0.5913304472830564,1.1436786469344609,0.6008662139022446,['PTPRR'],0.8350544829875594,0,0,1
1327,Positive Regulation Of TORC1 Signaling (GO:1904263),0.5913304472830564,1.1436786469344609,0.6008662139022446,['SESN2'],0.8350544829875594,0,0,1
1328,Positive Regulation Of Biomineral Tissue Development (GO:0070169),0.5913304472830564,1.1436786469344609,0.6008662139022446,['MEF2C'],0.8350544829875594,0,0,1
1329,Positive Regulation Of Interleukin-1 Production (GO:0032732),0.5913304472830564,1.1436786469344609,0.6008662139022446,['RIPK2'],0.8350544829875594,0,0,1
1330,Positive Regulation Of Osteoblast Differentiation (GO:0045669),0.5913304472830564,1.1436786469344609,0.6008662139022446,['MEF2C'],0.8350544829875594,0,0,1
1331,Protein Export From Nucleus (GO:0006611),0.5913304472830564,1.1436786469344609,0.6008662139022446,['CCHCR1'],0.8350544829875594,0,0,1
1332,Regulation Of Cardiac Muscle Contraction (GO:0055117),0.5913304472830564,1.1436786469344609,0.6008662139022446,['HCN4'],0.8350544829875594,0,0,1
1333,Neuron Development (GO:0048666),0.5949088547352942,0.9686981608366391,0.5030905520189877,"['ALK', 'MEF2C', 'NPY', 'MAPT']",0.8357740876025885,0,0,4
1334,Sodium Ion Transmembrane Transport (GO:0035725),0.5976462626106483,1.0029735355337497,0.5162868801062024,"['HCN4', 'SLC4A4']",0.8357740876025885,0,0,2
1335,Muscle Contraction (GO:0006936),0.5976462626106483,1.0029735355337497,0.5162868801062024,"['HCN4', 'GNAO1']",0.8357740876025885,0,0,2
1336,Positive Regulation Of MAP Kinase Activity (GO:0043406),0.5976462626106483,1.0029735355337497,0.5162868801062024,"['MEF2C', 'TNFRSF11A']",0.8357740876025885,0,0,2
1337,Protein Autoubiquitination (GO:0051865),0.5976462626106483,1.0029735355337497,0.5162868801062024,"['TRIM17', 'RNF4']",0.8357740876025885,0,0,2
1338,Potassium Ion Transport (GO:0006813),0.5984019823327626,0.9743051534452808,0.5002984275933376,"['HCN4', 'KCNB1', 'KCNK4']",0.8357740876025885,0,0,3
1339,Negative Regulation Of Gene Expression (GO:0010629),0.5992700373208669,0.9560579668504319,0.4895427597820191,"['MEF2C', 'RIDA', 'SMAD3', 'CSNK2A1', 'DHX36', 'AGO2', 'CNPY2', 'MAPT']",0.8357740876025885,0,0,8
1340,Regulation Of Cellular Senescence (GO:2000772),0.6051697540216511,1.0996096926329484,0.552274872241751,['NEK6'],0.8357740876025885,0,0,1
1341,Regulation Of Centrosome Duplication (GO:0010824),0.6051697540216511,1.0996096926329484,0.552274872241751,['VPS4B'],0.8357740876025885,0,0,1
1342,DNA Geometric Change (GO:0032392),0.6051697540216511,1.0996096926329484,0.552274872241751,['DHX36'],0.8357740876025885,0,0,1
1343,GPI Anchor Biosynthetic Process (GO:0006506),0.6051697540216511,1.0996096926329484,0.552274872241751,['PGAP2'],0.8357740876025885,0,0,1
1344,Notch Signaling Pathway (GO:0007219),0.6051697540216511,1.0996096926329484,0.552274872241751,['SORBS2'],0.8357740876025885,0,0,1
1345,T Cell Differentiation (GO:0030217),0.6051697540216511,1.0996096926329484,0.552274872241751,['CHD7'],0.8357740876025885,0,0,1
1346,Action Potential (GO:0001508),0.6051697540216511,1.0996096926329484,0.552274872241751,['KCNB1'],0.8357740876025885,0,0,1
1347,Apical Junction Assembly (GO:0043297),0.6051697540216511,1.0996096926329484,0.552274872241751,['CHAF1B'],0.8357740876025885,0,0,1
1348,Cellular Response To Hydrogen Peroxide (GO:0070301),0.6051697540216511,1.0996096926329484,0.552274872241751,['OSER1'],0.8357740876025885,0,0,1
1349,Regulation Of Vascular Associated Smooth Muscle Cell Proliferation (GO:1904705),0.6051697540216511,1.0996096926329484,0.552274872241751,['MEF2C'],0.8357740876025885,0,0,1
1350,Response To Amino Acid (GO:0043200),0.6051697540216511,1.0996096926329484,0.552274872241751,['SESN2'],0.8357740876025885,0,0,1
1351,Epidermis Development (GO:0008544),0.6051697540216511,1.0996096926329484,0.552274872241751,['CRABP2'],0.8357740876025885,0,0,1
1352,Spermatid Development (GO:0007286),0.6051697540216511,1.0996096926329484,0.552274872241751,['BBS4'],0.8357740876025885,0,0,1
1353,Zymogen Activation (GO:0031638),0.6051697540216511,1.0996096926329484,0.552274872241751,['RIPK2'],0.8357740876025885,0,0,1
1354,Lamellipodium Organization (GO:0097581),0.6051697540216511,1.0996096926329484,0.552274872241751,['PARVB'],0.8357740876025885,0,0,1
1355,Negative Regulation Of DNA Metabolic Process (GO:0051053),0.6051697540216511,1.0996096926329484,0.552274872241751,['TERF1'],0.8357740876025885,0,0,1
1356,Negative Regulation Of Cell-Cell Adhesion (GO:0022408),0.6051697540216511,1.0996096926329484,0.552274872241751,['ADTRP'],0.8357740876025885,0,0,1
1357,Neuropeptide Signaling Pathway (GO:0007218),0.6051697540216511,1.0996096926329484,0.552274872241751,['NPY'],0.8357740876025885,0,0,1
1358,Positive Regulation Of Ras Protein Signal Transduction (GO:0046579),0.6051697540216511,1.0996096926329484,0.552274872241751,['MMD2'],0.8357740876025885,0,0,1
1359,Positive Regulation Of Cell-Matrix Adhesion (GO:0001954),0.6051697540216511,1.0996096926329484,0.552274872241751,['COL16A1'],0.8357740876025885,0,0,1
1360,Positive Regulation Of miRNA Transcription (GO:1902895),0.6051697540216511,1.0996096926329484,0.552274872241751,['SMAD3'],0.8357740876025885,0,0,1
1361,Positive Regulation Of Ossification (GO:0045778),0.6051697540216511,1.0996096926329484,0.552274872241751,['MEF2C'],0.8357740876025885,0,0,1
1362,Protein Insertion Into Mitochondrial Membrane (GO:0051204),0.6051697540216511,1.0996096926329484,0.552274872241751,['TIMM9'],0.8357740876025885,0,0,1
1363,Vascular Transport (GO:0010232),0.6068399557292102,0.9856078316773816,0.4923014402076382,"['ABCC4', 'SLC4A4']",0.8368518744330239,0,0,2
1364,Negative Regulation Of Protein Serine/Threonine Kinase Activity (GO:0071901),0.6068399557292102,0.9856078316773816,0.4923014402076382,"['HEXIM2', 'GADD45A']",0.8368518744330239,0,0,2
1365,Cellular Response To UV (GO:0034644),0.6158734263782465,0.9688307957483482,0.46960566937266124,"['TMEM161A', 'DHX36']",0.8430987609472483,0,0,2
1366,Sodium Ion Transport (GO:0006814),0.6158734263782465,0.9688307957483482,0.46960566937266124,"['HCN4', 'SLC4A4']",0.8430987609472483,0,0,2
1367,Peptidyl-Threonine Modification (GO:0018210),0.6158734263782465,0.9688307957483482,0.46960566937266124,"['CSNK2A1', 'CDC42BPB']",0.8430987609472483,0,0,2
1368,G2/M Transition Of Mitotic Cell Cycle (GO:0000086),0.6185413557188744,1.0588051053167333,0.5086406814136549,['LCMT1'],0.8430987609472483,0,0,1
1369,SMAD Protein Signal Transduction (GO:0060395),0.6185413557188744,1.0588051053167333,0.5086406814136549,['SMAD3'],0.8430987609472483,0,0,1
1370,Adherens Junction Organization (GO:0034332),0.6185413557188744,1.0588051053167333,0.5086406814136549,['CDH9'],0.8430987609472483,0,0,1
1371,Regulation Of Postsynaptic Membrane Potential (GO:0060078),0.6185413557188744,1.0588051053167333,0.5086406814136549,['MEF2C'],0.8430987609472483,0,0,1
1372,Regulation Of Protein Autophosphorylation (GO:0031952),0.6185413557188744,1.0588051053167333,0.5086406814136549,['TNKS1BP1'],0.8430987609472483,0,0,1
1373,Regulation Of Protein Localization To Cell Surface (GO:2000008),0.6185413557188744,1.0588051053167333,0.5086406814136549,['TM9SF4'],0.8430987609472483,0,0,1
1374,Regulation Of Protein Polymerization (GO:0032271),0.6185413557188744,1.0588051053167333,0.5086406814136549,['MAPT'],0.8430987609472483,0,0,1
1375,Cytoplasmic Translational Initiation (GO:0002183),0.6185413557188744,1.0588051053167333,0.5086406814136549,['MCTS1'],0.8430987609472483,0,0,1
1376,Endothelial Cell Migration (GO:0043542),0.6185413557188744,1.0588051053167333,0.5086406814136549,['GIPC1'],0.8430987609472483,0,0,1
1377,Vesicle Coating (GO:0006901),0.6185413557188744,1.0588051053167333,0.5086406814136549,['TRAPPC6B'],0.8430987609472483,0,0,1
1378,Multivesicular Body Assembly (GO:0036258),0.6185413557188744,1.0588051053167333,0.5086406814136549,['VPS4B'],0.8430987609472483,0,0,1
1379,Myofibril Assembly (GO:0030239),0.6185413557188744,1.0588051053167333,0.5086406814136549,['SIX4'],0.8430987609472483,0,0,1
1380,Negative Chemotaxis (GO:0050919),0.6185413557188744,1.0588051053167333,0.5086406814136549,['SLIT1'],0.8430987609472483,0,0,1
1381,T Cell Receptor Signaling Pathway (GO:0050852),0.6247469789201202,0.9526129943502825,0.44811729256405264,"['GNAO1', 'RIPK2']",0.8441920331086223,0,0,2
1382,Cellular Response To Reactive Oxygen Species (GO:0034614),0.6247469789201202,0.9526129943502825,0.44811729256405264,"['OSER1', 'MAPT']",0.8441920331086223,0,0,2
1383,Spindle Assembly (GO:0051225),0.6247469789201202,0.9526129943502825,0.44811729256405264,"['NEK6', 'BCCIP']",0.8441920331086223,0,0,2
1384,Synapse Assembly (GO:0007416),0.6247469789201202,0.9526129943502825,0.44811729256405264,"['FARP1', 'ZDHHC2']",0.8441920331086223,0,0,2
1385,Transport Across Blood-Brain Barrier (GO:0150104),0.6247469789201202,0.9526129943502825,0.44811729256405264,"['ABCC4', 'SLC4A4']",0.8441920331086223,0,0,2
1386,Positive Regulation Of Synaptic Transmission (GO:0050806),0.6247469789201202,0.9526129943502825,0.44811729256405264,"['ZDHHC2', 'CACNG3']",0.8441920331086223,0,0,2
1387,Protein K48-linked Ubiquitination (GO:0070936),0.6247469789201202,0.9526129943502825,0.44811729256405264,"['UBE2D4', 'RNF4']",0.8441920331086223,0,0,2
1388,Negative Regulation Of Macromolecule Metabolic Process (GO:0010605),0.6266083812812153,0.9289742259124719,0.43423369681610496,"['MEF2C', 'SMAD3', 'CNPY2', 'MAPT']",0.8441920331086223,0,0,4
1389,Protein Glycosylation (GO:0006486),0.6266083812812153,0.9289742259124719,0.43423369681610496,"['FUT9', 'ALG5', 'OGA', 'GCNT4']",0.8441920331086223,0,0,4
1390,"DNA Damage Response, Signal Transduction By P53 Class Mediator (GO:0030330)",0.6314610263603571,1.0209151313802476,0.4693341395082284,['SESN2'],0.8441920331086223,0,0,1
1391,Regulation Of Heart Rate By Cardiac Conduction (GO:0086091),0.6314610263603571,1.0209151313802476,0.4693341395082284,['HCN4'],0.8441920331086223,0,0,1
1392,Calcium-Dependent Cell-Cell Adhesion Via Plasma Membrane Cell Adhesion Molecules (GO:0016339),0.6314610263603571,1.0209151313802476,0.4693341395082284,['CDH9'],0.8441920331086223,0,0,1
1393,Regulation Of Protein Modification By Small Protein Conjugation Or Removal (GO:1903320),0.6314610263603571,1.0209151313802476,0.4693341395082284,['COPS7B'],0.8441920331086223,0,0,1
1394,Cell Cycle G2/M Phase Transition (GO:0044839),0.6314610263603571,1.0209151313802476,0.4693341395082284,['LCMT1'],0.8441920331086223,0,0,1
1395,Renal System Development (GO:0072001),0.6314610263603571,1.0209151313802476,0.4693341395082284,['IFT27'],0.8441920331086223,0,0,1
1396,Heart Morphogenesis (GO:0003007),0.6314610263603571,1.0209151313802476,0.4693341395082284,['CHD7'],0.8441920331086223,0,0,1
1397,Vesicle Budding From Membrane (GO:0006900),0.6314610263603571,1.0209151313802476,0.4693341395082284,['TRAPPC6B'],0.8441920331086223,0,0,1
1398,Intrinsic Apoptotic Signaling Pathway By P53 Class Mediator (GO:0072332),0.6314610263603571,1.0209151313802476,0.4693341395082284,['RRP8'],0.8441920331086223,0,0,1
1399,Membrane Protein Proteolysis (GO:0033619),0.6314610263603571,1.0209151313802476,0.4693341395082284,['RBMX'],0.8441920331086223,0,0,1
1400,Modulation By Host Of Symbiont Process (GO:0051851),0.6314610263603571,1.0209151313802476,0.4693341395082284,['PI4KA'],0.8441920331086223,0,0,1
1401,Multivesicular Body Organization (GO:0036257),0.6314610263603571,1.0209151313802476,0.4693341395082284,['VPS4B'],0.8441920331086223,0,0,1
1402,Negative Regulation Of Proteasomal Ubiquitin-Dependent Protein Catabolic Process (GO:0032435),0.6314610263603571,1.0209151313802476,0.4693341395082284,['GIPC1'],0.8441920331086223,0,0,1
1403,Positive Regulation Of Exocytosis (GO:0045921),0.6314610263603571,1.0209151313802476,0.4693341395082284,['VPS4B'],0.8441920331086223,0,0,1
1404,Positive Regulation Of Myeloid Cell Differentiation (GO:0045639),0.6314610263603571,1.0209151313802476,0.4693341395082284,['THPO'],0.8441920331086223,0,0,1
1405,Positive Regulation Of Protein Tyrosine Kinase Activity (GO:0061098),0.6314610263603571,1.0209151313802476,0.4693341395082284,['NOX4'],0.8441920331086223,0,0,1
1406,Potassium Ion Import Across Plasma Membrane (GO:1990573),0.6314610263603571,1.0209151313802476,0.4693341395082284,['HCN4'],0.8441920331086223,0,0,1
1407,Protein Methylation (GO:0006479),0.6314610263603571,1.0209151313802476,0.4693341395082284,['LCMT1'],0.8441920331086223,0,0,1
1408,Regulation Of Cellular Component Organization (GO:0051128),0.6327558725860222,0.9214138641043239,0.42170403469448836,"['RAB4B', 'MUC12', 'SGK3', 'ZNF469']",0.845322298532889,0,0,4
1409,Transcription Initiation At RNA Polymerase II Promoter (GO:0006367),0.6334610800532374,0.936926924145596,0.42776028101431,"['MED11', 'E2F3']",0.8456637981406242,0,0,2
1410,Double-Strand Break Repair Via Homologous Recombination (GO:0000724),0.6416308395237446,0.9117089036454804,0.40456367545575406,"['SLF1', 'SLX4', 'INIP']",0.8517993537655555,0,0,3
1411,Regulation Of Protein Secretion (GO:0050708),0.6420163472657232,0.9217468562055768,0.4084642960799902,"['EIPR1', 'ADTRP']",0.8517993537655555,0,0,2
1412,Glycoprotein Biosynthetic Process (GO:0009101),0.6420163472657232,0.9217468562055768,0.4084642960799902,"['FUT9', 'ALG5']",0.8517993537655555,0,0,2
1413,Negative Regulation Of Neuron Death (GO:1901215),0.6420163472657232,0.9217468562055768,0.4084642960799902,"['MEF2C', 'SIX4']",0.8517993537655555,0,0,2
1414,L-alpha-amino Acid Transmembrane Transport (GO:1902475),0.6439440090667836,0.9856382590945542,0.43382227220508335,['SLC25A29'],0.8517993537655555,0,0,1
1415,Amino Acid Transport (GO:0006865),0.6439440090667836,0.9856382590945542,0.43382227220508335,['SLC25A29'],0.8517993537655555,0,0,1
1416,Regulation Of Neurotransmitter Secretion (GO:0046928),0.6439440090667836,0.9856382590945542,0.43382227220508335,['MEF2C'],0.8517993537655555,0,0,1
1417,Regulation Of Protein Import Into Nucleus (GO:0042306),0.6439440090667836,0.9856382590945542,0.43382227220508335,['SMAD3'],0.8517993537655555,0,0,1
1418,Substrate Adhesion-Dependent Cell Spreading (GO:0034446),0.6439440090667836,0.9856382590945542,0.43382227220508335,['PARVB'],0.8517993537655555,0,0,1
1419,Lytic Vacuole Organization (GO:0080171),0.6439440090667836,0.9856382590945542,0.43382227220508335,['NAGPA'],0.8517993537655555,0,0,1
1420,Positive Regulation Of Cell Death (GO:0010942),0.6439440090667836,0.9856382590945542,0.43382227220508335,['MAPT'],0.8517993537655555,0,0,1
1421,Protein K63-linked Deubiquitination (GO:0070536),0.6439440090667836,0.9856382590945542,0.43382227220508335,['USP20'],0.8517993537655555,0,0,1
1422,Protein Transmembrane Import Into Intracellular Organelle (GO:0044743),0.6439440090667836,0.9856382590945542,0.43382227220508335,['TIMM44'],0.8517993537655555,0,0,1
1423,Potassium Ion Transmembrane Transport (GO:0071805),0.6485088107388758,0.902044921220248,0.39065733392982444,"['HCN4', 'KCNB1', 'KCNK4']",0.856311914361424,0,0,3
1424,Positive Regulation Of Peptidyl-Tyrosine Phosphorylation (GO:0050731),0.6504135385055485,0.9070486951842884,0.3901641891942256,"['RIPK2', 'NOX4']",0.856311914361424,0,0,2
1425,Positive Regulation Of Protein Localization To Membrane (GO:1905477),0.6504135385055485,0.9070486951842884,0.3901641891942256,"['KCNB1', 'ITGB1BP1']",0.856311914361424,0,0,2
1426,Negative Regulation Of Wnt Signaling Pathway (GO:0030178),0.655292585286123,0.8925822717622081,0.37727082642237203,"['CTNND1', 'IGFBP2', 'CXXC4']",0.856311914361424,0,0,3
1427,Protein-Containing Complex Organization (GO:0043933),0.655292585286123,0.8925822717622081,0.37727082642237203,"['NDC1', 'MATN1', 'GEMIN5']",0.856311914361424,0,0,3
1428,Regulation Of Cytosolic Calcium Ion Concentration (GO:0051480),0.6560050338090441,0.9527131782945737,0.4016513159492061,['WBP2NL'],0.856311914361424,0,0,1
1429,Regulation Of Metaphase/Anaphase Transition Of Cell Cycle (GO:1902099),0.6560050338090441,0.9527131782945737,0.4016513159492061,['NEK6'],0.856311914361424,0,0,1
1430,Antiviral Innate Immune Response (GO:0140374),0.6560050338090441,0.9527131782945737,0.4016513159492061,['USP20'],0.856311914361424,0,0,1
1431,Regulation Of Neuronal Synaptic Plasticity (GO:0048168),0.6560050338090441,0.9527131782945737,0.4016513159492061,['ZDHHC2'],0.856311914361424,0,0,1
1432,Regulation Of Primary Metabolic Process (GO:0080090),0.6560050338090441,0.9527131782945737,0.4016513159492061,['BBS4'],0.856311914361424,0,0,1
1433,Regulation Of Protein Tyrosine Kinase Activity (GO:0061097),0.6560050338090441,0.9527131782945737,0.4016513159492061,['NOX4'],0.856311914361424,0,0,1
1434,Cholesterol Transport (GO:0030301),0.6560050338090441,0.9527131782945737,0.4016513159492061,['OSBP'],0.856311914361424,0,0,1
1435,Response To cAMP (GO:0051591),0.6560050338090441,0.9527131782945737,0.4016513159492061,['HCN4'],0.856311914361424,0,0,1
1436,Interstrand Cross-Link Repair (GO:0036297),0.6560050338090441,0.9527131782945737,0.4016513159492061,['EXO5'],0.856311914361424,0,0,1
1437,Monoatomic Cation Transport (GO:0006812),0.6560050338090441,0.9527131782945737,0.4016513159492061,['HCN4'],0.856311914361424,0,0,1
1438,Negative Regulation Of Mitochondrion Organization (GO:0010823),0.6560050338090441,0.9527131782945737,0.4016513159492061,['MAPT'],0.856311914361424,0,0,1
1439,Positive Regulation Of Epithelial To Mesenchymal Transition (GO:0010718),0.6560050338090441,0.9527131782945737,0.4016513159492061,['SMAD3'],0.856311914361424,0,0,1
1440,Positive Regulation Of Stress Fiber Assembly (GO:0051496),0.6560050338090441,0.9527131782945737,0.4016513159492061,['ITGB1BP1'],0.856311914361424,0,0,1
1441,Protein Targeting To Vacuole (GO:0006623),0.6560050338090441,0.9527131782945737,0.4016513159492061,['NAGPA'],0.856311914361424,0,0,1
1442,Regulation Of Double-Strand Break Repair Via Homologous Recombination (GO:0010569),0.6586535415618444,0.8928098516949152,0.37279955350034044,"['KMT5A', 'TP53BP1']",0.8579829028239815,0,0,2
1443,Cell-Matrix Adhesion (GO:0007160),0.6586535415618444,0.8928098516949152,0.37279955350034044,"['ITGB1BP1', 'PPFIA2']",0.8579829028239815,0,0,2
1444,Import Into Nucleus (GO:0051170),0.6586535415618444,0.8928098516949152,0.37279955350034044,"['HIKESHI', 'E2F3']",0.8579829028239815,0,0,2
1445,Regulation Of Proteasomal Ubiquitin-Dependent Protein Catabolic Process (GO:0032434),0.6619820286293452,0.8833147284785606,0.36438222745782545,"['UFL1', 'BAG2', 'GIPC1']",0.8601817311858923,0,0,3
1446,Regulation Of Anatomical Structure Morphogenesis (GO:0022603),0.6619820286293452,0.8833147284785606,0.36438222745782545,"['MEF2C', 'MAPT', 'PPFIA2']",0.8601817311858923,0,0,3
1447,Intracellular Protein Transport (GO:0006886),0.6623174972103267,0.904020899591095,0.37246586326840536,"['ARL6', 'GIPC1', 'IFT27', 'HIKESHI', 'TIMM44', 'E2F3', 'CCHCR1', 'DNAJC27', 'CACNG3']",0.8601817311858923,0,0,9
1448,Cellular Response To Transforming Growth Factor Beta Stimulus (GO:0071560),0.6667373648316595,0.8790091264667536,0.35631431893485277,"['MEF2C', 'SMAD3']",0.8601817311858923,0,0,2
1449,Cellular Response To Amino Acid Stimulus (GO:0071230),0.6676583346791083,0.9219122962558821,0.3724329413958823,['SESN2'],0.8601817311858923,0,0,1
1450,Transcription Initiation-Coupled Chromatin Remodeling (GO:0045815),0.6676583346791083,0.9219122962558821,0.3724329413958823,['FAM47E'],0.8601817311858923,0,0,1
1451,Ubiquitin-Dependent Protein Catabolic Process Via The Multivesicular Body Sorting Pathway (GO:0043162),0.6676583346791083,0.9219122962558821,0.3724329413958823,['VPS4B'],0.8601817311858923,0,0,1
1452,Inner Mitochondrial Membrane Organization (GO:0007007),0.6676583346791083,0.9219122962558821,0.3724329413958823,['TIMM9'],0.8601817311858923,0,0,1
1453,Intracellular Glucose Homeostasis (GO:0001678),0.6676583346791083,0.9219122962558821,0.3724329413958823,['KCNB1'],0.8601817311858923,0,0,1
1454,Negative Regulation Of I-kappaB kinase/NF-kappaB Signaling (GO:0043124),0.6676583346791083,0.9219122962558821,0.3724329413958823,['USP20'],0.8601817311858923,0,0,1
1455,Positive Regulation Of ATP-dependent Activity (GO:0032781),0.6676583346791083,0.9219122962558821,0.3724329413958823,['DNAJC24'],0.8601817311858923,0,0,1
1456,Positive Regulation Of miRNA Metabolic Process (GO:2000630),0.6676583346791083,0.9219122962558821,0.3724329413958823,['SMAD3'],0.8601817311858923,0,0,1
1457,Positive Regulation Of Myoblast Differentiation (GO:0045663),0.6676583346791083,0.9219122962558821,0.3724329413958823,['MEF2C'],0.8601817311858923,0,0,1
1458,Positive Regulation Of Telomere Maintenance Via Telomere Lengthening (GO:1904358),0.6676583346791083,0.9219122962558821,0.3724329413958823,['DHX36'],0.8601817311858923,0,0,1
1459,Protein Destabilization (GO:0031648),0.6676583346791083,0.9219122962558821,0.3724329413958823,['FBXW11'],0.8601817311858923,0,0,1
1460,Regulation Of JUN Kinase Activity (GO:0043506),0.6676583346791083,0.9219122962558821,0.3724329413958823,['TNFRSF11A'],0.8601817311858923,0,0,1
1461,Negative Regulation Of Cellular Biosynthetic Process (GO:0031327),0.6685770761777715,0.8742363187313141,0.3519706820792877,"['RIDA', 'CSNK2A1', 'DHX36']",0.8607758249763096,0,0,3
1462,Regulation Of Peptidyl-Serine Phosphorylation (GO:0033135),0.6746661279748797,0.8656266050333847,0.34065638785536834,"['RIPK2', 'TNKS1BP1']",0.8634510689126043,0,0,2
1463,Positive Regulation Of Binding (GO:0051099),0.6746661279748797,0.8656266050333847,0.34065638785536834,"['RIPK2', 'NMD3']",0.8634510689126043,0,0,2
1464,B Cell Differentiation (GO:0030183),0.678917666625062,0.8930364693446089,0.3458332090704281,['JAK3'],0.8634510689126043,0,0,1
1465,Regulation Of Interferon-Beta Production (GO:0032648),0.678917666625062,0.8930364693446089,0.3458332090704281,['RIPK2'],0.8634510689126043,0,0,1
1466,Regulation Of Mitochondrial Membrane Potential (GO:0051881),0.678917666625062,0.8930364693446089,0.3458332090704281,['MAPT'],0.8634510689126043,0,0,1
1467,Regulation Of Monoatomic Cation Transmembrane Transport (GO:1904062),0.678917666625062,0.8930364693446089,0.3458332090704281,['HCN4'],0.8634510689126043,0,0,1
1468,Regulation Of Phosphoprotein Phosphatase Activity (GO:0043666),0.678917666625062,0.8930364693446089,0.3458332090704281,['TIPRL'],0.8634510689126043,0,0,1
1469,Regulation Of Protein Dephosphorylation (GO:0035304),0.678917666625062,0.8930364693446089,0.3458332090704281,['TIPRL'],0.8634510689126043,0,0,1
1470,Ceramide Biosynthetic Process (GO:0046513),0.678917666625062,0.8930364693446089,0.3458332090704281,['DEGS2'],0.8634510689126043,0,0,1
1471,Response To Molecule Of Bacterial Origin (GO:0002237),0.678917666625062,0.8930364693446089,0.3458332090704281,['TNFRSF11A'],0.8634510689126043,0,0,1
1472,Epithelial Cell Migration (GO:0010631),0.678917666625062,0.8930364693446089,0.3458332090704281,['GIPC1'],0.8634510689126043,0,0,1
1473,Erythrocyte Differentiation (GO:0030218),0.678917666625062,0.8930364693446089,0.3458332090704281,['UFL1'],0.8634510689126043,0,0,1
1474,Steroid Biosynthetic Process (GO:0006694),0.678917666625062,0.8930364693446089,0.3458332090704281,['OSBP'],0.8634510689126043,0,0,1
1475,Negative Regulation Of Cysteine-Type Endopeptidase Activity Involved In Apoptotic Process (GO:0043154),0.678917666625062,0.8930364693446089,0.3458332090704281,['CSNK2A1'],0.8634510689126043,0,0,1
1476,Negative Regulation Of Proteasomal Protein Catabolic Process (GO:1901799),0.678917666625062,0.8930364693446089,0.3458332090704281,['GIPC1'],0.8634510689126043,0,0,1
1477,Organic Hydroxy Compound Biosynthetic Process (GO:1901617),0.678917666625062,0.8930364693446089,0.3458332090704281,['OSBP'],0.8634510689126043,0,0,1
1478,Regulation Of DNA Binding (GO:0051101),0.678917666625062,0.8930364693446089,0.3458332090704281,['HABP4'],0.8634510689126043,0,0,1
1479,Regulation Of Axon Extension (GO:0030516),0.678917666625062,0.8930364693446089,0.3458332090704281,['MAPT'],0.8634510689126043,0,0,1
1480,Plasma Membrane Bounded Cell Projection Organization (GO:0120036),0.6814840562248968,0.856624203821656,0.32850032548793073,"['CFAP61', 'NPY', 'MAPT']",0.8655911136623146,0,0,3
1481,Protein Localization (GO:0008104),0.681752499381551,0.888045540796964,0.34020011508934966,"['CEP68', 'USP4', 'ARL6', 'IFT27', 'TIMM44', 'DNAJC27', 'CACNG3', 'BBS4', 'TM9SF4']",0.8655911136623146,0,0,9
1482,Positive Regulation Of Supramolecular Fiber Organization (GO:1902905),0.6824410534615697,0.8526435618517582,0.3257773053734637,"['DRG1', 'MAPT']",0.8655911136623146,0,0,2
1483,Protein Import Into Nucleus (GO:0006606),0.6824410534615697,0.8526435618517582,0.3257773053734637,"['HIKESHI', 'E2F3']",0.8655911136623146,0,0,2
1484,Gene Expression (GO:0010467),0.6853475840375761,0.8809054302616535,0.3328317477106109,"['EXOSC7', 'RBM3', 'MRPL3', 'MRPS16', 'DHX8', 'AGO2', 'NOX4', 'MAGOHB']",0.8663208887946164,0,0,8
1485,Regulation Of Lipid Metabolic Process (GO:0019216),0.6897963215918707,0.8659106925491703,0.3215636518650867,['BBS4'],0.8663208887946164,0,0,1
1486,Adenylate Cyclase-Inhibiting G Protein-Coupled Receptor Signaling Pathway (GO:0007193),0.6897963215918707,0.8659106925491703,0.3215636518650867,['HTR1F'],0.8663208887946164,0,0,1
1487,Base-Excision Repair (GO:0006284),0.6897963215918707,0.8659106925491703,0.3215636518650867,['LIG1'],0.8663208887946164,0,0,1
1488,Cardiac Conduction (GO:0061337),0.6897963215918707,0.8659106925491703,0.3215636518650867,['HCN4'],0.8663208887946164,0,0,1
1489,Cilium Movement (GO:0003341),0.6897963215918707,0.8659106925491703,0.3215636518650867,['CFAP61'],0.8663208887946164,0,0,1
1490,Response To Glucose (GO:0009749),0.6897963215918707,0.8659106925491703,0.3215636518650867,['KCNB1'],0.8663208887946164,0,0,1
1491,Response To Hydrogen Peroxide (GO:0042542),0.6897963215918707,0.8659106925491703,0.3215636518650867,['OSER1'],0.8663208887946164,0,0,1
