Rank,Term name,P-value,Z-score,Combined score,Overlapping genes,Adjusted p-value,Old p-value,Old adjusted p-value,gene count
993,Regulation Of Proteasomal Protein Catabolic Process (GO:0061136),0.44096006954478756,1.3626916868442291,1.1157732516760792,"['UFL1', 'BAG2']",0.8102930354472728,0,0,2
994,Regulation Of Signal Transduction By P53 Class Mediator (GO:1901796),0.44096006954478756,1.3626916868442291,1.1157732516760792,"['KMT5A', 'MLF1']",0.8102930354472728,0,0,2
995,Glycerophospholipid Metabolic Process (GO:0006650),0.44096006954478756,1.3626916868442291,1.1157732516760792,"['PLA2G4C', 'GPCPD1']",0.8102930354472728,0,0,2
996,Intracellular Protein Transmembrane Transport (GO:0065002),0.44096006954478756,1.3626916868442291,1.1157732516760792,"['SRP54', 'TIMM44']",0.8102930354472728,0,0,2
997,Lymphocyte Differentiation (GO:0030098),0.44096006954478756,1.3626916868442291,1.1157732516760792,"['CHD7', 'JAK3']",0.8102930354472728,0,0,2
998,Phospholipid Metabolic Process (GO:0006644),0.44096006954478756,1.3626916868442291,1.1157732516760792,"['PLA2G4C', 'MBOAT2']",0.8102930354472728,0,0,2
999,Purine Ribonucleotide Biosynthetic Process (GO:0009152),0.44096006954478756,1.3626916868442291,1.1157732516760792,"['ATIC', 'DCAKD']",0.8102930354472728,0,0,2
1000,Cellular Response To Chemical Stress (GO:0062197),0.44127660261544904,1.244345979876304,1.0179787692608302,"['CCS', 'TMEM161A', 'SESN2']",0.8102930354472728,0,0,3
1001,Enzyme-Linked Receptor Protein Signaling Pathway (GO:0007167),0.44127660261544904,1.244345979876304,1.0179787692608302,"['ALK', 'DOK6', 'JAK3']",0.8102930354472728,0,0,3
1002,Mitotic Spindle Organization (GO:0007052),0.44127660261544904,1.244345979876304,1.0179787692608302,"['NEK6', 'BCCIP', 'TUBG2']",0.8102930354472728,0,0,3
1003,Negative Regulation Of Protein Kinase Activity (GO:0006469),0.44127660261544904,1.244345979876304,1.0179787692608302,"['PTPRR', 'GADD45A', 'ITGB1BP1']",0.8102930354472728,0,0,3
1004,Regulation Of Fibroblast Migration (GO:0010762),0.4428395749281215,1.7881871035940804,1.4565637064720585,['ITGB1BP1'],0.8102930354472728,0,0,1
1005,Regulation Of Interleukin-10 Production (GO:0032653),0.4428395749281215,1.7881871035940804,1.4565637064720585,['JAK3'],0.8102930354472728,0,0,1
1006,Regulation Of Membrane Depolarization (GO:0003254),0.4428395749281215,1.7881871035940804,1.4565637064720585,['HCN4'],0.8102930354472728,0,0,1
1007,Branched-Chain Amino Acid Catabolic Process (GO:0009083),0.4428395749281215,1.7881871035940804,1.4565637064720585,['MCCC2'],0.8102930354472728,0,0,1
1008,Cell Morphogenesis Involved In Differentiation (GO:0000904),0.4428395749281215,1.7881871035940804,1.4565637064720585,['MEF2C'],0.8102930354472728,0,0,1
1009,Cellular Component Disassembly (GO:0022411),0.4428395749281215,1.7881871035940804,1.4565637064720585,['MMP15'],0.8102930354472728,0,0,1
1010,Cellular Response To Nerve Growth Factor Stimulus (GO:1990090),0.4428395749281215,1.7881871035940804,1.4565637064720585,['MAPT'],0.8102930354472728,0,0,1
1011,Chromosome Condensation (GO:0030261),0.4428395749281215,1.7881871035940804,1.4565637064720585,['KMT5A'],0.8102930354472728,0,0,1
1012,Glycosphingolipid Biosynthetic Process (GO:0006688),0.4428395749281215,1.7881871035940804,1.4565637064720585,['FUT9'],0.8102930354472728,0,0,1
1013,Granulocyte Chemotaxis (GO:0071621),0.4428395749281215,1.7881871035940804,1.4565637064720585,['SRP54'],0.8102930354472728,0,0,1
1014,Heme Biosynthetic Process (GO:0006783),0.4428395749281215,1.7881871035940804,1.4565637064720585,['COX15'],0.8102930354472728,0,0,1
1015,Late Endosome To Vacuole Transport (GO:0045324),0.4428395749281215,1.7881871035940804,1.4565637064720585,['VPS4B'],0.8102930354472728,0,0,1
1016,Limb Development (GO:0060173),0.4428395749281215,1.7881871035940804,1.4565637064720585,['IFT122'],0.8102930354472728,0,0,1
1017,Macrophage Activation (GO:0042116),0.4428395749281215,1.7881871035940804,1.4565637064720585,['MAPT'],0.8102930354472728,0,0,1
1018,Maintenance Of Protein Location In Nucleus (GO:0051457),0.4428395749281215,1.7881871035940804,1.4565637064720585,['BBS4'],0.8102930354472728,0,0,1
1019,ncRNA Metabolic Process (GO:0034660),0.4428395749281215,1.7881871035940804,1.4565637064720585,['MAPT'],0.8102930354472728,0,0,1
1020,Negative Regulation Of T Cell Activation (GO:0050868),0.4428395749281215,1.7881871035940804,1.4565637064720585,['JAK3'],0.8102930354472728,0,0,1
1021,Negative Regulation Of Lipid Biosynthetic Process (GO:0051055),0.4428395749281215,1.7881871035940804,1.4565637064720585,['ASXL3'],0.8102930354472728,0,0,1
1022,Negative Regulation Of Peptidyl-Serine Phosphorylation (GO:0033137),0.4428395749281215,1.7881871035940804,1.4565637064720585,['GADD45A'],0.8102930354472728,0,0,1
1023,"Phagocytosis, Engulfment (GO:0006911)",0.4428395749281215,1.7881871035940804,1.4565637064720585,['XKR4'],0.8102930354472728,0,0,1
1024,Pore Complex Assembly (GO:0046931),0.4428395749281215,1.7881871035940804,1.4565637064720585,['NDC1'],0.8102930354472728,0,0,1
1025,Positive Regulation Of Reproductive Process (GO:2000243),0.4428395749281215,1.7881871035940804,1.4565637064720585,['AGO2'],0.8102930354472728,0,0,1
1026,Regulation Of Calcium-Mediated Signaling (GO:0050848),0.4428395749281215,1.7881871035940804,1.4565637064720585,['MAPT'],0.8102930354472728,0,0,1
1027,Regulation Of Cardiac Muscle Hypertrophy (GO:0010611),0.4428395749281215,1.7881871035940804,1.4565637064720585,['MLIP'],0.8102930354472728,0,0,1
1028,Regulation Of Cell Migration Involved In Sprouting Angiogenesis (GO:0090049),0.4428395749281215,1.7881871035940804,1.4565637064720585,['ITGB1BP1'],0.8102930354472728,0,0,1
1029,Mitochondrial Gene Expression (GO:0140053),0.44654361791697017,1.1802588286905022,0.951546142420525,"['MRPL3', 'MRPS16', 'MRPS25', 'MRPL16']",0.8159622142054538,0,0,4
1030,RNA Modification (GO:0009451),0.45244105686433655,1.330902640914466,1.0555359370924822,"['NSUN6', 'METTL6']",0.8159622142054538,0,0,2
1031,Regulation Of Mitotic Metaphase/Anaphase Transition (GO:0030071),0.45244105686433655,1.330902640914466,1.0555359370924822,"['NEK6', 'LCMT1']",0.8159622142054538,0,0,2
1032,Regulation Of Synapse Assembly (GO:0051963),0.45244105686433655,1.330902640914466,1.0555359370924822,"['MEF2C', 'SLIT1']",0.8159622142054538,0,0,2
1033,"Regulation Of Synaptic Transmission, Glutamatergic (GO:0051966)",0.45244105686433655,1.330902640914466,1.0555359370924822,"['MEF2C', 'CACNG3']",0.8159622142054538,0,0,2
1034,Cellular Response To Ionizing Radiation (GO:0071479),0.45244105686433655,1.330902640914466,1.0555359370924822,"['GADD45A', 'TNKS1BP1']",0.8159622142054538,0,0,2
1035,Second-Messenger-Mediated Signaling (GO:0019932),0.45244105686433655,1.330902640914466,1.0555359370924822,"['DHX8', 'RCAN2']",0.8159622142054538,0,0,2
1036,Positive Regulation Of Cysteine-Type Endopeptidase Activity (GO:2001056),0.45244105686433655,1.330902640914466,1.0555359370924822,"['RIPK2', 'GRAMD4']",0.8159622142054538,0,0,2
1037,Positive Regulation Of Protein Binding (GO:0032092),0.45244105686433655,1.330902640914466,1.0555359370924822,"['RIPK2', 'NMD3']",0.8159622142054538,0,0,2
1038,Positive Regulation Of NF-kappaB Transcription Factor Activity (GO:0051092),0.45405530434147506,1.1681285280069476,0.9222798439549083,"['ALK', 'RIPK2', 'TRAF5', 'TNFRSF11A']",0.8159622142054538,0,0,4
1039,Protein Modification By Small Protein Conjugation (GO:0032446),0.4566561927164743,1.0711347173858745,0.8395816179511681,"['KLHL18', 'CAND2', 'UFL1', 'SLF1', 'TRIM17', 'UBE2D4', 'EIPR1', 'FBXW11', 'CUL2', 'COPS7B', 'FBXO32']",0.8159622142054538,0,0,11
1040,Positive Regulation Of Amide Metabolic Process (GO:0034250),0.4590534536215698,1.2091145599712927,0.9414028354732625,"['RBM3', 'AGO2', 'ELAVL1']",0.8159622142054538,0,0,3
1041,Positive Regulation Of Neuron Projection Development (GO:0010976),0.4590534536215698,1.2091145599712927,0.9414028354732625,"['ALK', 'FUT9', 'DHX36']",0.8159622142054538,0,0,3
1042,Regulation Of Centriole Replication (GO:0046599),0.4616953158808908,1.682875264270613,1.300610307687174,['PLK4'],0.8159622142054538,0,0,1
1043,Alpha-Amino Acid Catabolic Process (GO:1901606),0.4616953158808908,1.682875264270613,1.300610307687174,['MCCC2'],0.8159622142054538,0,0,1
1044,Blood Vessel Diameter Maintenance (GO:0097746),0.4616953158808908,1.682875264270613,1.300610307687174,['ITGB1BP1'],0.8159622142054538,0,0,1
1045,Carbohydrate Biosynthetic Process (GO:0016051),0.4616953158808908,1.682875264270613,1.300610307687174,['FUT9'],0.8159622142054538,0,0,1
1046,Regulation Of Protein Neddylation (GO:2000434),0.4616953158808908,1.682875264270613,1.300610307687174,['COPS7B'],0.8159622142054538,0,0,1
1047,Cellular Response To Hexose Stimulus (GO:0071331),0.4616953158808908,1.682875264270613,1.300610307687174,['KCNB1'],0.8159622142054538,0,0,1
1048,Sensory Perception Of Smell (GO:0007608),0.4616953158808908,1.682875264270613,1.300610307687174,['BBS4'],0.8159622142054538,0,0,1
1049,Ventricular Septum Morphogenesis (GO:0060412),0.4616953158808908,1.682875264270613,1.300610307687174,['SLIT1'],0.8159622142054538,0,0,1
1050,Vesicle Cargo Loading (GO:0035459),0.4616953158808908,1.682875264270613,1.300610307687174,['SEC23B'],0.8159622142054538,0,0,1
1051,Meiosis I (GO:0007127),0.4616953158808908,1.682875264270613,1.300610307687174,['MOV10L1'],0.8159622142054538,0,0,1
1052,Microtubule Polymerization Or Depolymerization (GO:0031109),0.4616953158808908,1.682875264270613,1.300610307687174,['MAPT'],0.8159622142054538,0,0,1
1053,Negative Regulation Of Cation Channel Activity (GO:2001258),0.4616953158808908,1.682875264270613,1.300610307687174,['CRHR1'],0.8159622142054538,0,0,1
1054,Negative Regulation Of Epithelial Cell Migration (GO:0010633),0.4616953158808908,1.682875264270613,1.300610307687174,['PTPRR'],0.8159622142054538,0,0,1
1055,Negative Regulation Of Intrinsic Apoptotic Signaling Pathway In Response To DNA Damage (GO:1902230),0.4616953158808908,1.682875264270613,1.300610307687174,['TMEM161A'],0.8159622142054538,0,0,1
1056,Nuclear-Transcribed mRNA poly(A) Tail Shortening (GO:0000289),0.4616953158808908,1.682875264270613,1.300610307687174,['TNKS1BP1'],0.8159622142054538,0,0,1
1057,Plasma Membrane Repair (GO:0001778),0.4616953158808908,1.682875264270613,1.300610307687174,['VPS4B'],0.8159622142054538,0,0,1
1058,Positive Regulation Of ERBB Signaling Pathway (GO:1901186),0.4616953158808908,1.682875264270613,1.300610307687174,['NEU3'],0.8159622142054538,0,0,1
1059,Positive Regulation Of Axon Extension (GO:0045773),0.4616953158808908,1.682875264270613,1.300610307687174,['MAPT'],0.8159622142054538,0,0,1
1060,Protein Localization To Cell Junction (GO:1902414),0.4616953158808908,1.682875264270613,1.300610307687174,['NPHS1'],0.8159622142054538,0,0,1
1061,Regulation Of Cell Adhesion Mediated By Integrin (GO:0033628),0.4616953158808908,1.682875264270613,1.300610307687174,['ITGB1BP1'],0.8159622142054538,0,0,1
1062,Regulation Of Cell Junction Assembly (GO:1901888),0.4616953158808908,1.682875264270613,1.300610307687174,['MEF2C'],0.8159622142054538,0,0,1
1063,B Cell Activation (GO:0042113),0.4637864821082244,1.3005585516178737,0.9992594532199705,"['MEF2C', 'JAK3']",0.8159622142054538,0,0,2
1064,Regulation Of Neuron Death (GO:1901214),0.4637864821082244,1.3005585516178737,0.9992594532199705,"['MEF2C', 'MAPT']",0.8159622142054538,0,0,2
1065,Positive Regulation Of DNA Recombination (GO:0045911),0.4637864821082244,1.3005585516178737,0.9992594532199705,"['ERCC2', 'TP53BP1']",0.8159622142054538,0,0,2
1066,Protein Polymerization (GO:0051258),0.4637864821082244,1.3005585516178737,0.9992594532199705,"['ARL6', 'MAPT']",0.8159622142054538,0,0,2
1067,Antigen Receptor-Mediated Signaling Pathway (GO:0050851),0.46785133455277045,1.1922328379334748,0.9056256609192846,"['GNAO1', 'MEF2C', 'RIPK2']",0.8159622142054538,0,0,3
1068,Negative Regulation Of MAPK Cascade (GO:0043409),0.46785133455277045,1.1922328379334748,0.9056256609192846,"['SPRED3', 'PTPRR', 'ITGB1BP1']",0.8159622142054538,0,0,3
1069,Regulation Of Telomere Maintenance Via Telomerase (GO:0032210),0.47499238144399564,1.271563088512241,0.9466234243846896,"['GNL3L', 'TERF1']",0.8159622142054538,0,0,2
1070,Membrane Lipid Biosynthetic Process (GO:0046467),0.47499238144399564,1.271563088512241,0.9466234243846896,"['HACD1', 'DEGS2']",0.8159622142054538,0,0,2
1071,DNA Metabolic Process (GO:0006259),0.4764317020081791,1.064276193015196,0.789087254334864,"['ENDOV', 'SLX4', 'ZNF827', 'LIG1', 'GADD45A', 'APLF', 'LTO1', 'TERF1', 'INIP']",0.8159622142054538,0,0,9
1072,Regulation Of Mitotic Cell Cycle Phase Transition (GO:1901990),0.4765850244862007,1.1758136288282,0.8714062229901242,"['KLHL18', 'NEK6', 'ERCC2']",0.8159622142054538,0,0,3
1073,Negative Regulation Of Amide Metabolic Process (GO:0034249),0.4765850244862007,1.1758136288282,0.8714062229901242,"['RIDA', 'CSNK2A1', 'DHX36']",0.8159622142054538,0,0,3
1074,Regulation Of Chromosome Segregation (GO:0051983),0.4799142291542049,1.589264740427531,1.166755340434867,['CSNK2A1'],0.8159622142054538,0,0,1
1075,RNA Destabilization (GO:0050779),0.4799142291542049,1.589264740427531,1.166755340434867,['RIDA'],0.8159622142054538,0,0,1
1076,Regulation Of Histone Deacetylation (GO:0031063),0.4799142291542049,1.589264740427531,1.166755340434867,['RRP8'],0.8159622142054538,0,0,1
1077,Activation Of Protein Kinase B Activity (GO:0032148),0.4799142291542049,1.589264740427531,1.166755340434867,['ITGB1BP1'],0.8159622142054538,0,0,1
1078,Amyloid Fibril Formation (GO:1990000),0.4799142291542049,1.589264740427531,1.166755340434867,['MAPT'],0.8159622142054538,0,0,1
1079,Aortic Valve Morphogenesis (GO:0003180),0.4799142291542049,1.589264740427531,1.166755340434867,['SLIT1'],0.8159622142054538,0,0,1
1080,Regulation Of Myeloid Cell Differentiation (GO:0045637),0.4799142291542049,1.589264740427531,1.166755340434867,['MEF2C'],0.8159622142054538,0,0,1
1081,"Regulation Of Nuclear-Transcribed mRNA Catabolic Process, Deadenylation-Dependent Decay (GO:1900151)",0.4799142291542049,1.589264740427531,1.166755340434867,['DHX36'],0.8159622142054538,0,0,1
1082,Bile Acid Biosynthetic Process (GO:0006699),0.4799142291542049,1.589264740427531,1.166755340434867,['OSBP'],0.8159622142054538,0,0,1
1083,Carboxylic Acid Metabolic Process (GO:0019752),0.4799142291542049,1.589264740427531,1.166755340434867,['ST6GAL1'],0.8159622142054538,0,0,1
1084,Regulation Of Striated Muscle Contraction (GO:0006942),0.4799142291542049,1.589264740427531,1.166755340434867,['HCN4'],0.8159622142054538,0,0,1
1085,Cellular Response To Steroid Hormone Stimulus (GO:0071383),0.4799142291542049,1.589264740427531,1.166755340434867,['ADTRP'],0.8159622142054538,0,0,1
1086,"Chemical Synaptic Transmission, Postsynaptic (GO:0099565)",0.4799142291542049,1.589264740427531,1.166755340434867,['MEF2C'],0.8159622142054538,0,0,1
1087,Membrane Protein Ectodomain Proteolysis (GO:0006509),0.4799142291542049,1.589264740427531,1.166755340434867,['RBMX'],0.8159622142054538,0,0,1
1088,Muscle Cell Development (GO:0055001),0.4799142291542049,1.589264740427531,1.166755340434867,['ACTN4'],0.8159622142054538,0,0,1
1089,Negative Regulation Of DNA Binding (GO:0043392),0.4799142291542049,1.589264740427531,1.166755340434867,['HABP4'],0.8159622142054538,0,0,1
1090,Negative Regulation Of RNA Splicing (GO:0033119),0.4799142291542049,1.589264740427531,1.166755340434867,['RBMX'],0.8159622142054538,0,0,1
1091,Negative Regulation Of Protein Dephosphorylation (GO:0035308),0.4799142291542049,1.589264740427531,1.166755340434867,['TIPRL'],0.8159622142054538,0,0,1
1092,Negative Regulation Of Receptor-Mediated Endocytosis (GO:0048261),0.4799142291542049,1.589264740427531,1.166755340434867,['NEU3'],0.8159622142054538,0,0,1
1093,Porphyrin-Containing Compound Biosynthetic Process (GO:0006779),0.4799142291542049,1.589264740427531,1.166755340434867,['COX15'],0.8159622142054538,0,0,1
1094,Positive Regulation Of Cell Cycle G2/M Phase Transition (GO:1902751),0.4799142291542049,1.589264740427531,1.166755340434867,['VPS4B'],0.8159622142054538,0,0,1
1095,Positive Regulation Of Cell Development (GO:0010720),0.4799142291542049,1.589264740427531,1.166755340434867,['FAIM'],0.8159622142054538,0,0,1
1096,Positive Regulation Of Cell-Substrate Junction Organization (GO:0150117),0.4799142291542049,1.589264740427531,1.166755340434867,['COL16A1'],0.8159622142054538,0,0,1
1097,Positive Regulation Of Cellular Response To Transforming Growth Factor Beta Stimulus (GO:1903846),0.4799142291542049,1.589264740427531,1.166755340434867,['GIPC1'],0.8159622142054538,0,0,1
1098,Positive Regulation Of Cholesterol Transport (GO:0032376),0.4799142291542049,1.589264740427531,1.166755340434867,['LPCAT3'],0.8159622142054538,0,0,1
1099,Positive Regulation Of Dendritic Spine Development (GO:0060999),0.4799142291542049,1.589264740427531,1.166755340434867,['DHX36'],0.8159622142054538,0,0,1
1100,Positive Regulation Of Leukocyte Cell-Cell Adhesion (GO:1903039),0.4799142291542049,1.589264740427531,1.166755340434867,['GNAO1'],0.8159622142054538,0,0,1
1101,Positive Regulation Of Lymphocyte Activation (GO:0051251),0.4799142291542049,1.589264740427531,1.166755340434867,['GNAO1'],0.8159622142054538,0,0,1
1102,Positive Regulation Of Protein Autophosphorylation (GO:0031954),0.4799142291542049,1.589264740427531,1.166755340434867,['TNKS1BP1'],0.8159622142054538,0,0,1
1103,Positive Regulation Of Transforming Growth Factor Beta Receptor Signaling Pathway (GO:0030511),0.4799142291542049,1.589264740427531,1.166755340434867,['GIPC1'],0.8159622142054538,0,0,1
1104,Protein K48-linked Deubiquitination (GO:0071108),0.4799142291542049,1.589264740427531,1.166755340434867,['USP20'],0.8159622142054538,0,0,1
1105,Regulation Of Macromolecule Metabolic Process (GO:0060255),0.4837451692332478,1.1219858156028368,0.8147827566360231,"['TRIM17', 'ZNF827', 'CHD7', 'COQ7']",0.8159622142054538,0,0,4
1106,Regulation Of Neuron Apoptotic Process (GO:0043523),0.48525184575903296,1.1598381821311758,0.838664205287873,"['MEF2C', 'SIX4', 'KCNB1']",0.8159622142054538,0,0,3
1107,Negative Regulation Of Macromolecule Biosynthetic Process (GO:0010558),0.48525184575903296,1.1598381821311758,0.838664205287873,"['RIDA', 'CSNK2A1', 'DHX36']",0.8159622142054538,0,0,3
1108,Activation Of Cysteine-Type Endopeptidase Activity Involved In Apoptotic Process (GO:0006919),0.48605521235180255,1.243828297715549,0.8973388498011614,"['SMAD3', 'MAPT']",0.8159622142054538,0,0,2
1109,Mitochondrial Transport (GO:0006839),0.48605521235180255,1.243828297715549,0.8973388498011614,"['TIMM9', 'TIMM44']",0.8159622142054538,0,0,2
1110,Positive Regulation Of Cellular Component Organization (GO:0051130),0.4938492710396321,1.144288747346072,0.807324235745631,"['CHAF1B', 'SLF1', 'GNL3L']",0.8159622142054538,0,0,3
1111,Positive Regulation Of Cysteine-Type Endopeptidase Activity Involved In Apoptotic Process (GO:0043280),0.4938492710396321,1.144288747346072,0.807324235745631,"['SMAD3', 'MAPT', 'GRAMD4']",0.8159622142054538,0,0,3
1112,Cellular Response To Light Stimulus (GO:0071482),0.4969718299864757,1.217273710782546,0.8511444789905827,"['TMEM161A', 'DHX36']",0.8159622142054538,0,0,2
1113,Endoplasmic Reticulum Organization (GO:0007029),0.4969718299864757,1.217273710782546,0.8511444789905827,"['LPCAT3', 'TOR1B']",0.8159622142054538,0,0,2
1114,Regulation Of Centrosome Cycle (GO:0046605),0.49751777883980297,1.5055079559363524,1.051031216147545,['VPS4B'],0.8159622142054538,0,0,1
1115,Regulation Of Intracellular Estrogen Receptor Signaling Pathway (GO:0033146),0.49751777883980297,1.5055079559363524,1.051031216147545,['UFL1'],0.8159622142054538,0,0,1
1116,Aortic Valve Development (GO:0003176),0.49751777883980297,1.5055079559363524,1.051031216147545,['SLIT1'],0.8159622142054538,0,0,1
1117,Regulation Of Osteoclast Differentiation (GO:0045670),0.49751777883980297,1.5055079559363524,1.051031216147545,['TNFRSF11A'],0.8159622142054538,0,0,1
1118,Regulation Of Spindle Organization (GO:0090224),0.49751777883980297,1.5055079559363524,1.051031216147545,['RNF4'],0.8159622142054538,0,0,1
1119,Regulation Of Supramolecular Fiber Organization (GO:1902903),0.49751777883980297,1.5055079559363524,1.051031216147545,['MAPT'],0.8159622142054538,0,0,1
1120,Regulation Of Voltage-Gated Calcium Channel Activity (GO:1901385),0.49751777883980297,1.5055079559363524,1.051031216147545,['CRHR1'],0.8159622142054538,0,0,1
1121,Digestive Tract Development (GO:0048565),0.49751777883980297,1.5055079559363524,1.051031216147545,['NPY'],0.8159622142054538,0,0,1
1122,snRNA 3'-End Processing (GO:0034472),0.49751777883980297,1.5055079559363524,1.051031216147545,['EXOSC7'],0.8159622142054538,0,0,1
1123,Heart Looping (GO:0001947),0.49751777883980297,1.5055079559363524,1.051031216147545,['MEF2C'],0.8159622142054538,0,0,1
1124,Long-Chain fatty-acyl-CoA Metabolic Process (GO:0035336),0.49751777883980297,1.5055079559363524,1.051031216147545,['HACD1'],0.8159622142054538,0,0,1
1125,Maturation Of LSU-rRNA (GO:0000470),0.49751777883980297,1.5055079559363524,1.051031216147545,['WDR12'],0.8159622142054538,0,0,1
1126,Mitochondrial RNA Metabolic Process (GO:0000959),0.49751777883980297,1.5055079559363524,1.051031216147545,['MTERF2'],0.8159622142054538,0,0,1
1127,Mitochondrial Cytochrome C Oxidase Assembly (GO:0033617),0.49751777883980297,1.5055079559363524,1.051031216147545,['TMEM223'],0.8159622142054538,0,0,1
1128,Modified Amino Acid Transport (GO:0072337),0.49751777883980297,1.5055079559363524,1.051031216147545,['SLC25A29'],0.8159622142054538,0,0,1
1129,Negative Regulation Of Neurogenesis (GO:0050768),0.49751777883980297,1.5055079559363524,1.051031216147545,['DYNLT1'],0.8159622142054538,0,0,1
1130,Negative Regulation Of Protein Localization To Membrane (GO:1905476),0.49751777883980297,1.5055079559363524,1.051031216147545,['ITGB1BP1'],0.8159622142054538,0,0,1
1131,Peptidyl-Lysine Methylation (GO:0018022),0.49751777883980297,1.5055079559363524,1.051031216147545,['KMT5A'],0.8159622142054538,0,0,1
1132,Positive Regulation Of Lipid Kinase Activity (GO:0090218),0.49751777883980297,1.5055079559363524,1.051031216147545,['MAPT'],0.8159622142054538,0,0,1
1133,Positive Regulation Of Mitotic Cell Cycle (GO:0045931),0.49751777883980297,1.5055079559363524,1.051031216147545,['KLHL18'],0.8159622142054538,0,0,1
1134,Regulation Of B Cell Proliferation (GO:0030888),0.49751777883980297,1.5055079559363524,1.051031216147545,['MEF2C'],0.8159622142054538,0,0,1
1135,Regulation Of T Cell Receptor Signaling Pathway (GO:0050856),0.49751777883980297,1.5055079559363524,1.051031216147545,['TESPA1'],0.8159622142054538,0,0,1
1136,Regulation Of Cardiac Muscle Cell Contraction (GO:0086004),0.49751777883980297,1.5055079559363524,1.051031216147545,['HCN4'],0.8159622142054538,0,0,1
1137,Regulation Of Catabolic Process (GO:0009894),0.49751777883980297,1.5055079559363524,1.051031216147545,['ZDHHC2'],0.8159622142054538,0,0,1
1138,Cytokine-Mediated Signaling Pathway (GO:0019221),0.4983489607631969,1.1002454991816695,0.7662711742832854,"['TRAF5', 'ACTN4', 'TNFRSF11A', 'JAK3']",0.8159622142054538,0,0,4
1139,DNA Repair (GO:0006281),0.5048906306723019,1.0380593132154006,0.7094236924885025,"['ENDOV', 'SLX4', 'LIG1', 'GADD45A', 'APLF', 'ERCC2', 'TNKS1BP1', 'EXO5', 'INIP']",0.8159622142054538,0,0,9
1140,Cellular Response To Growth Factor Stimulus (GO:0071363),0.5055843239466106,1.0896859169199595,0.7432098638534407,"['MEF2C', 'SMAD3', 'ITGB1BP1', 'MAPT']",0.8159622142054538,0,0,4
1141,Synapse Organization (GO:0050808),0.5055843239466106,1.0896859169199595,0.7432098638534407,"['FARP1', 'MAPT', 'ZDHHC2', 'PPFIA2']",0.8159622142054538,0,0,4
1142,RNA Catabolic Process (GO:0006401),0.5077394643434328,1.1918255649717515,0.8078036697237764,"['EXOSC7', 'RIDA']",0.8159622142054538,0,0,2
1143,Cell-Cell Junction Assembly (GO:0007043),0.5077394643434328,1.1918255649717515,0.8078036697237764,"['CTNND1', 'CDH9']",0.8159622142054538,0,0,2
1144,Endosome To Lysosome Transport (GO:0008333),0.5077394643434328,1.1918255649717515,0.8078036697237764,"['VPS4B', 'CACNG3']",0.8159622142054538,0,0,2
1145,Neuron Migration (GO:0001764),0.5077394643434328,1.1918255649717515,0.8078036697237764,"['MEF2C', 'ELP3']",0.8159622142054538,0,0,2
1146,Positive Regulation Of Peptidyl-Serine Phosphorylation (GO:0033138),0.5077394643434328,1.1918255649717515,0.8078036697237764,"['RIPK2', 'TNKS1BP1']",0.8159622142054538,0,0,2
1147,Phosphate-Containing Compound Metabolic Process (GO:0006796),0.5079437135719757,1.0672914743977342,0.7229668485959182,"['ALK', 'PLA2G4C', 'PI4KA', 'MBOAT2', 'LHPP']",0.8159622142054538,0,0,5
1148,Positive Regulation Of DNA-binding Transcription Factor Activity (GO:0051091),0.5098591879695084,1.052855120339783,0.70922499622094,"['ALK', 'SMAD3', 'RIPK2', 'TRAF5', 'TP53BP1', 'TNFRSF11A']",0.8159622142054538,0,0,6
1149,rRNA Metabolic Process (GO:0016072),0.5108265549976597,1.1144015220448342,0.7485715508414476,"['EXOSC7', 'PIN4', 'MAPT']",0.8159622142054538,0,0,3
1150,Cellular Response To Organic Cyclic Compound (GO:0071407),0.5127731416525383,1.079325572059414,0.7209050255787767,"['HCN4', 'MEF2C', 'DHX8', 'ADTRP']",0.8159622142054538,0,0,4
1151,Membrane Organization (GO:0061024),0.5143093712488683,1.0593066413961936,0.7043650881527567,"['GLTP', 'NSFL1C', 'VPS4B', 'LPCAT3', 'TOR1B']",0.8159622142054538,0,0,5
1152,Regulation Of Intracellular Steroid Hormone Receptor Signaling Pathway (GO:0033143),0.5145267069762788,1.4301268498942918,0.9503304702728748,['UFL1'],0.8159622142054538,0,0,1
1153,Alpha-Amino Acid Metabolic Process (GO:1901605),0.5145267069762788,1.4301268498942918,0.9503304702728748,['NOX4'],0.8159622142054538,0,0,1
1154,Bicellular Tight Junction Assembly (GO:0070830),0.5145267069762788,1.4301268498942918,0.9503304702728748,['CHAF1B'],0.8159622142054538,0,0,1
1155,Respiratory System Development (GO:0060541),0.5145267069762788,1.4301268498942918,0.9503304702728748,['CHD7'],0.8159622142054538,0,0,1
1156,Determination Of Heart Left/Right Asymmetry (GO:0061371),0.5145267069762788,1.4301268498942918,0.9503304702728748,['MEF2C'],0.8159622142054538,0,0,1
