Rank,Term name,P-value,Z-score,Combined score,Overlapping genes,Adjusted p-value,Old p-value,Old adjusted p-value,gene count
493,Regulation Of Leukocyte Adhesion To Vascular Endothelial Cell (GO:1904994),0.24054791803400385,4.090003020235578,5.827583403863166,['FUT9'],0.7961970623536397,0,0,1
494,Regulation Of Leukocyte Cell-Cell Adhesion (GO:1903037),0.24054791803400385,4.090003020235578,5.827583403863166,['FUT9'],0.7961970623536397,0,0,1
495,Regulation Of miRNA Metabolic Process (GO:2000628),0.24054791803400385,4.090003020235578,5.827583403863166,['SMAD3'],0.7961970623536397,0,0,1
496,Regulation Of Mitotic Sister Chromatid Separation (GO:0010965),0.24054791803400385,4.090003020235578,5.827583403863166,['LCMT1'],0.7961970623536397,0,0,1
497,Regulation Of Muscle System Process (GO:0090257),0.24054791803400385,4.090003020235578,5.827583403863166,['MYL5'],0.7961970623536397,0,0,1
498,Biogenic Amine Metabolic Process (GO:0006576),0.24054791803400385,4.090003020235578,5.827583403863166,['SMS'],0.7961970623536397,0,0,1
499,Cellular Response To Cholesterol (GO:0071397),0.24054791803400385,4.090003020235578,5.827583403863166,['GRAMD1C'],0.7961970623536397,0,0,1
500,Cellular Response To Fatty Acid (GO:0071398),0.24054791803400385,4.090003020235578,5.827583403863166,['KCNK4'],0.7961970623536397,0,0,1
501,Cellular Response To Fluid Shear Stress (GO:0071498),0.24054791803400385,4.090003020235578,5.827583403863166,['MEF2C'],0.7961970623536397,0,0,1
502,Regulation Of Toll-Like Receptor 9 Signaling Pathway (GO:0034163),0.24054791803400385,4.090003020235578,5.827583403863166,['GRAMD4'],0.7961970623536397,0,0,1
503,Regulation Of Trophoblast Cell Migration (GO:1901163),0.24054791803400385,4.090003020235578,5.827583403863166,['AGO2'],0.7961970623536397,0,0,1
504,Cellular Response To Superoxide (GO:0071451),0.24054791803400385,4.090003020235578,5.827583403863166,['CCS'],0.7961970623536397,0,0,1
505,Removal Of Superoxide Radicals (GO:0019430),0.24054791803400385,4.090003020235578,5.827583403863166,['CCS'],0.7961970623536397,0,0,1
506,Diol Metabolic Process (GO:0034311),0.24054791803400385,4.090003020235578,5.827583403863166,['DEGS2'],0.7961970623536397,0,0,1
507,Embryonic Axis Specification (GO:0000578),0.24054791803400385,4.090003020235578,5.827583403863166,['CXXC4'],0.7961970623536397,0,0,1
508,Sphingoid Metabolic Process (GO:0046519),0.24054791803400385,4.090003020235578,5.827583403863166,['DEGS2'],0.7961970623536397,0,0,1
509,Establishment Of Protein Localization To Chromosome (GO:0070199),0.24054791803400385,4.090003020235578,5.827583403863166,['ZNF827'],0.7961970623536397,0,0,1
510,Ether Lipid Biosynthetic Process (GO:0008611),0.24054791803400385,4.090003020235578,5.827583403863166,['PLA2G4C'],0.7961970623536397,0,0,1
511,Superoxide Anion Generation (GO:0042554),0.24054791803400385,4.090003020235578,5.827583403863166,['NOX4'],0.7961970623536397,0,0,1
512,Ubiquitin-Dependent Protein Catabolic Process Via The C-end Degron Rule Pathway (GO:0140627),0.24054791803400385,4.090003020235578,5.827583403863166,['KLHDC10'],0.7961970623536397,0,0,1
513,Icosanoid Biosynthetic Process (GO:0046456),0.24054791803400385,4.090003020235578,5.827583403863166,['MGST3'],0.7961970623536397,0,0,1
514,Icosanoid Transport (GO:0071715),0.24054791803400385,4.090003020235578,5.827583403863166,['ABCC4'],0.7961970623536397,0,0,1
515,Internal Protein Amino Acid Acetylation (GO:0006475),0.24054791803400385,4.090003020235578,5.827583403863166,['MAPT'],0.7961970623536397,0,0,1
516,mRNA Pseudouridine Synthesis (GO:1990481),0.24054791803400385,4.090003020235578,5.827583403863166,['PUS1'],0.7961970623536397,0,0,1
517,Melanocyte Differentiation (GO:0030318),0.24054791803400385,4.090003020235578,5.827583403863166,['MEF2C'],0.7961970623536397,0,0,1
518,Mitotic DNA Replication (GO:1902969),0.24054791803400385,4.090003020235578,5.827583403863166,['LIG1'],0.7961970623536397,0,0,1
519,Monoacylglycerol Metabolic Process (GO:0046462),0.24054791803400385,4.090003020235578,5.827583403863166,['MGLL'],0.7961970623536397,0,0,1
520,Motor Neuron Axon Guidance (GO:0008045),0.24054791803400385,4.090003020235578,5.827583403863166,['SLIT1'],0.7961970623536397,0,0,1
521,Negative Regulation Of DNA Replication (GO:0008156),0.24054791803400385,4.090003020235578,5.827583403863166,['TERF1'],0.7961970623536397,0,0,1
522,Negative Regulation Of Cytoplasmic Translation (GO:2000766),0.24054791803400385,4.090003020235578,5.827583403863166,['NMNAT2'],0.7961970623536397,0,0,1
523,Negative Regulation Of Lymphocyte Activation (GO:0051250),0.24054791803400385,4.090003020235578,5.827583403863166,['JAK3'],0.7961970623536397,0,0,1
524,Negative Regulation Of Telomerase Activity (GO:0051974),0.24054791803400385,4.090003020235578,5.827583403863166,['TERF1'],0.7961970623536397,0,0,1
525,Nuclear Membrane Disassembly (GO:0051081),0.24054791803400385,4.090003020235578,5.827583403863166,['NEK6'],0.7961970623536397,0,0,1
526,Podocyte Differentiation (GO:0072112),0.24054791803400385,4.090003020235578,5.827583403863166,['NPHS1'],0.7961970623536397,0,0,1
527,Positive Regulation Of T Cell Receptor Signaling Pathway (GO:0050862),0.24054791803400385,4.090003020235578,5.827583403863166,['TESPA1'],0.7961970623536397,0,0,1
528,Positive Regulation Of Mitochondrial Membrane Permeability Involved In Apoptotic Process (GO:1902110),0.24054791803400385,4.090003020235578,5.827583403863166,['STPG1'],0.7961970623536397,0,0,1
529,Purine Nucleobase Metabolic Process (GO:0006144),0.24054791803400385,4.090003020235578,5.827583403863166,['HPRT1'],0.7961970623536397,0,0,1
530,Purine Ribonucleoside Monophosphate Biosynthetic Process (GO:0009168),0.24054791803400385,4.090003020235578,5.827583403863166,['ATIC'],0.7961970623536397,0,0,1
531,Quaternary Ammonium Group Transport (GO:0015697),0.24054791803400385,4.090003020235578,5.827583403863166,['SLC25A19'],0.7961970623536397,0,0,1
532,Glycerophospholipid Biosynthetic Process (GO:0046474),0.24333757936538944,1.525994646826657,2.156696755839631,"['LPCAT3', 'PLA2G4C', 'PI4KA', 'MBOAT2', 'LCLAT1']",0.7961970623536397,0,0,5
533,Regulation Of Dendritic Spine Morphogenesis (GO:0061001),0.24413622526833395,2.2038787483702738,3.1075327475746923,"['DHX36', 'PPFIA2']",0.7961970623536397,0,0,2
534,Icosanoid Metabolic Process (GO:0006690),0.24413622526833395,2.2038787483702738,3.1075327475746923,"['PLA2G4C', 'MGLL']",0.7961970623536397,0,0,2
535,mRNA Splice Site Recognition (GO:0006376),0.24413622526833395,2.2038787483702738,3.1075327475746923,"['LUC7L3', 'LUC7L2']",0.7961970623536397,0,0,2
536,Negative Regulation Of Cell-Substrate Adhesion (GO:0010812),0.24413622526833395,2.2038787483702738,3.1075327475746923,"['ITGB1BP1', 'ACTN4']",0.7961970623536397,0,0,2
537,Phosphatidic Acid Biosynthetic Process (GO:0006654),0.24413622526833395,2.2038787483702738,3.1075327475746923,"['MBOAT2', 'LCLAT1']",0.7961970623536397,0,0,2
538,Protein K11-linked Ubiquitination (GO:0070979),0.24413622526833395,2.2038787483702738,3.1075327475746923,"['UBE2D4', 'RNF4']",0.7961970623536397,0,0,2
539,Protein Palmitoylation (GO:0018345),0.24413622526833395,2.2038787483702738,3.1075327475746923,"['ZDHHC6', 'ZDHHC2']",0.7961970623536397,0,0,2
540,Cilium Assembly (GO:0060271),0.24504585192770204,1.3393949523650344,1.8836044286979594,"['PLK4', 'TCTN3', 'ARL6', 'IFT122', 'IFT27', 'BBOF1', 'CFAP43', 'CLUAP1', 'BBS4']",0.7961970623536397,0,0,9
541,Organelle Disassembly (GO:1903008),0.24764158827336785,1.7915339702760085,2.5005743621839676,"['MCTS1', 'UFL1', 'MTIF3']",0.7961970623536397,0,0,3
542,"mRNA Splicing, Via Spliceosome (GO:0000398)",0.24942666778076858,1.3323910874625873,1.850145371438522,"['COIL', 'PNN', 'SCNM1', 'DHX8', 'GEMIN5', 'SNRPA1', 'MAGOHB', 'RBMX', 'U2AF1L4']",0.7961970623536397,0,0,9
543,Cell Junction Assembly (GO:0034329),0.2553314561440677,1.5930260047281324,2.1747875519819218,"['FARP1', 'CTNND1', 'CDH9', 'ZDHHC2']",0.7961970623536397,0,0,4
544,RNA Metabolic Process (GO:0016070),0.2560771817750613,1.4939809879175552,2.035215024906858,"['RBM3', 'EXOSC7', 'DHX8', 'DHX36', 'AGO2']",0.7961970623536397,0,0,5
545,Regulation Of Protein Ubiquitination (GO:0031396),0.2560771817750613,1.4939809879175552,2.035215024906858,"['UFL1', 'GNL3L', 'BAG2', 'USP4', 'RIPK2']",0.7961970623536397,0,0,5
546,Heart Development (GO:0007507),0.2560771817750613,1.4939809879175552,2.035215024906858,"['MEF2C', 'TCF25', 'CHD7', 'IFT122', 'NDUFV2']",0.7961970623536397,0,0,5
547,Proton Motive Force-Driven Mitochondrial ATP Synthesis (GO:0042776),0.2567868045288438,1.7548420642142206,2.3857237425868023,"['SDHD', 'NDUFV3', 'NDUFV2']",0.7961970623536397,0,0,3
548,Tumor Necrosis Factor-Mediated Signaling Pathway (GO:0033209),0.2567902787954278,2.1220966729441306,2.884981011211289,"['TRAF5', 'TNFRSF11A']",0.7961970623536397,0,0,2
549,Negative Regulation Of mRNA Catabolic Process (GO:1902373),0.2567902787954278,2.1220966729441306,2.884981011211289,"['THRAP3', 'ELAVL1']",0.7961970623536397,0,0,2
550,Non-Motile Cilium Assembly (GO:1905515),0.2567902787954278,2.1220966729441306,2.884981011211289,"['IFT122', 'BBS4']",0.7961970623536397,0,0,2
551,Organic Hydroxy Compound Transport (GO:0015850),0.2567902787954278,2.1220966729441306,2.884981011211289,"['ABCC4', 'OSBP']",0.7961970623536397,0,0,2
552,Phosphatidic Acid Metabolic Process (GO:0046473),0.2567902787954278,2.1220966729441306,2.884981011211289,"['MBOAT2', 'LCLAT1']",0.7961970623536397,0,0,2
553,Positive Regulation Of Microtubule Polymerization (GO:0031116),0.2567902787954278,2.1220966729441306,2.884981011211289,"['DRG1', 'MAPT']",0.7961970623536397,0,0,2
554,Positive Regulation Of Neuron Differentiation (GO:0045666),0.2567902787954278,2.1220966729441306,2.884981011211289,"['MEF2C', 'MMD2']",0.7961970623536397,0,0,2
555,Positive Regulation Of Reactive Oxygen Species Metabolic Process (GO:2000379),0.2567902787954278,2.1220966729441306,2.884981011211289,"['GADD45A', 'MAPT']",0.7961970623536397,0,0,2
556,Lipid Transport (GO:0006869),0.26280333946039736,1.5710871466044884,2.0995211853849236,"['GLTP', 'ABCC4', 'CRABP2', 'OSBP']",0.7961970623536397,0,0,4
557,Double-Strand Break Repair (GO:0006302),0.26562086308037164,1.3665748954828183,1.8116482690268914,"['SLF1', 'SLX4', 'APLF', 'TNKS1BP1', 'TP53BP1', 'CYREN', 'INIP']",0.7961970623536397,0,0,7
558,ERBB2 Signaling Pathway (GO:0038128),0.2662332389952676,3.578488372093023,4.735708945589568,['PTPRR'],0.7961970623536397,0,0,1
559,Regulation Of Endocytic Recycling (GO:2001135),0.2662332389952676,3.578488372093023,4.735708945589568,['EIPR1'],0.7961970623536397,0,0,1
560,ESCRT III Complex Disassembly (GO:1904903),0.2662332389952676,3.578488372093023,4.735708945589568,['VPS4B'],0.7961970623536397,0,0,1
561,ESCRT Complex Disassembly (GO:1904896),0.2662332389952676,3.578488372093023,4.735708945589568,['VPS4B'],0.7961970623536397,0,0,1
562,G Protein-Coupled Glutamate Receptor Signaling Pathway (GO:0007216),0.2662332389952676,3.578488372093023,4.735708945589568,['HOMER2'],0.7961970623536397,0,0,1
563,Regulation Of Lipid Catabolic Process (GO:0050994),0.2662332389952676,3.578488372093023,4.735708945589568,['ALK'],0.7961970623536397,0,0,1
564,Amino Sugar Metabolic Process (GO:0006040),0.2662332389952676,3.578488372093023,4.735708945589568,['ST6GAL1'],0.7961970623536397,0,0,1
565,Astrocyte Development (GO:0014002),0.2662332389952676,3.578488372093023,4.735708945589568,['MAPT'],0.7961970623536397,0,0,1
566,"Regulation Of Nuclear-Transcribed mRNA Catabolic Process, Nonsense-Mediated Decay (GO:2000622)",0.2662332389952676,3.578488372093023,4.735708945589568,['MAGOHB'],0.7961970623536397,0,0,1
567,Regulation Of Protein Exit From Endoplasmic Reticulum (GO:0070861),0.2662332389952676,3.578488372093023,4.735708945589568,['TM9SF4'],0.7961970623536397,0,0,1
568,Regulation Of Protein Localization To Centrosome (GO:1904779),0.2662332389952676,3.578488372093023,4.735708945589568,['NSFL1C'],0.7961970623536397,0,0,1
569,Regulation Of Protein Localization To Chromatin (GO:1905634),0.2662332389952676,3.578488372093023,4.735708945589568,['RNF4'],0.7961970623536397,0,0,1
570,Cardiolipin Metabolic Process (GO:0032048),0.2662332389952676,3.578488372093023,4.735708945589568,['LCLAT1'],0.7961970623536397,0,0,1
571,Cell Projection Assembly (GO:0030031),0.2662332389952676,3.578488372093023,4.735708945589568,['PARVB'],0.7961970623536397,0,0,1
572,Cellular Response To Leucine (GO:0071233),0.2662332389952676,3.578488372093023,4.735708945589568,['SESN2'],0.7961970623536397,0,0,1
573,Response To Leucine (GO:0043201),0.2662332389952676,3.578488372093023,4.735708945589568,['SESN2'],0.7961970623536397,0,0,1
574,Response To Muramyl Dipeptide (GO:0032495),0.2662332389952676,3.578488372093023,4.735708945589568,['RIPK2'],0.7961970623536397,0,0,1
575,Endoplasmic Reticulum Membrane Organization (GO:0090158),0.2662332389952676,3.578488372093023,4.735708945589568,['LPCAT3'],0.7961970623536397,0,0,1
576,Sodium Ion Export Across Plasma Membrane (GO:0036376),0.2662332389952676,3.578488372093023,4.735708945589568,['SLC4A4'],0.7961970623536397,0,0,1
577,Glucosamine-Containing Compound Metabolic Process (GO:1901071),0.2662332389952676,3.578488372093023,4.735708945589568,['OGA'],0.7961970623536397,0,0,1
578,Lipid Droplet Formation (GO:0140042),0.2662332389952676,3.578488372093023,4.735708945589568,['PLA2G4C'],0.7961970623536397,0,0,1
579,Lymphocyte Proliferation (GO:0046651),0.2662332389952676,3.578488372093023,4.735708945589568,['MEF2C'],0.7961970623536397,0,0,1
580,Megakaryocyte Differentiation (GO:0030219),0.2662332389952676,3.578488372093023,4.735708945589568,['THPO'],0.7961970623536397,0,0,1
581,Mitochondrial Ribosome Assembly (GO:0061668),0.2662332389952676,3.578488372093023,4.735708945589568,['NOA1'],0.7961970623536397,0,0,1
582,Negative Regulation Of calcineurin-NFAT Signaling Cascade (GO:0070885),0.2662332389952676,3.578488372093023,4.735708945589568,['HOMER2'],0.7961970623536397,0,0,1
583,Negative Regulation Of Calcineurin-Mediated Signaling (GO:0106057),0.2662332389952676,3.578488372093023,4.735708945589568,['HOMER2'],0.7961970623536397,0,0,1
584,Negative Regulation Of Interleukin-2 Production (GO:0032703),0.2662332389952676,3.578488372093023,4.735708945589568,['HOMER2'],0.7961970623536397,0,0,1
585,Negative Regulation Of Lipid Catabolic Process (GO:0050995),0.2662332389952676,3.578488372093023,4.735708945589568,['ALK'],0.7961970623536397,0,0,1
586,Negative Regulation Of Substrate Adhesion-Dependent Cell Spreading (GO:1900025),0.2662332389952676,3.578488372093023,4.735708945589568,['ITGB1BP1'],0.7961970623536397,0,0,1
587,Negative Regulation Of Voltage-Gated Calcium Channel Activity (GO:1901386),0.2662332389952676,3.578488372093023,4.735708945589568,['CRHR1'],0.7961970623536397,0,0,1
588,Nuclear mRNA Surveillance (GO:0071028),0.2662332389952676,3.578488372093023,4.735708945589568,['EXOSC7'],0.7961970623536397,0,0,1
589,Pancreas Development (GO:0031016),0.2662332389952676,3.578488372093023,4.735708945589568,['SRP54'],0.7961970623536397,0,0,1
590,Peptidyl-Tyrosine Autophosphorylation (GO:0038083),0.2662332389952676,3.578488372093023,4.735708945589568,['ALK'],0.7961970623536397,0,0,1
591,Phosphate Ion Transmembrane Transport (GO:0035435),0.2662332389952676,3.578488372093023,4.735708945589568,['SLC37A1'],0.7961970623536397,0,0,1
592,Positive Regulation Of Cardiac Muscle Cell Proliferation (GO:0060045),0.2662332389952676,3.578488372093023,4.735708945589568,['MEF2C'],0.7961970623536397,0,0,1
593,Positive Regulation Of mRNA 3'-End Processing (GO:0031442),0.2662332389952676,3.578488372093023,4.735708945589568,['DHX36'],0.7961970623536397,0,0,1
594,Positive Regulation Of Protein Exit From Endoplasmic Reticulum (GO:0070863),0.2662332389952676,3.578488372093023,4.735708945589568,['TM9SF4'],0.7961970623536397,0,0,1
595,Purine Ribonucleoside Monophosphate Metabolic Process (GO:0009167),0.2662332389952676,3.578488372093023,4.735708945589568,['HPRT1'],0.7961970623536397,0,0,1
596,Regulation Of Alcohol Biosynthetic Process (GO:1902930),0.2662332389952676,3.578488372093023,4.735708945589568,['LPCAT3'],0.7961970623536397,0,0,1
597,Regulation Of Peptidyl-Threonine Phosphorylation (GO:0010799),0.2694542147453148,2.0461561743341403,2.683240798125306,"['RIPK2', 'TNKS1BP1']",0.7961970623536397,0,0,2
598,Response To Transforming Growth Factor Beta (GO:0071559),0.2694542147453148,2.0461561743341403,2.683240798125306,"['MEF2C', 'SMAD3']",0.7961970623536397,0,0,2
599,Glutamate Receptor Signaling Pathway (GO:0007215),0.2694542147453148,2.0461561743341403,2.683240798125306,"['HOMER2', 'KCNB1']",0.7961970623536397,0,0,2
600,Glycolipid Metabolic Process (GO:0006664),0.2694542147453148,2.0461561743341403,2.683240798125306,"['GLTP', 'NEU3']",0.7961970623536397,0,0,2
601,miRNA Processing (GO:0035196),0.2694542147453148,2.0461561743341403,2.683240798125306,"['SMAD3', 'AGO2']",0.7961970623536397,0,0,2
602,Regulation Of Protein Localization (GO:0032880),0.27031611538237377,1.5497412305922944,2.0273144584183536,"['UFL1', 'TRIM17', 'MMD2', 'MAPT']",0.7961970623536397,0,0,4
603,Adenylate Cyclase-Modulating G Protein-Coupled Receptor Signaling Pathway (GO:0007188),0.27786606471043307,1.5289645390070923,1.9580165484140006,"['GNAO1', 'GNAL', 'HTR1F', 'CRHR1']",0.7961970623536397,0,0,4
604,Protein O-linked Glycosylation (GO:0006493),0.27786606471043307,1.5289645390070923,1.9580165484140006,"['ST6GAL1', 'FUT9', 'OGA', 'GCNT4']",0.7961970623536397,0,0,4
605,Microtubule Polymerization (GO:0046785),0.2821129392696895,1.9754529514903565,2.4998325803177943,"['TUBG2', 'MAPT']",0.7961970623536397,0,0,2
606,Negative Regulation Of Cysteine-Type Endopeptidase Activity (GO:2000117),0.2821129392696895,1.9754529514903565,2.4998325803177943,"['CSNK2A1', 'CARD18']",0.7961970623536397,0,0,2
607,Negative Regulation Of Transferase Activity (GO:0051348),0.2821129392696895,1.9754529514903565,2.4998325803177943,"['MAPT', 'TERF1']",0.7961970623536397,0,0,2
608,Telomere Organization (GO:0032200),0.28446656953923366,1.653233708966193,2.0783454616469124,"['ZNF827', 'LTO1', 'TERF1']",0.7961970623536397,0,0,3
609,Positive Regulation Of Protein Localization To Nucleus (GO:1900182),0.28446656953923366,1.653233708966193,2.0783454616469124,"['SMAD3', 'SESN2', 'NMD3']",0.7961970623536397,0,0,3
610,3'-UTR-mediated mRNA Stabilization (GO:0070935),0.2910516302147804,3.180643645759925,3.92572406387547,['ELAVL1'],0.7961970623536397,0,0,1
611,C-terminal Protein Amino Acid Modification (GO:0018410),0.2910516302147804,3.180643645759925,3.92572406387547,['LCMT1'],0.7961970623536397,0,0,1
612,Regulation Of Establishment Of Protein Localization To Telomere (GO:0070203),0.2910516302147804,3.180643645759925,3.92572406387547,['TERF1'],0.7961970623536397,0,0,1
613,N-acetylglucosamine Metabolic Process (GO:0006044),0.2910516302147804,3.180643645759925,3.92572406387547,['OGA'],0.7961970623536397,0,0,1
614,Regulation Of Insulin-Like Growth Factor Receptor Signaling Pathway (GO:0043567),0.2910516302147804,3.180643645759925,3.92572406387547,['IGFBP2'],0.7961970623536397,0,0,1
615,Regulation Of Integrin-Mediated Signaling Pathway (GO:2001044),0.2910516302147804,3.180643645759925,3.92572406387547,['ITGB1BP1'],0.7961970623536397,0,0,1
616,Regulation Of Lipid Storage (GO:0010883),0.2910516302147804,3.180643645759925,3.92572406387547,['HILPDA'],0.7961970623536397,0,0,1
617,Regulation Of Melanin Biosynthetic Process (GO:0048021),0.2910516302147804,3.180643645759925,3.92572406387547,['GIPC1'],0.7961970623536397,0,0,1
618,Regulation Of Mitochondrial Fusion (GO:0010635),0.2910516302147804,3.180643645759925,3.92572406387547,['ZDHHC6'],0.7961970623536397,0,0,1
619,Antigen Processing And Presentation Of Exogenous Peptide Antigen Via MHC Class II (GO:0019886),0.2910516302147804,3.180643645759925,3.92572406387547,['GNAO1'],0.7961970623536397,0,0,1
620,Antigen Processing And Presentation Of Peptide Antigen Via MHC Class II (GO:0002495),0.2910516302147804,3.180643645759925,3.92572406387547,['GNAO1'],0.7961970623536397,0,0,1
621,Regulation Of Receptor Signaling Pathway Via STAT (GO:1904892),0.2910516302147804,3.180643645759925,3.92572406387547,['JAK3'],0.7961970623536397,0,0,1
622,Regulation Of Transforming Growth Factor Beta Production (GO:0071634),0.2910516302147804,3.180643645759925,3.92572406387547,['SMAD3'],0.7961970623536397,0,0,1
623,Ceramide Catabolic Process (GO:0046514),0.2910516302147804,3.180643645759925,3.92572406387547,['NEU3'],0.7961970623536397,0,0,1
624,Chemokine-Mediated Signaling Pathway (GO:0070098),0.2910516302147804,3.180643645759925,3.92572406387547,['THPO'],0.7961970623536397,0,0,1
625,Chondroitin Sulfate Biosynthetic Process (GO:0030206),0.2910516302147804,3.180643645759925,3.92572406387547,['CHST15'],0.7961970623536397,0,0,1
626,Coenzyme A Biosynthetic Process (GO:0015937),0.2910516302147804,3.180643645759925,3.92572406387547,['DCAKD'],0.7961970623536397,0,0,1
627,Ribonucleoside Bisphosphate Biosynthetic Process (GO:0034030),0.2910516302147804,3.180643645759925,3.92572406387547,['DCAKD'],0.7961970623536397,0,0,1
628,Ear Morphogenesis (GO:0042471),0.2910516302147804,3.180643645759925,3.92572406387547,['CHD7'],0.7961970623536397,0,0,1
629,Stabilization Of Membrane Potential (GO:0030322),0.2910516302147804,3.180643645759925,3.92572406387547,['KCNK4'],0.7961970623536397,0,0,1
630,Substrate-Dependent Cell Migration (GO:0006929),0.2910516302147804,3.180643645759925,3.92572406387547,['ITGB1BP1'],0.7961970623536397,0,0,1
631,Facultative Heterochromatin Formation (GO:0140718),0.2910516302147804,3.180643645759925,3.92572406387547,['RRP8'],0.7961970623536397,0,0,1
632,Heart Process (GO:0003015),0.2910516302147804,3.180643645759925,3.92572406387547,['NOX4'],0.7961970623536397,0,0,1
633,Very Long-Chain Fatty Acid Biosynthetic Process (GO:0042761),0.2910516302147804,3.180643645759925,3.92572406387547,['HACD1'],0.7961970623536397,0,0,1
634,Inner Ear Morphogenesis (GO:0042472),0.2910516302147804,3.180643645759925,3.92572406387547,['CHD7'],0.7961970623536397,0,0,1
635,Intraciliary Retrograde Transport (GO:0035721),0.2910516302147804,3.180643645759925,3.92572406387547,['IFT122'],0.7961970623536397,0,0,1
636,Leukotriene Metabolic Process (GO:0006691),0.2910516302147804,3.180643645759925,3.92572406387547,['MGST3'],0.7961970623536397,0,0,1
637,Medium-Chain Fatty Acid Metabolic Process (GO:0051791),0.2910516302147804,3.180643645759925,3.92572406387547,['ACAD9'],0.7961970623536397,0,0,1
638,Microglial Cell Activation (GO:0001774),0.2910516302147804,3.180643645759925,3.92572406387547,['MAPT'],0.7961970623536397,0,0,1
639,Negative Regulation Of Biosynthetic Process (GO:0009890),0.2910516302147804,3.180643645759925,3.92572406387547,['ASXL3'],0.7961970623536397,0,0,1
640,Negative Regulation Of Cardiac Muscle Hypertrophy (GO:0010614),0.2910516302147804,3.180643645759925,3.92572406387547,['MLIP'],0.7961970623536397,0,0,1
641,Negative Regulation Of Epithelial Cell Differentiation (GO:0030857),0.2910516302147804,3.180643645759925,3.92572406387547,['SPRED3'],0.7961970623536397,0,0,1
642,Negative Regulation Of Exocytosis (GO:0045920),0.2910516302147804,3.180643645759925,3.92572406387547,['VPS4B'],0.7961970623536397,0,0,1
643,Negative Regulation Of Leukocyte Cell-Cell Adhesion (GO:1903038),0.2910516302147804,3.180643645759925,3.92572406387547,['JAK3'],0.7961970623536397,0,0,1
644,Nuclear RNA Surveillance (GO:0071027),0.2910516302147804,3.180643645759925,3.92572406387547,['EXOSC7'],0.7961970623536397,0,0,1
645,Nuclear Body Organization (GO:0030575),0.2910516302147804,3.180643645759925,3.92572406387547,['HABP4'],0.7961970623536397,0,0,1
646,Nuclear Pore Complex Assembly (GO:0051292),0.2910516302147804,3.180643645759925,3.92572406387547,['NDC1'],0.7961970623536397,0,0,1
647,Nucleoside Phosphate Biosynthetic Process (GO:1901293),0.2910516302147804,3.180643645759925,3.92572406387547,['NMNAT2'],0.7961970623536397,0,0,1
648,Nucleotide Metabolic Process (GO:0009117),0.2910516302147804,3.180643645759925,3.92572406387547,['NMNAT2'],0.7961970623536397,0,0,1
649,Polyamine Metabolic Process (GO:0006595),0.2910516302147804,3.180643645759925,3.92572406387547,['SMS'],0.7961970623536397,0,0,1
650,Positive Regulation Of Cardiac Muscle Tissue Growth (GO:0055023),0.2910516302147804,3.180643645759925,3.92572406387547,['MEF2C'],0.7961970623536397,0,0,1
651,Positive Regulation Of Lipid Storage (GO:0010884),0.2910516302147804,3.180643645759925,3.92572406387547,['HILPDA'],0.7961970623536397,0,0,1
652,Positive Regulation Of Protein Localization To Cell Surface (GO:2000010),0.2910516302147804,3.180643645759925,3.92572406387547,['TM9SF4'],0.7961970623536397,0,0,1
653,Positive Regulation Of Stem Cell Proliferation (GO:2000648),0.2910516302147804,3.180643645759925,3.92572406387547,['THPO'],0.7961970623536397,0,0,1
654,Post-Transcriptional Gene Silencing (GO:0016441),0.2910516302147804,3.180643645759925,3.92572406387547,['MOV10L1'],0.7961970623536397,0,0,1
655,Protein Deneddylation (GO:0000338),0.2910516302147804,3.180643645759925,3.92572406387547,['COPS7B'],0.7961970623536397,0,0,1
656,Protein Localization To Cell-Cell Junction (GO:0150105),0.2910516302147804,3.180643645759925,3.92572406387547,['CHAF1B'],0.7961970623536397,0,0,1
657,Purine Nucleoside Bisphosphate Biosynthetic Process (GO:0034033),0.2910516302147804,3.180643645759925,3.92572406387547,['DCAKD'],0.7961970623536397,0,0,1
658,Regulation Of Amyloid Precursor Protein Biosynthetic Process (GO:0042984),0.2910516302147804,3.180643645759925,3.92572406387547,['AGO2'],0.7961970623536397,0,0,1
659,Proton Motive Force-Driven ATP Synthesis (GO:0015986),0.2937525736956593,1.6219204422545368,1.9868808475903719,"['SDHD', 'NDUFV3', 'NDUFV2']",0.7961970623536397,0,0,3
660,Purine Ribonucleotide Metabolic Process (GO:0009150),0.2937525736956593,1.6219204422545368,1.9868808475903719,"['TPST2', 'SULT1A1', 'HPRT1']",0.7961970623536397,0,0,3
661,Positive Regulation Of Cellular Biosynthetic Process (GO:0031328),0.2943610486405051,1.3549364021804966,1.6570170456615698,"['RBM3', 'SMAD3', 'GIPC1', 'AGO2', 'NMD3', 'ELAVL1']",0.7961970623536397,0,0,6
