Rank,Term name,P-value,Z-score,Combined score,Overlapping genes,Adjusted p-value,Old p-value,Old adjusted p-value,gene count
1,Oxidative Phosphorylation (GO:0006119),1.3495114127828724e-13,21.322922044398556,631.8805633838112,"['NDUFA13', 'NDUFA7', 'NDUFA6', 'NDUFA5', 'NDUFB3', 'NDUFB2', 'NDUFA1', 'CHCHD10', 'UQCRH', 'ATP5F1E', 'NDUFS6', 'NDUFS5', 'ATP5PO', 'ATP5MF', 'ATP5ME']",9.09570692215656e-11,0,0,15
2,Mitochondrial Respiratory Chain Complex Assembly (GO:0033108),4.5389517089124487e-13,19.10668826660495,543.0294700049168,"['COA3', 'NDUFA13', 'NDUFA6', 'NDUFA5', 'PET100', 'UQCC3', 'COX17', 'NDUFB3', 'NDUFB2', 'NDUFA1', 'NDUFS5', 'SDHAF1', 'TMEM126A', 'COX14', 'COA8']",1.4919693820849502e-10,0,0,15
3,Aerobic Electron Transport Chain (GO:0019646),6.64081327337515e-13,18.466442953020135,517.805925709196,"['NDUFA7', 'NDUFA6', 'NDUFA5', 'UQCC3', 'NDUFB3', 'NDUFB2', 'NDUFA1', 'COX7A2', 'UQCR10', 'COX6C', 'UQCRH', 'NDUFS6', 'UQCRQ', 'NDUFS5', 'CYCS']",1.4919693820849502e-10,0,0,15
4,Mitochondrial ATP Synthesis Coupled Electron Transport (GO:0042775),9.611497207550055e-13,17.86750378869885,494.4053758364732,"['NDUFA7', 'NDUFA6', 'NDUFA5', 'UQCC3', 'NDUFB3', 'NDUFB2', 'NDUFA1', 'COX7A2', 'UQCR10', 'COX6C', 'UQCRH', 'NDUFS6', 'UQCRQ', 'NDUFS5', 'CYCS']",1.6195372794721843e-10,0,0,15
5,Cellular Respiration (GO:0045333),1.202994649643694e-12,15.22938322938323,417.9888065218484,"['NDUFA13', 'NDUFA7', 'NDUFA6', 'NDUFA5', 'NDUFB3', 'NDUFB2', 'NDUFA1', 'COX7A2', 'UQCR10', 'COX6C', 'MTLN', 'UQCRH', 'NDUFS6', 'UQCRQ', 'NDUFS5', 'CYCS']",1.6216367877196995e-10,0,0,16
6,Proton Motive Force-Driven ATP Synthesis (GO:0015986),2.7672377193732054e-12,19.033086419753086,506.5307931869226,"['NDUFA13', 'NDUFA7', 'NDUFA6', 'NDUFA5', 'NDUFB3', 'NDUFB2', 'NDUFA1', 'ATP5F1E', 'ATP5MC1', 'NDUFS6', 'NDUFS5', 'ATP5PO', 'ATP5MF', 'ATP5ME']",3.108530371429234e-10,0,0,14
7,Mitochondrial Gene Expression (GO:0140053),3.826238873376579e-12,15.813998082454459,415.73639077224874,"['MRPS26', 'NDUFA7', 'MRPS24', 'MRPS33', 'MRPS12', 'MRPS18B', 'MRPS21', 'MRPL36', 'MRPL47', 'MRPS7', 'MRPL46', 'MRPL57', 'MRPL52', 'MRPL51', 'CHCHD1']",3.2236062508197676e-10,0,0,15
8,Mitochondrial Translation (GO:0032543),3.826238873376579e-12,15.813998082454459,415.73639077224874,"['MRPS26', 'NDUFA7', 'MRPS24', 'MRPS33', 'MRPS12', 'MRPS18B', 'MRPS21', 'MRPL36', 'MRPL47', 'MRPS7', 'MRPL46', 'MRPL57', 'MRPL52', 'MRPL51', 'CHCHD1']",3.2236062508197676e-10,0,0,15
9,Proton Motive Force-Driven Mitochondrial ATP Synthesis (GO:0042776),1.1341963563861583e-11,19.761865342163354,498.0486420815086,"['NDUFA13', 'NDUFA7', 'NDUFA6', 'NDUFA5', 'NDUFB3', 'NDUFB2', 'NDUFA1', 'ATP5F1E', 'NDUFS6', 'NDUFS5', 'ATP5PO', 'ATP5MF', 'ATP5ME']",8.493870491158563e-10,0,0,13
10,Translation (GO:0006412),4.5984897738684817e-10,6.5132981772326035,140.0367118835158,"['RPL41', 'NDUFA7', 'MRPS26', 'MRPS24', 'MRPS33', 'MRPS12', 'MRPS18B', 'MRPS21', 'MRPL47', 'MRPL36', 'MRPS7', 'MRPL57', 'MRPL46', 'MRPL52', 'MRPL51', 'RPL18A', 'RPLP2', 'FAU', 'RPL29', 'CHCHD1', 'RPL39']",3.099382107587357e-08,0,0,21
11,Aerobic Respiration (GO:0009060),2.5945591937736787e-09,15.84,313.1544113641512,"['NDUFA13', 'NDUFA7', 'NDUFA6', 'NDUFA5', 'NDUFS6', 'NDUFS5', 'NDUFB3', 'NDUFB2', 'NDUFA1', 'CHCHD10', 'UQCRH']",1.5897571787304177e-07,0,0,11
12,Mitochondrial Cytochrome C Oxidase Assembly (GO:0033617),9.716294188975529e-07,57.9664570230608,802.504520218853,"['COA3', 'PET100', 'COX17', 'COX14', 'COA8']",5.0375248333611587e-05,0,0,5
13,Respiratory Chain Complex IV Assembly (GO:0008535),9.716294188975529e-07,57.9664570230608,802.504520218853,"['COA3', 'PET100', 'COX17', 'COX14', 'COA8']",5.0375248333611587e-05,0,0,5
14,NADH Dehydrogenase Complex Assembly (GO:0010257),1.7837988309378757e-06,12.285395763656632,162.61890025626803,"['NDUFA13', 'NDUFA6', 'NDUFA5', 'NDUFS5', 'NDUFB3', 'TMEM126A', 'NDUFB2', 'NDUFA1']",8.015202747014187e-05,0,0,8
15,Mitochondrial Respiratory Chain Complex I Assembly (GO:0032981),1.7837988309378757e-06,12.285395763656632,162.61890025626803,"['NDUFA13', 'NDUFA6', 'NDUFA5', 'NDUFS5', 'NDUFB3', 'TMEM126A', 'NDUFB2', 'NDUFA1']",8.015202747014187e-05,0,0,8
16,Inner Mitochondrial Membrane Organization (GO:0007007),2.096633923995346e-06,23.30801687763713,304.7564553443162,"['TIMM8B', 'NDUFA13', 'UQCC3', 'TMEM11', 'TIMM10', 'MICOS10']",8.466148681700927e-05,0,0,6
17,"Mitochondrial Electron Transport, Ubiquinol To Cytochrome C (GO:0006122)",2.135378747610026e-06,43.466981132075475,567.5425710021785,"['UQCC3', 'UQCRQ', 'CYCS', 'UQCR10', 'UQCRH']",8.466148681700927e-05,0,0,5
18,Peptide Biosynthetic Process (GO:0043043),2.3002172033779443e-06,5.34259649122807,69.36029636283631,"['RPL41', 'MRPS33', 'MRPS12', 'MRPS18B', 'MRPS21', 'MRPL36', 'MRPS7', 'MRPL52', 'MRPL51', 'RPL18A', 'RPLP2', 'FAU', 'RPL29', 'RPL39']",8.61303552820408e-05,0,0,14
19,"Mitochondrial Electron Transport, NADH To Ubiquinone (GO:0006120)",3.3015727630388715e-06,14.466841513675535,182.58762136176014,"['NDUFA7', 'NDUFA6', 'NDUFA5', 'NDUFS6', 'NDUFS5', 'NDUFB3', 'NDUFB2']",0.00011711894959411576,0,0,7
20,"RNA Splicing, Via Transesterification Reactions With Bulged Adenosine As Nucleophile (GO:0000377)",3.96732417915481e-06,8.866129032258064,110.27175902951835,"['LSM7', 'SNRPD1', 'SNRPG', 'SNRPE', 'CWC15', 'LSM4', 'ESS2', 'LSM3', 'LSM2']",0.00013369882483751713,0,0,9
21,Energy Derivation By Oxidation Of Organic Compounds (GO:0015980),7.875022970338444e-06,12.290127388535032,144.4312967154417,"['UQCRQ', 'CYCS', 'COX7A2', 'UQCR10', 'COX6C', 'MTLN', 'UQCRH']",0.00025275073723848146,0,0,7
22,"mRNA Splicing, Via Spliceosome (GO:0000398)",9.912731486290736e-06,7.777812745869394,89.61355214504323,"['LSM7', 'SNRPD1', 'SNRPG', 'SNRPE', 'CWC15', 'LSM4', 'ESS2', 'LSM3', 'LSM2']",0.0003036900464436344,0,0,9
23,Macromolecule Biosynthetic Process (GO:0009059),1.1776602404502599e-05,4.559039039039039,51.742338713242255,"['RPL41', 'MRPS33', 'MRPS12', 'MRPS18B', 'MRPS21', 'MRPL36', 'MRPS7', 'MRPL52', 'MRPL51', 'RPL18A', 'RPLP2', 'FAU', 'RPL29', 'RPL39']",0.0003451056530710762,0,0,14
24,mRNA Processing (GO:0006397),1.3854483870233848e-05,7.413353338334583,82.93245456352119,"['LSM7', 'SNRPD1', 'SNRPG', 'SNRPE', 'CWC15', 'LSM4', 'ESS2', 'LSM3', 'LSM2']",0.00038908008868906725,0,0,9
25,Mitochondrion Organization (GO:0007005),1.6281203896040275e-05,7.243548387096774,79.86373731460382,"['TIMM8B', 'CHCHD2', 'HAX1', 'TMEM11', 'CHCHD10', 'COX7A2', 'TIMM10', 'COX7A1', 'TOMM5']",0.00043894125703724586,0,0,9
26,Gene Expression (GO:0010467),3.103010163819007e-05,4.139562841530054,42.97095066209441,"['RPL41', 'MRPS33', 'MRPS12', 'MRPS18B', 'MRPS21', 'MRPL36', 'MRPS7', 'MRPL52', 'MRPL51', 'RPL18A', 'RPLP2', 'FAU', 'RPL29', 'RPL39']",0.0008043957116976965,0,0,14
27,Spliceosomal snRNP Assembly (GO:0000387),4.4209720385007394e-05,17.367924528301888,174.14063939237687,"['SNRPD1', 'SNRPG', 'SNRPE', 'LSM4', 'LSM2']",0.0011036056125738882,0,0,5
28,ATP Biosynthetic Process (GO:0006754),6.281654169951917e-05,15.786163522012579,152.73574347140317,"['ATP5PO', 'ATP5MF', 'ATP5F1E', 'ATP5MC1', 'ATP5ME']",0.0015120838966241402,0,0,5
29,7-Methylguanosine Cap Hypermethylation (GO:0036261),9.17422723598757e-05,103.0807453416149,958.2929631249648,"['SNRPD1', 'SNRPG', 'SNRPE']",0.002061143052351874,0,0,3
30,RNA Capping (GO:0036260),9.17422723598757e-05,103.0807453416149,958.2929631249648,"['SNRPD1', 'SNRPG', 'SNRPE']",0.002061143052351874,0,0,3
31,P-body Assembly (GO:0033962),0.0008237677931652145,inf,inf,"['LSM4', 'LSM3']",0.017910306212688857,0,0,2
32,Protein Insertion Into Mitochondrial Inner Membrane (GO:0045039),0.00117921621337655,20.601242236024845,138.9122251951999,"['TIMM8B', 'NDUFA13', 'TIMM10']",0.024837241494243583,0,0,3
33,Protein Insertion Into Mitochondrial Membrane (GO:0051204),0.001477239582139195,9.855357142857143,64.23307939519933,"['TIMM8B', 'NDUFA13', 'TIMM10', 'TOMM5']",0.030171499344297498,0,0,4
34,Transcription By RNA Polymerase III (GO:0006383),0.0017315653370037962,17.164596273291924,109.14502400052069,"['SNAPC5', 'POLR3K', 'POLR2K']",0.03432573638648702,0,0,3
35,RNA Splicing (GO:0008380),0.0018296011103976285,9.196666666666667,57.972635045779015,"['SNRPD1', 'SNRPG', 'SNRNP25', 'LSM4']",0.03523288995451433,0,0,4
36,U2-type Prespliceosome Assembly (GO:1903241),0.002421628376920472,14.709849157054126,88.60205628270047,"['SNRPD1', 'SNRPG', 'SNRPE']",0.04300213920789596,0,0,3
37,Innate Immune Response In Mucosa (GO:0002227),0.0024244529523739563,68.29629629629629,411.29049748808853,"['FAU', 'RPL39']",0.04300213920789596,0,0,2
38,Cristae Formation (GO:0042407),0.0024244529523739563,68.29629629629629,411.29049748808853,"['UQCC3', 'MICOS10']",0.04300213920789596,0,0,2
39,RNA Processing (GO:0006396),0.0034039137879313254,5.581253804017042,31.717313180022142,"['SNRPD1', 'SNRPG', 'SNRNP25', 'LSM4', 'LSM3']",0.05882661264271059,0,0,5
40,"Mitochondrial Electron Transport, Cytochrome C To Oxygen (GO:0006123)",0.004255201302966817,11.436853002070393,62.44079371183713,"['CYCS', 'COX7A2', 'COX6C']",0.07170014195499087,0,0,3
41,Antibacterial Humoral Response (GO:0019731),0.004757177741537846,34.141975308641975,182.59472197999582,"['FAU', 'RPL39']",0.07456599529759321,0,0,2
42,Mucosal Immune Response (GO:0002385),0.004757177741537846,34.141975308641975,182.59472197999582,"['FAU', 'RPL39']",0.07456599529759321,0,0,2
43,Regulation Of RNA Polymerase II Regulatory Region Sequence-Specific DNA Binding (GO:1903025),0.004757177741537846,34.141975308641975,182.59472197999582,"['TMSB4X', 'LAMTOR5']",0.07456599529759321,0,0,2
44,Striated Muscle Cell Differentiation (GO:0051146),0.0077789773648780204,22.757201646090536,110.51649002570173,"['MESP1', 'MTLN']",0.11651179430950635,0,0,2
45,Regulation Of Oxidative Phosphorylation (GO:0002082),0.0077789773648780204,22.757201646090536,110.51649002570173,"['COX7A2', 'COX7A1']",0.11651179430950635,0,0,2
46,Spliceosomal Complex Assembly (GO:0000245),0.008259651370132806,8.572981366459627,41.11921549268266,"['SNRPD1', 'SNRPG', 'SNRPE']",0.11844691539296832,0,0,3
47,RNA Methylation (GO:0001510),0.008259651370132806,8.572981366459627,41.11921549268266,"['SNRPD1', 'SNRPG', 'SNRPE']",0.11844691539296832,0,0,3
48,Cytoplasmic Translation (GO:0002181),0.008957248954246252,3.2446709129511677,15.29957123811469,"['RPL41', 'RPL18A', 'MRPS12', 'RPLP2', 'FAU', 'RPL29', 'RPL39']",0.12577470406587446,0,0,7
49,Regulation Of Cysteine-Type Endopeptidase Activity Involved In Apoptotic Process (GO:0043281),0.010117507022061602,5.295192307692307,24.32340225510484,"['NDUFA13', 'CYCS', 'TRIAP1', 'LAMTOR5']",0.13916734148713306,0,0,4
50,Regulation Of Aerobic Respiration (GO:1903715),0.011448727958408622,17.064814814814813,76.2776172856582,"['COX7A2', 'COX7A1']",0.15130279694053747,0,0,2
51,Sequestering Of Actin Monomers (GO:0042989),0.011448727958408622,17.064814814814813,76.2776172856582,"['TMSB4X', 'TMSB10']",0.15130279694053747,0,0,2
52,protein-RNA Complex Assembly (GO:0022618),0.011727508902723782,4.014918824045634,17.849598411128348,"['SNRPD1', 'SNRPG', 'SNRPE', 'MRPS7', 'LSM4']",0.15200655770068902,0,0,5
53,Protein Targeting To Mitochondrion (GO:0006626),0.012699285012988209,4.915178571428571,21.460699791994735,"['TIMM8B', 'NDUFA13', 'TIMM10', 'TOMM5']",0.16149656790101985,0,0,4
54,Regulation Of Actin Filament Organization (GO:0110053),0.01572707742885467,13.649382716049383,56.67730607897717,"['HAX1', 'BRK1']",0.19629722568607494,0,0,2
55,Positive Regulation Of Ion Transmembrane Transporter Activity (GO:0032414),0.025960624766093822,9.746031746031745,35.58446084222903,"['COX17', 'COA8']",0.2455996972932229,0,0,2
56,Positive Regulation Of Peptidase Activity (GO:0010952),0.025960624766093822,9.746031746031745,35.58446084222903,"['PSENEN', 'NDUFA13']",0.2455996972932229,0,0,2
57,Positive Regulation Of Telomerase RNA Localization To Cajal Body (GO:1904874),0.025960624766093822,9.746031746031745,35.58446084222903,"['NHP2', 'CCT7']",0.2455996972932229,0,0,2
58,Regulation Of Telomerase RNA Localization To Cajal Body (GO:1904872),0.025960624766093822,9.746031746031745,35.58446084222903,"['NHP2', 'CCT7']",0.2455996972932229,0,0,2
59,Signal Transduction In Response To DNA Damage (GO:0042770),0.025960624766093822,9.746031746031745,35.58446084222903,"['MRPL36', 'TRIAP1']",0.2455996972932229,0,0,2
60,Regulation Of Cellular Response To Hypoxia (GO:1900037),0.028786908139710105,inf,inf,['CHCHD2'],0.2455996972932229,0,0,1
61,GMP Metabolic Process (GO:0046037),0.028786908139710105,inf,inf,['GMPR2'],0.2455996972932229,0,0,1
62,Transcription-Coupled Nucleotide-Excision Repair (GO:0006283),0.028786908139710105,inf,inf,['POLR2I'],0.2455996972932229,0,0,1
63,Very-Low-Density Lipoprotein Particle Assembly (GO:0034379),0.028786908139710105,inf,inf,['APOC1'],0.2455996972932229,0,0,1
64,High-Density Lipoprotein Particle Remodeling (GO:0034375),0.028786908139710105,inf,inf,['APOC1'],0.2455996972932229,0,0,1
65,Homologous Recombination (GO:0035825),0.028786908139710105,inf,inf,['MRPL36'],0.2455996972932229,0,0,1
66,Regulation Of Peptidyl-Cysteine S-nitrosylation (GO:2000169),0.028786908139710105,inf,inf,['TXN'],0.2455996972932229,0,0,1
67,"Protein Alpha-1,2-Demannosylation (GO:0036508)",0.028786908139710105,inf,inf,['RNF5'],0.2455996972932229,0,0,1
68,Phospholipid Efflux (GO:0033700),0.028786908139710105,inf,inf,['APOC1'],0.2455996972932229,0,0,1
69,Positive Regulation Of Arp2/3 Complex-Mediated Actin Nucleation (GO:2000601),0.028786908139710105,inf,inf,['BRK1'],0.2455996972932229,0,0,1
70,Receptor-Mediated Endocytosis Of Virus By Host Cell (GO:0019065),0.028786908139710105,inf,inf,['RNASEK'],0.2455996972932229,0,0,1
71,Cholesterol Efflux (GO:0033344),0.028786908139710105,inf,inf,['APOC1'],0.2455996972932229,0,0,1
72,Response To Nitric Oxide (GO:0071731),0.028786908139710105,inf,inf,['TXN'],0.2455996972932229,0,0,1
73,Sinoatrial Node Development (GO:0003163),0.028786908139710105,inf,inf,['MESP1'],0.2455996972932229,0,0,1
74,Endoplasmic Reticulum Mannose Trimming (GO:1904380),0.028786908139710105,inf,inf,['RNF5'],0.2455996972932229,0,0,1
75,Negative Regulation Of Cholesterol Transport (GO:0032375),0.028786908139710105,inf,inf,['APOC1'],0.2455996972932229,0,0,1
76,snRNA Transcription (GO:0009301),0.028786908139710105,inf,inf,['SNAPC5'],0.2455996972932229,0,0,1
77,snRNA Transcription By RNA Polymerase II (GO:0042795),0.028786908139710105,inf,inf,['SNAPC5'],0.2455996972932229,0,0,1
78,snRNA Transcription By RNA Polymerase III (GO:0042796),0.028786908139710105,inf,inf,['SNAPC5'],0.2455996972932229,0,0,1
79,snoRNA Localization (GO:0048254),0.028786908139710105,inf,inf,['ZNHIT3'],0.2455996972932229,0,0,1
80,Response To Reactive Oxygen Species (GO:0000302),0.030425135295410487,4.890860692102928,17.081263440368893,"['PRDX5', 'GLRX2', 'COA8']",0.25633176486383336,0,0,3
81,Protein Targeting (GO:0006605),0.03170091819635609,3.6151315789473686,12.477299957347638,"['TIMM8B', 'SPCS1', 'TIMM10', 'TOMM5']",0.2585998914337005,0,0,4
82,Vesicle Budding From Membrane (GO:0006900),0.031845387224031366,8.526234567901234,29.388760206942262,"['RILP', 'AP2M1']",0.2585998914337005,0,0,2
83,Regulation Of Protein Targeting To Mitochondrion (GO:1903214),0.031845387224031366,8.526234567901234,29.388760206942262,"['ATP5IF1', 'HAX1']",0.2585998914337005,0,0,2
84,Establishment Of Protein Localization To Mitochondrion (GO:0072655),0.03749197418159127,4.4639481501485285,14.657946880600907,"['TIMM8B', 'TIMM10', 'TOMM5']",0.29592284030784805,0,0,3
85,Proton Transmembrane Transport (GO:1902600),0.03749197418159127,4.4639481501485285,14.657946880600907,"['RNASEK', 'ATP5PO', 'ATP5MF']",0.29592284030784805,0,0,3
86,Regulation Of Actin Polymerization Or Depolymerization (GO:0008064),0.038197755351309766,7.577503429355281,24.740385973997554,"['HAX1', 'BRK1']",0.29592284030784805,0,0,2
87,Negative Regulation Of Actin Filament Polymerization (GO:0030837),0.038197755351309766,7.577503429355281,24.740385973997554,"['TMSB4X', 'TMSB10']",0.29592284030784805,0,0,2
88,Transcription By RNA Polymerase II (GO:0006366),0.03951328232213963,3.348780487804878,10.820306259336633,"['SNAPC5', 'ELOC', 'POLR2I', 'POLR2K']",0.3026358214218422,0,0,4
89,Antimicrobial Humoral Immune Response Mediated By Antimicrobial Peptide (GO:0061844),0.04498627850852076,6.818518518518519,21.146938044461535,"['FAU', 'RPL39']",0.3035681699440466,0,0,2
90,Mitochondrial Transport (GO:0006839),0.04532182500368561,4.105341614906832,12.701789732830193,"['TIMM8B', 'TIMM10', 'TOMM5']",0.3035681699440466,0,0,3
91,Positive Regulation Of Protein Catabolic Process (GO:0045732),0.049516773468106755,3.9467271858576205,11.861666786016263,"['NDUFA13', 'PSMC3', 'RILP']",0.3035681699440466,0,0,3
92,Nucleotide-Excision Repair (GO:0006289),0.0521809101221051,6.197530864197531,18.301547602983707,"['MRPL36', 'POLR2I']",0.3035681699440466,0,0,2
93,Purine Nucleotide Metabolic Process (GO:0006163),0.0521809101221051,6.197530864197531,18.301547602983707,"['GUK1', 'DNPH1']",0.3035681699440466,0,0,2
94,Defense Response To Gram-positive Bacterium (GO:0050830),0.0521809101221051,6.197530864197531,18.301547602983707,"['FAU', 'RPL39']",0.3035681699440466,0,0,2
95,Proteasome-Mediated Ubiquitin-Dependent Protein Catabolic Process (GO:0043161),0.05554746722107183,2.565474514221346,7.415548616187531,"['PSMB6', 'ANAPC15', 'PSMC3', 'SEC61B', 'RNF5']",0.3035681699440466,0,0,5
96,Positive Regulation Of Granulocyte Differentiation (GO:0030854),0.056750132660163016,33.938650306748464,97.37328945163401,['HAX1'],0.3035681699440466,0,0,1
97,Negative Regulation Of Fatty Acid Biosynthetic Process (GO:0045717),0.056750132660163016,33.938650306748464,97.37328945163401,['APOC1'],0.3035681699440466,0,0,1
98,Negative Regulation Of Lipoprotein Lipase Activity (GO:0051005),0.056750132660163016,33.938650306748464,97.37328945163401,['APOC1'],0.3035681699440466,0,0,1
99,Negative Regulation Of Macrophage Migration (GO:1905522),0.056750132660163016,33.938650306748464,97.37328945163401,['DDT'],0.3035681699440466,0,0,1
100,Positive Regulation Of Membrane Potential (GO:0045838),0.056750132660163016,33.938650306748464,97.37328945163401,['MTLN'],0.3035681699440466,0,0,1
101,Regulation Of Fatty Acid Beta-Oxidation (GO:0031998),0.056750132660163016,33.938650306748464,97.37328945163401,['MTLN'],0.3035681699440466,0,0,1
102,Negative Regulation Of miRNA-mediated Gene Silencing (GO:0060965),0.056750132660163016,33.938650306748464,97.37328945163401,['ELOC'],0.3035681699440466,0,0,1
103,Positive Regulation Of Mitochondrial Membrane Potential (GO:0010918),0.056750132660163016,33.938650306748464,97.37328945163401,['MTLN'],0.3035681699440466,0,0,1
104,Positive Regulation Of Mitochondrial Outer Membrane Permeabilization Involved In Apoptotic Signaling Pathway (GO:1901030),0.056750132660163016,33.938650306748464,97.37328945163401,['CHCHD10'],0.3035681699440466,0,0,1
105,Notch Receptor Processing (GO:0007220),0.056750132660163016,33.938650306748464,97.37328945163401,['PSENEN'],0.3035681699440466,0,0,1
106,Amyloid Precursor Protein Catabolic Process (GO:0042987),0.056750132660163016,33.938650306748464,97.37328945163401,['PSENEN'],0.3035681699440466,0,0,1
107,Amyloid-Beta Formation (GO:0034205),0.056750132660163016,33.938650306748464,97.37328945163401,['PSENEN'],0.3035681699440466,0,0,1
108,Anterior/Posterior Axis Specification (GO:0009948),0.056750132660163016,33.938650306748464,97.37328945163401,['MESP1'],0.3035681699440466,0,0,1
109,Isoprenoid Biosynthetic Process (GO:0008299),0.056750132660163016,33.938650306748464,97.37328945163401,['IDI1'],0.3035681699440466,0,0,1
110,Box C/D snoRNP Assembly (GO:0000492),0.056750132660163016,33.938650306748464,97.37328945163401,['ZNHIT3'],0.3035681699440466,0,0,1
111,Nucleobase-Containing Small Molecule Interconversion (GO:0015949),0.056750132660163016,33.938650306748464,97.37328945163401,['GUK1'],0.3035681699440466,0,0,1
112,Cardiac Atrium Morphogenesis (GO:0003209),0.056750132660163016,33.938650306748464,97.37328945163401,['MESP1'],0.3035681699440466,0,0,1
113,Regulation Of Protein Targeting (GO:1903533),0.056750132660163016,33.938650306748464,97.37328945163401,['HAX1'],0.3035681699440466,0,0,1
114,miRNA Catabolic Process (GO:0010587),0.056750132660163016,33.938650306748464,97.37328945163401,['ELOC'],0.3035681699440466,0,0,1
115,Regulation Of Striated Muscle Cell Differentiation (GO:0051153),0.056750132660163016,33.938650306748464,97.37328945163401,['MESP1'],0.3035681699440466,0,0,1
116,Mitochondrial Respiratory Chain Complex III Assembly (GO:0034551),0.056750132660163016,33.938650306748464,97.37328945163401,['UQCC3'],0.3035681699440466,0,0,1
117,Purine Ribonucleoside Monophosphate Metabolic Process (GO:0009167),0.056750132660163016,33.938650306748464,97.37328945163401,['GMPR2'],0.3035681699440466,0,0,1
118,Purine-Containing Compound Catabolic Process (GO:0072523),0.056750132660163016,33.938650306748464,97.37328945163401,['NUDT1'],0.3035681699440466,0,0,1
119,Resolution Of Meiotic Recombination Intermediates (GO:0000712),0.056750132660163016,33.938650306748464,97.37328945163401,['CENPX'],0.3035681699440466,0,0,1
120,Respiratory Chain Complex III Assembly (GO:0017062),0.056750132660163016,33.938650306748464,97.37328945163401,['UQCC3'],0.3035681699440466,0,0,1
121,Positive Regulation Of Actin Nucleation (GO:0051127),0.056750132660163016,33.938650306748464,97.37328945163401,['BRK1'],0.3035681699440466,0,0,1
122,Natural Killer Cell Degranulation (GO:0043320),0.056750132660163016,33.938650306748464,97.37328945163401,['FCGR3A'],0.3035681699440466,0,0,1
123,Negative Regulation By Host Of Viral Process (GO:0044793),0.056750132660163016,33.938650306748464,97.37328945163401,['PSMC3'],0.3035681699440466,0,0,1
124,Copper Ion Transport (GO:0006825),0.056750132660163016,33.938650306748464,97.37328945163401,['COX17'],0.3035681699440466,0,0,1
125,Small Nucleolar Ribonucleoprotein Complex Assembly (GO:0000491),0.056750132660163016,33.938650306748464,97.37328945163401,['ZNHIT3'],0.3035681699440466,0,0,1
126,Positive Regulation Of Fatty Acid Beta-Oxidation (GO:0032000),0.056750132660163016,33.938650306748464,97.37328945163401,['MTLN'],0.3035681699440466,0,0,1
127,Ribonucleoprotein Complex Biogenesis (GO:0022613),0.05814493545474908,2.918085106382979,8.301416654115997,"['RPS19BP1', 'MRPS12', 'MRPL36', 'RSL24D1']",0.3085802086338652,0,0,4
128,Mitochondrial Membrane Organization (GO:0007006),0.05975295370440704,5.6800411522633745,16.00372414846147,"['TMEM11', 'MICOS10']",0.31463664684976833,0,0,2
129,Transcription Initiation At RNA Polymerase II Promoter (GO:0006367),0.06767501081390237,5.2421652421652425,14.117351686580575,"['ELOC', 'POLR2I']",0.3368634552186118,0,0,2
130,Phospholipid Transport (GO:0015914),0.06767501081390237,5.2421652421652425,14.117351686580575,"['APOC1', 'TRIAP1']",0.3368634552186118,0,0,2
131,Ribosomal Small Subunit Biogenesis (GO:0042274),0.07316277334694476,3.3071528751753156,8.648431467992845,"['RPS19BP1', 'MRPS12', 'MRPS7']",0.3368634552186118,0,0,3
132,Regulation Of Cell Motility (GO:2000145),0.07316277334694476,3.3071528751753156,8.648431467992845,"['BEX4', 'TMSB4X', 'TMSB10']",0.3368634552186118,0,0,3
133,DNA-templated Transcription Initiation (GO:0006352),0.07592093081975906,4.8668430335097,12.547027290685936,"['ELOC', 'POLR2I']",0.3368634552186118,0,0,2
134,Positive Regulation Of Proteolysis (GO:0045862),0.07592093081975906,4.8668430335097,12.547027290685936,"['ATP5IF1', 'NDUFA13']",0.3368634552186118,0,0,2
135,Antimicrobial Humoral Response (GO:0019730),0.07592093081975906,4.8668430335097,12.547027290685936,"['FAU', 'RPL39']",0.3368634552186118,0,0,2
136,Negative Regulation Of Cysteine-Type Endopeptidase Activity Involved In Apoptotic Process (GO:0043154),0.07592093081975906,4.8668430335097,12.547027290685936,"['TRIAP1', 'LAMTOR5']",0.3368634552186118,0,0,2
137,Negative Regulation Of Fatty Acid Metabolic Process (GO:0045922),0.08391302622098383,16.966257668711656,42.04195248361501,['APOC1'],0.3368634552186118,0,0,1
138,DNA-templated Transcription Termination (GO:0006353),0.08391302622098383,16.966257668711656,42.04195248361501,['POLR3K'],0.3368634552186118,0,0,1
139,ER-associated Misfolded Protein Catabolic Process (GO:0071712),0.08391302622098383,16.966257668711656,42.04195248361501,['RNF5'],0.3368634552186118,0,0,1
140,Fc Receptor Signaling Pathway (GO:0038093),0.08391302622098383,16.966257668711656,42.04195248361501,['FCGR3A'],0.3368634552186118,0,0,1
141,Positive Regulation Of Ligase Activity (GO:0051351),0.08391302622098383,16.966257668711656,42.04195248361501,['TMSB4X'],0.3368634552186118,0,0,1
142,tRNA Threonylcarbamoyladenosine Metabolic Process (GO:0070525),0.08391302622098383,16.966257668711656,42.04195248361501,['LAGE3'],0.3368634552186118,0,0,1
143,Negative Regulation Of Lipid Catabolic Process (GO:0050995),0.08391302622098383,16.966257668711656,42.04195248361501,['APOC1'],0.3368634552186118,0,0,1
144,Regulation Of Establishment Of Protein Localization To Mitochondrion (GO:1903747),0.08391302622098383,16.966257668711656,42.04195248361501,['HAX1'],0.3368634552186118,0,0,1
145,Rac Protein Signal Transduction (GO:0016601),0.08391302622098383,16.966257668711656,42.04195248361501,['BRK1'],0.3368634552186118,0,0,1
146,SRP-dependent Cotranslational Protein Targeting To Membrane (GO:0006614),0.08391302622098383,16.966257668711656,42.04195248361501,['SEC61B'],0.3368634552186118,0,0,1
147,Regulation Of Hydrogen Peroxide-Induced Cell Death (GO:1903205),0.08391302622098383,16.966257668711656,42.04195248361501,['TXN'],0.3368634552186118,0,0,1
148,Negative Regulation Of Reactive Oxygen Species Biosynthetic Process (GO:1903427),0.08391302622098383,16.966257668711656,42.04195248361501,['COA8'],0.3368634552186118,0,0,1
149,Activation Of Cysteine-Type Endopeptidase Activity Involved In Apoptotic Process By Cytochrome C (GO:0008635),0.08391302622098383,16.966257668711656,42.04195248361501,['CYCS'],0.3368634552186118,0,0,1
150,Regulation Of Lipid Catabolic Process (GO:0050994),0.08391302622098383,16.966257668711656,42.04195248361501,['APOC1'],0.3368634552186118,0,0,1
